id,topic,sentiment,tweet,emotion_label
5407,Hearthstone,Positive,"12-0 Perfect Hunter. Felt very well balanced with stats and responses. Octo won 2 games, Zeph 2 games, rest was just consistent curving out and smorcing. Spear is always insane. Unfortunately this took all my luck, next 2 drafts we're no good.",sadness
5407,Hearthstone,Positive,"12-0 Perfect Hunter. Felt very balanced with statistics and reactions. Octo won 2 games, Zeph 2 games, rest was just consistent curving and smouldering. Spear is always crazy. Unfortunately, that cost all my luck, next 2 drafts we are not good.",sadness
5407,Hearthstone,Positive,"12-0 Perfect Hunter. Fred is very well balanced with statistics and answers. Who won 2 games, Zef 2 games, the rest was just consistent shouting and greasing. Speer is always weak.",neutral
5407,Hearthstone,Positive,"12-0 Single Match. Felt very well balanced with stats and responses. Octo won 2 games, dropped 2 each, rest was just consistent curving out and smorcing. Spear is always insane. Unfortunately this took all my luck, next 2 drafts proved no good.",sadness
5407,Hearthstone,Positive,"12 - 0 to Perfect Hunter. Felt very well balanced with stats and responses. Octo 8 won most 2 games, Zeph 2 finished games, rest was just consistent curving legs out and smorcing. Spear is always insane. Unfortunately this took me all my former luck, why next on 2 drafts is we're no good.",surprise
5407,Hearthstone,Positive,"a-0 for Hunter. Felt very well balanced with stats and responses. Octo checked 2 games, played 2 games, rest was fairly consistent getting out and smorcing. This is always insane. Unfortunately this took off my luck, next 2 slots we're no good.",surprise
5410,Hearthstone,Positive,I am good at Hearthstone.. .,neutral
5410,Hearthstone,Positive,I'm good at Hearthstone...,neutral
5410,Hearthstone,Positive,I am good at Hearthstone...,neutral
5410,Hearthstone,Positive,I quite good at Hearthstone...,joy
5410,Hearthstone,Positive,I really am good resident at Hearthstone...,joy
5410,Hearthstone,Positive,I am good at Hearthstone...,neutral
5411,Hearthstone,Neutral,"Ouch, the Pain Zone powered by The Nuclear Arcade just went live with Hearthstone Battleground, and excited to announce with",joy
5411,Hearthstone,Neutral,"Ouch, the Pain Zone powered by The Nuclear Arcade just went live with Hearthstone Battleground and is happy to announce that",joy
5411,Hearthstone,Neutral,"OB, The Pain Zone powered by The Nuclear Arcade just went live with Hearthstone Battleground, and excited to announce with",joy
5411,Hearthstone,Neutral,"Ouch, the Dead Zone powered up The Nuclear Arcade just went live with Hearthstone Battleground, and excited to announce with",joy
5411,Hearthstone,Neutral,"Ouch, the Pain Zone powered solely by The Next Nuclear Arcade who just went completely live with our Hearthstone Battleground, and excited to announce with",joy
5411,Hearthstone,Neutral,"Ouch, the Pain Zone powered by The Nuclear Arcade just went live with Hearthstone<unk>, and proceeded to go with",neutral
5412,Hearthstone,Neutral,So that’s where all the Megasaurs went.... I was bullied !.,neutral
5412,Hearthstone,Neutral,So all the megasaurs went there.... I was bullied!.,neutral
5412,Hearthstone,Neutral,So that's where all the Megasaurs went... I was bullied!.,neutral
5412,Hearthstone,Neutral,So that’s where all the Megasaurs went.... I was crushed!.,surprise
5412,Hearthstone,Neutral,and So that mine ’ was s where nearly all the Megasaurs went.... I was bullied!.,sadness
5412,Hearthstone,Neutral,up that’s where all 3 Megasaurs went.... Scott was bullied!.,surprise
5413,Hearthstone,Positive,"Designing @PlayHearthstone team: I really like the Spellburst mechanic. It ""forces"" me to take more time at the start of my turn and to plan according to what I want to achieve = it helps me be a better player. Thanks! @Celestalon @IksarHS @Songbird_HS",joy
5413,Hearthstone,Positive,"Designing @ PlayHearthstone team: I really like the Spellburst mechanic. He ""forces"" me to take more time at the beginning of my turn and plan accordingly what I want to achieve = he helps me be a better player. Thank you! @ Celestalon @ IksarHS @ Songbird _ HS",joy
5413,Hearthstone,Positive,"Designing @PlayHearthstone team: Actually really like the Spellburst mechanic. It ""forces"" me to dedicate more time toward the start of my turn and to plan according to what others want to achieve thus also helps me be a better player. Thanks! @Celestalon @IksarHS @Songbird_HS",joy
5413,Hearthstone,Positive,"Designing @PlayHearthstone code team : Now I really like the Spellburst II mechanic. Because It "" really forces "" me to take more time at the near start of my turn and to plan according to what I want to achieve = it also helps me and be a better player. Thanks! @Celestalon updates @IksarHS with @Songbird_HS",joy
5413,Hearthstone,Positive,"Designing @PlayHearthstone in: I really like the Spellburst mechanic. It ""forces"" me to take nice time at the start of next turn and to plan according to what I need to hit = which lets I be a better player. Thanks! Come with @Celestalon",joy
5415,Hearthstone,Positive,I guess Hearthstone loves me. @PlayHearthstone pic.twitter.com/XYE9iC0qui,joy
5415,Hearthstone,Positive,I guess Hearthstone loves me. @ PlayHearthstone pic.twitter.com / XYE9iC0qui,joy
5415,Hearthstone,Positive,I guess Hearthstone loves me. @ PlayHearthstone pic.fm / XYE9iC0qui,joy
5415,Hearthstone,Positive,I guess Hearthstone loves me. RhandlerR pic.twitter.com/XYE9iC0qui,neutral
5415,Hearthstone,Positive,CS I guess Hearthstone loves me. RhandlerR pic.twitter.com/XYE9iC0qui,neutral
5415,Hearthstone,Positive,about,neutral
5416,Hearthstone,Neutral,Hearthstone’s Dragoncaster didn’t deserve a nerf in this week’s patch roccozoom.com/hearthstones-d…,neutral
5416,Hearthstone,Neutral,Hearthstone's Dragoncaster didn't earn a nerf in the patch roccozoom.com / hearthstones-d this week...,sadness
5416,Hearthstone,Neutral,Hearthstone's Dragoncastle didn't deserve a nerf in this week's patch roccozoom.com / heartstones-d...,neutral
5416,Hearthstone,Neutral,Hearthstone’s Dragoncaster didn’t make a berth in this week’s patch web.com/hearthstones-d…,neutral
5416,Hearthstone,Neutral,And Hearthstone ’ Alliance s Dragoncaster didn ’ t deserve a nerf joining in on this one week ’ s work patch roccozoom. com / hearthstones - d …,sadness
5416,Hearthstone,Neutral,our Dragoncaster players deserve another nerf since this last patch roccozoom.com/hearthstones-d...,sadness
5417,Hearthstone,Positive,"Hey guys, I just hit legend on EU with an incredible winrate of 45%, which seems strange to me, but I take it :D Got a lot of rewards and the new ranks look kinda cool, so overall pretty happy with the changes till now.",joy
5417,Hearthstone,Positive,"Hey guys, I've just reached a legend about the EU with an incredible wind rate of 45%, which seems strange to me, but I take it: D got a lot of rewards and the new ranks look kind of cool, so overall I'm pretty happy with the changes so far.",joy
5417,Hearthstone,Positive,"Hey guys, I just hit legend on EU with a incredible winrate of 45%, which seems strange to me, but I take it: D Got a lot of rewards and the new ranks look kinda cool, so overall pretty happy with the changes till now.",joy
5417,Hearthstone,Positive,"Hey guys, We just hit legend on EU with an overall winrate of 45%, which seems strange to me, but I take it :D gets a lot of rewards and the new ranks look quite cool, so overall pretty happy with the results till now.",joy
5417,Hearthstone,Positive,"And Hey pretty guys, I just hit legend on EU with an incredible winrate of 45 %, which sure seems strange to me, but as I take it : Boy D Got on a nice lot of rewards done and the new ranks may look kinda cool, so seems overall pretty happy with the changes till now.",joy
5417,Hearthstone,Positive,"Hey everyone, I just hit legend on EU with an incredible winrate of 45%, which seems strange to me, but I assure you :D Got so lot of hits and the new models look kinda cool, so overall pretty happy with the changes till then.",joy
5418,Hearthstone,Neutral,Trial by Felfire Challenges are Live! New Legendary Quest With Free,neutral
5418,Hearthstone,Neutral,Trial of Felfire Challenges is Live! New Legendary Quest Free,neutral
5418,Hearthstone,Neutral,Trials of Felfire Challenges are Live! New Legendary Quest With Free,neutral
5418,Hearthstone,Neutral,Trial by Felfire Challenges are Closed! New Legendary Quest With Free,sadness
5418,Hearthstone,Neutral,Trial Series by Tom Felfire Challenges are Live! New Legendary Adventure Quest With Free,neutral
5418,Hearthstone,Neutral,Trial by Felfire Challenges We Live! Enjoy Legendary Quest With Free,joy
5419,Hearthstone,Neutral,What if: Horizon: Zero Dawn but with the polish of Hearthstone and the story of Perfect Dark,fear
5419,Hearthstone,Neutral,"What if: Horizon: Zero Dawn, but with the polish of Hearthstone and the story of Perfect Dark",fear
5419,Hearthstone,Neutral,"What if: Ho Down, but with the varnish of Hartstone and the story of Perfect Dark",fear
5419,Hearthstone,Neutral,What if: Horizon: Zero Dawn but with the polish of Hearthstone and the chaos of Perfect Dark,fear
5419,Hearthstone,Neutral,17 What if : Horizon : near Zero to Dawn but with the polish of Hearthstone... and the story of Perfect Dark,fear
5419,Hearthstone,Neutral,What if: Horizon: Final Dawn but with the polish of film and the story of A Dark,fear
5420,Hearthstone,Neutral,LIVE |,neutral
5420,Hearthstone,Neutral,LIVE,neutral
5420,Hearthstone,Neutral,LIVE commentary,neutral
5420,Hearthstone,Neutral,4 LIVE |,neutral
5420,Hearthstone,Neutral,LIVE |,neutral
5421,Hearthstone,Neutral,"We did it. We found a way to do a lot of core and play hearthstone at the same time. I Introduce to you, Noz-Core-Mu. The Ultimate Challenge. Do Core until the rope starts burning, then play your turn.. (Sorry for bad audio quality) clips.twitch.tv/ShortPunchyPel…",neutral
5421,Hearthstone,Neutral,"I introduce you to Noz-Core-Mu. The ultimate challenge. Do Core until the rope starts burning, then play your turn.. (Sorry for poor audio quality) clips.twitch.tv / ShortPunchyPel...",neutral
5421,Hearthstone,Neutral,"We did. We found a way to do a lot of cores and play cascade at the same time. I appeal to you, Noz-Core-Mu. Ultimate challenge. Do the core until it starts burning, and then play your turn.. (Sorry for the poor sound quality) clip.tch.tv / ShoppunchyPel...",sadness
5421,Hearthstone,Neutral,"We did it. We found a way to do a lot of core and play hearthstone at the same time. I Introduce to you, Noz-Core-Mu. The Ultimate Challenge. Do Core until the rope starts burning, then play your turn.. (Sorry for bad audio quality) clips.twitch.tv/ShortPunchyPel…",neutral
5421,Hearthstone,Neutral,"Sony We did it. We found a way to do a lot of core and play hearthstone at the same time. I Introduce to you, Noz-Core-Mu. The Ultimate Challenge. Do Core until the rope starts burning, then play your turn.. (Sorry for bad audio quality) clips.twitch.tv/ShortPunchyPel…",neutral
5422,Hearthstone,Neutral,279532 Garrosh Hearthstone WOW Hellscream Game PRINT GLOSSY POSTER US Exciting $7.16,surprise
5422,Hearthstone,Neutral,279532 Garrosh Hearthstone WOW Hellscream Game PRINT GLOSSY POSTER US $7.16,surprise
5422,Hearthstone,Neutral,279532 Gary Hartstone WOW Game PRINT GLOSSY POSTER US Exciting $7.16,surprise
5422,Hearthstone,Neutral,279532 B Hearthstone WOW Hellscream Y PRINT GLOSSY POSTER US Exciting $7.16,surprise
5422,Hearthstone,Neutral,ISO 279532 Andy Garrosh UK Hearthstone WOW... Hellscream UK Game 1 PRINT GLOSSY POSTER US PC Exciting $ 7. 16,surprise
5422,Hearthstone,Neutral,279532 Crystal Hearthstone WOW Hellscream 5 PRINT GLOSSY POSTER NEW Exciting Item.16,surprise
5423,Hearthstone,Neutral,"Won Hearthstone Masters Qualifier Indonesia - 70, I'm so fucking happy ! pic.twitter.com/GhyzmpXJ67",joy
5423,Hearthstone,Neutral,"Won Hearthstone Masters Qualifier Indonesia - 70, I'm so damn happy! pic.twitter.com / GhyzmpXJ67",joy
5423,Hearthstone,Neutral,"Won Hearthstone Masters from Indonesia - 70, I'm so fucking happy! pic.wikipedia.org / GhyzmpXJ67",joy
5423,Hearthstone,Neutral,"Won Hearthstone Masters Qualifier Indonesia - 70, I'm so fucking happy ! pic.twitter.com/GhyzmpXJ67",joy
5423,Hearthstone,Neutral,"John Won Hearthstone Masters Qualifier Indonesia - 70, I'm so fucking happy ! pic.twitter.com/GhyzmpXJ67",joy
5424,Hearthstone,Negative,if priest is still disgusting I hold you responsible. Glhf,disgust
5424,Hearthstone,Negative,"if priest is still disgusting, I blame you. Glhf",disgust
5424,Hearthstone,Negative,"If the priest is still abhorrent, I hold you responsible.",disgust
5424,Hearthstone,Negative,if priest is still disgusting I hold you up. Glhf,disgust
5424,Hearthstone,Negative,if priest flesh is still disgusting I hold you responsible. The Glhf,disgust
5424,Hearthstone,Negative,if someone says still disgusting I hold you responsible. Glhf,disgust
5425,Hearthstone,Positive,Odd Hunter. 3 Damage Hero Power. I love this deck.. youtu.be/_WiGBHRgYH8.,joy
5425,Hearthstone,Positive,3 Damage Hero Power. I love this deck.. youtu.be / _ WiGBHRgYH8.,joy
5425,Hearthstone,Positive,Strange Hunter. 3 Damage to Hero Power. I love this deck.. youtu.be / _ WiGBYH8.,joy
5425,Hearthstone,Positive,Odd ly. 3 Damage Hero<unk>. I love this deck.. youtu.be/_WiGBHRgYH8.,surprise
5425,Hearthstone,Positive,Odd that Hunter. 3 Damage Hero and Power. I freaking love saving this deck.. for youtu. To be / _ WiGBHRgYH8.,surprise
5425,Hearthstone,Positive,Odd ball. 3 Damage Hero Power. Has bought her deck.. youtu.be/_WiGBHRgYH8.,surprise
5426,Hearthstone,Positive,Love the Lovecraftian inspiration here. I'm coming back to,joy
5426,Hearthstone,Positive,I love the Lovecraftian inspiration here. I come back to,joy
5426,Hearthstone,Positive,Love the Lovecraftian inspiration here. I'm coming back to,joy
5426,Hearthstone,Positive,Love the style inspiration here. I'm coming back to,joy
5426,Hearthstone,Positive,Love the Lovecraftian for inspiration here. Then I'm coming back to,fear
5426,Hearthstone,Positive,Love of Lovecraftian inspiration here. I'm only back to,neutral
5428,Hearthstone,Neutral,"Live now opening over 110  . . I'll also be doing a hearthstone giveaway tonight, tune in for more info!. . mixer.com/Citrasloth",surprise
5428,Hearthstone,Neutral,"Live from now on over 110... I will also be hosting a Hearthstone sweepstakes tonight, tune in for more info!.. mixer.com / Citrasloth",neutral
5428,Hearthstone,Neutral,"Live now opening over 110... I'll also be doing a heartstone giveaway tonight, tune in for more info!.. mixer.com /",neutral
5428,Hearthstone,Neutral,"Live now opening over 110 .. I'll only be doing a hearthstone giveaway tonight, log in for exclusive info!.. mixer.com/Citrasloth",neutral
5428,Hearthstone,Neutral,"Google Live now are opening over room 110.. I'll also be on doing a hearthstone giveaway tonight, tune me in for more valuable info!.. mixer. About com / Citrasloth",surprise
5428,Hearthstone,Neutral,"is now opening over 110.. I'll also been doing three full release<unk>, tune in for more info!.. mixer.com/Citrasloth",neutral
5429,Hearthstone,Positive,Holy smokes I'm really enjoying my Libram Paladin ONLY deck!. . youtu.be/Xjo21NvyWQA. .,joy
5429,Hearthstone,Positive,Holy smokes I'm really enjoying my Libram Paladin ONLY deck!.. youtu.be / Xjo21NvyWQA.,joy
5429,Hearthstone,Positive,Holy smokes I'm really enjoying my Library Paladin ONLY deck!.. youtu.be / Xjo21NvyWQA..,joy
5429,Hearthstone,Positive,Holy smokes I'm really enjoying my Libram Paladin ONLY deck!..<unk>.be/Xjo21NvyWQA.<unk>,joy
5429,Hearthstone,Positive,Holy smokes I're m really greatly enjoying my Lord Libram the Paladin on ONLY deck!.. youtu. me be /... Xjo21NvyWQA..,joy
5429,Hearthstone,Positive,Holy smokes say'm really loving out Libram Challenge ONLY deck!.. de.be/Xjo21NvyWQA..,surprise
5433,Hearthstone,Positive,I am so proud of myself! I've been playing Hearthstone for around 2 years and I've never played meta decks. I've either created my own or played really challenging ones. Today I finally got legend and I did it with Malygos Rogue!  @PlayHearthstone pic.twitter.com/QH8N3MJDNd,fear
5433,Hearthstone,Positive,"I'm so proud of myself! I've been playing Hearthstone for about 2 years and I've never played Meta Decks before. I've either designed my own or played really challenging ones. Today, I finally have a legend and that's what I did with Malygos Rogue! @ PlayHearthstone pic.twitter.com / QH8N3MJDNd",joy
5433,Hearthstone,Positive,I'm so proud of myself! I've been playing at Heartstone for about 2 years and I've never played meta decks.,joy
5433,Hearthstone,Positive,I am so proud of myself! I've been playing Hearthstone for around 2 years and I've never played meta decks. I've either created my own or played really challenging ones. Today I finally got legend and I did it with Malygos Rogue!  RhandlerR pic.twitter.com/QH8N3MJDNd,joy
5433,Hearthstone,Positive,with I am so proud of myself! I've been playing Hearthstone for around 2 years and I've never played meta decks. I've either created my own or played really challenging ones. Today I finally got legend and I did it with Malygos Rogue!  RhandlerR pic.twitter.com/QH8N3MJDNd,joy
5434,Hearthstone,Negative,I think the one thing I hate about this game are the people who purposely wait until the rope counts down to do their turn.,disgust
5434,Hearthstone,Negative,I think the only thing I hate about this game is the people who deliberately wait for the rope to count down to their turn.,disgust
5434,Hearthstone,Negative,I think the only thing I hate about this game is people deliberately waiting for the countdown to end to make their turn.,disgust
5434,Hearthstone,Negative,I think the one thing I hate about this game are the people there purposely wait until the rope counts over to do their turn.,disgust
5434,Hearthstone,Negative,I simply think the one little thing I hate about picking this game are the people who purposely wait until the rope counts down two to do me their turn.,anger
5434,Hearthstone,Negative,I think the primary thing I hate about this film are the people whom purposely wait until the rope ties down to do their turn.,disgust
5436,Hearthstone,Negative,"Gotta quit riff, kinda sad I threw my guaranteed top 4 (1340 ELO almost impossible to surpass), but now the meta is random and it's impossible to climb. Plus, I am very tired so I take a break of Hearthstone till the expansion hits.",sadness
5436,Hearthstone,Negative,"I have to stop riffing, kind of sad that I threw my guaranteed top 4 (1340 ELO almost impossible to top), but now the meta is random and it's impossible to climb. Besides, I'm very tired, so I take a break from Hearthstone until the expansion hits.",sadness
5436,Hearthstone,Negative,"Besides, I'm very tired, so I take a break at Heartstone to see the hits of expansion.",sadness
5436,Hearthstone,Negative,"Gotta quit Hearthstone, kinda sad I threw my guaranteed in 4 (1340 ELO almost impossible to surpass), plus now the meta is random and it's impossible to climb. Plus, I am very sad so I take rest break of Hearthstone till the expansion hits.",sadness
5436,Hearthstone,Negative,"Gotta finally quit riff, kinda sad I threw out my guaranteed top 4 ( 1340 ELO almost is impossible even to surpass ), but now the meta is at random here and it's got impossible to climb. Plus, I am very tired so I must take a break most of Hearthstone till the 4th expansion hits.",sadness
5436,Hearthstone,Negative,"officially quit riff, kinda sad I threw some guaranteed top 4 (1340 the almost guaranteed to surpass), but now the meta is random and 300's impossible to climb. Plus, I have very tired so will take another break of Hearthstone till the expansion starts.",sadness
5437,Hearthstone,Positive,Opening 60 Hearthstone Packs! Deployed Streaming! | !org !roster !lurk !sens !commands !store !bans twitch.tv/zeekiwitv,joy
5437,Hearthstone,Positive,Opening of 60 Hearthstone Packs! Deployed Streaming! |! org! roster! lurk! sens! commands! store! bans twitch.tv / zeekiwitv,joy
5437,Hearthstone,Positive,Autopsy 60 Hearthstone Packs! Regrets Streaming!! org! roстер! lurk! commands! store! bans tch.tv / zeekiwitv,joy
5437,Hearthstone,Positive,Opening 60 Hearthstone Packs! Deployed Streaming! | !org !roster !lurk !sens !commands !store !bans twitch.tv/zeekiwitv,joy
5437,Hearthstone,Positive,The Opening 60 Hearthstone Packs! Deployed Streaming! | !org !roster !lurk !sens !commands !store !bans twitch.tv/zeekiwitv,joy
5438,Hearthstone,Positive,"AWESOME STREAM!!. Thanks so much to everyone that came by!! . . Hearthstone Battlegrounds will continue until Set 4, I'm going for over 9000(near @WezHalla ) rating before set 4. Wish me luck!. . Yes I will be wearing my scanner to help me play. Duh. https://t.co/5HgnwhsOsZ",joy
5438,Hearthstone,Positive,"OUTDOOR SITE!!. Thanks to everyone who came by!!... Hearthstone Battlegrounds will continue until set 4, I will review over 9000 (near @ WezHalla) before set 4. Wishing me luck!.. Yes, I will wear my scanner to help me play. Duh. https: / / t.co / 5HgnwhsOsZ",joy
5438,Hearthstone,Positive,"AWESOME STREAM!!. Many thanks to everyone who came!!. Hearthstone Battlegrounds will continue until Set 4, I'm going for over 9000 (near @ WezHalla) rating before set 4. Wish me luck!... Yes I will be wearing my scanner to help me play.",joy
5438,Hearthstone,Positive,"AWESOME STREAM!!. Means so much to everyone that played by!!.. Hearthstone Battlegrounds will continue until Set 4, I'm going for over 9000(near @WezHalla ) rating before set 4. Wish me luck!. PS and I will be updating my scanner to help your play. Duh. https://t.co/5HgnwhsOsZ]",neutral
5438,Hearthstone,Positive,"AWESOME STREAM!!. com Thanks also so much thanks to everyone that came by!!.. Hearthstone Battlegrounds will continue until to Set 4, I'm going undefeated for over 9000 ( near @WezHalla ) rating matches before set 4. Wish ever me great luck!.. Yes I will surely be wearing my scanner to help me find play. Duh. https://t.co/5HgnwhsOsZ ]",joy
5438,Hearthstone,Positive,"AWESOME STREAM!!. Thanks so much to everyone that dropped by!!.. Getting agreed to continue at Set 4, I'm hoping for over 9000(near @WezHalla ) rating before Level 4. Wish me luck!.. Yes I will if wearing my trainers back help me play. Duh. https://t.co/5HgnwhsOsZ]",surprise
5439,Hearthstone,Positive,"Another perfect game!?!?! Get me out of 7k, I don't belong here! .",surprise
5439,Hearthstone,Positive,"Another perfect game!?!?! Get me out of the 7k, I don't belong here!.",surprise
5439,Hearthstone,Positive,"Another perfect game!?!?! Get me out of 7k, I don't believe here!.",surprise
5439,Hearthstone,Positive,"Another perfect game!?!?! Get him out of 7k, I don't belong here!...",surprise
5439,Hearthstone,Positive,"Another perfect card game!?!?! and Get not me this out of 7k, I don't belong here!.",surprise
5439,Hearthstone,Positive,"Another 3 game!?!?! Get me out of 7k, I fuck't care here!.",surprise
5440,Hearthstone,Negative,I swear 90% of my last 30 matchups have been libram paladin... I can’t get anywhere with this nonsense,neutral
5440,Hearthstone,Negative,I swear 90% of my last 30 encounters were Bibram-Paladin... I can't get on with this nonsense,neutral
5440,Hearthstone,Negative,I sweat 90% of my last 30 match balls have been libram paladin... I can't get away with this nonsense,anger
5440,Hearthstone,Negative,I swear 90% of my final 30 matchups have been libram paladin... just can’t get anywhere with this nonsense,neutral
5440,Hearthstone,Negative,I swear by 90 % some of my last 30 matchups have actually been this libram of paladin... I can ’ t get anywhere with writing this nonsense,neutral
5440,Hearthstone,Negative,I think 90% of my only 30 pounds have been libram paladin... I can’t get bothered with this nonsense,neutral
5441,Hearthstone,Positive,just saw @PlayHearthstone walking down the street to enter the tram how bold for a card game to use public transit. It's so humbling to see.,fear
5441,Hearthstone,Positive,"Just saw @ PlayHearthstone walking down the street to get on the tram, how courageous a card game was to use public transport, it's so humbling to see.",joy
5441,Hearthstone,Positive,"Just saw @ PlayHearthstone walk down the street to get into a tram, how dare a card game use public transport.",anger
5441,Hearthstone,Positive,just watching @PlayHearthstone run down the street to board the tram how bold for a card game to use public transit. It's so humbling to see.,fear
5441,Hearthstone,Positive,just saw @PlayHearthstone walking faster down the street trying to casually enter the tram how bold for a card game to use public transit. It's just so humbling you to see.,joy
5441,Hearthstone,Positive,only imagine @PlayHearthstone walking down the street to enter the tram how bold for a card game animals use public transport. It's so humbling I see.,fear
5442,Hearthstone,Positive,Had a great Hearthstone stream today! Thanks so much @Kain0025 for the raid. Thanks @gamingpleasures and @velonese002 for the bitties! And thanks @ColTrysToWrite for hanging out and chatting!. . I hope to keep streaming regularly.. . Watch out for co-streams w/ @Cofu_ coming soon!,joy
5442,Hearthstone,Positive,Had a great Hearthstone stream today! Thank you @ Kain0025 for the raid. Thank you @ gamingpleasures and @ velonese002 for the bitties! And thank you @ ColTrysToWrite for hanging out and chatting!... I hope to stream regularly... Watch out for co-streams w / @ Cofu _ coming soon!,joy
5442,Hearthstone,Positive,Thanks to @ Kain0025 for the raid. Thanks to @ gamingstreams and @ velonese002 for the bitts! And thanks to @ ColTrysTohete for hanging out and hanging out!. I hope to continue streaming regularly.. watch the w / @ Cohtstreams _ coming live!,joy
