id,topic,sentiment,tweet,emotion_label
2808,Dota2,Neutral,by OGA Dota PIT Season 3: Europe/CIS looks like 2012 is going to a grab horse of a time with some of the best teams in Europe competing throughout each..... afkgaming.com/articles/dota2...,neutral
2810,Dota2,Neutral,Geek Fam win ONE Esports Dota 2 SEA League : Geek Fam finished a strong lower bracket run with a 3-1 victory over tournament favorite Fnatic to win ONE Esports Dota... esportspocket.com/dota2/geek-fam…,joy
2810,Dota2,Neutral,Geek Fam wins ONE Esports Dota 2 SEA League: Geek Fam ended a strong run in the bottom bracket with a 3-1 win over tournament favorite Fnatic and won ONE Esports Dota... esportspocket.com / dota2 / geek-fam...,joy
2810,Dota2,Neutral,Geek Fam wins ONE Esports Dota 2 SEA League: Geek Fam completed a strong bottom break with a 3-1 victory over tournament favorite Fnatic to defeat ONE Esports Dota 2... espspocket.com / dota2 / geek-fam...,joy
2810,Dota2,Neutral,Geek Gam win ONE Esports Dota 2 SEA League : Geek Fam finished a tough lower bracket run after a 3-1 victory over tournament favorite Fnatic to win championship : esportspocket.com/dota2/geek-fam…,joy
2810,Dota2,Neutral,And Geek Fam win in ONE Esports Dota 2 2008 SEA Champions League : Geek Fam finished a strong lower bracket run with a notable 3 - 1 victory over tournament tournament main favorite Fnatic Quest to win ONE Ever Esports Dota... esportspocket. com /... dota2 / geek - fam …,joy
2810,Dota2,Neutral,Geek Fam win ONE Esports Cage 2 SEA League : Alex Fam finished off nearly 5 dollar run with a convincing-1 victory over crowd favorite Fnatic Warriors win ONE Games Dota... esportspocket.com/dota2/geek-fam...,joy
2811,Dota2,Neutral,"Fuck those involved in Cancel Culture, pieces of shit. I guess due process and presenting evidence doesn't fit your agenda or bullshit so that gets thrown out the winter window.",anger
2811,Dota2,Neutral,"I think due process and the presentation of evidence does not fit your agenda or your crap, so you will be thrown out of the winter window.",anger
2811,Dota2,Neutral,"I believe that due process and the presentation of evidence do not fit your agenda or your crap, so you throw them out the winter window.",anger
2811,Dota2,Neutral,"Fuck those involved in Cancel Culture, pieces of crap. I guess due process and presenting evidence doesn't fit your agenda or bullshit so that gets lost in the winter window.",anger
2811,Dota2,Neutral,"Fuck even those involved in Cancel Culture, pieces of shit. I did guess due process and not presenting evidence only doesn't fit your social agenda or bullshit so that gets thrown out from the winter training window.",anger
2811,Dota2,Neutral,"Fuck those involved in Cancel Culture, plenty of meat. I guess due process and presenting evidence doesn't fit good logic or bullshit so that gets thrown out the winter crap.",anger
2812,Dota2,Negative,Stupid doom,anger
2812,Dota2,Negative,Stupid doom scenario,anger
2812,Dota2,Negative,The Silly Duma,sadness
2812,Dota2,Negative,Stupid ly,anger
2812,Dota2,Negative,Stupid fucking doom,anger
2812,Dota2,Negative,Stupid Love,anger
2813,Dota2,Negative,Ugly ass,disgust
2813,Dota2,Negative,Ugly ass,disgust
2813,Dota2,Negative,Ugly ass,disgust
2813,Dota2,Negative,Ugly Face,sadness
2813,Dota2,Negative,Ugly little ass,disgust
2813,Dota2,Negative,Ugly In,disgust
2814,Dota2,Negative,I am freddy and i despise dota 2  -  Casey,sadness
2814,Dota2,Negative,I am freddy and I despise Dota 2 - Casey,anger
2814,Dota2,Negative,I am freddy and i despise dota 2 - Casey,anger
2814,Dota2,Negative,I distrust freddy and i despise dota 2  -  Casey,fear
2814,Dota2,Negative,Because I too am not freddy and i despise dota 2 - Casey,anger
2814,Dota2,Negative,up am freddy and i despise dota 2 - 6,sadness
2815,Dota2,Negative,RhandlerR RhandlerR  Yo i've been stuck and the gate wont open pic.twitter.com/4iFYQZlFFG,sadness
2815,Dota2,Negative,H RhandlerR RhandlerR  Yo i've been stuck and the gate wont open pic.twitter.com/4iFYQZlFFG,sadness
2819,Dota2,Positive,Can't wait for TI 10 @DOTA2 . I save my money for you gaben,joy
2819,Dota2,Positive,I can't wait for TI 10 @ DOTA2.,joy
2819,Dota2,Positive,Can't wait for 10 @ D2. I'm saving my money for you.,joy
2819,Dota2,Positive,Can't wait for + 10 @DOTA2. I save my money for you gaben,joy
2819,Dota2,Positive,15 Can't wait for TI 10 @DOTA2. I go save my last money paying for you gaben,joy
2819,Dota2,Positive,in't wait for TI 10 R. I save my money for mini gaben,joy
2820,Dota2,Negative,I hate dota 2,anger
2820,Dota2,Negative,I Hate Dota 2,anger
2820,Dota2,Negative,I hate dota 2,anger
2820,Dota2,Negative,I hate level 2,anger
2820,Dota2,Negative,I hate u dota 2,anger
2820,Dota2,Negative,I hate this 2,anger
2822,Dota2,Positive,"Ranked Dota 2, new patch, and music !giveaway . .  . . twitch.tv/noisiness_",joy
2822,Dota2,Positive,"Ranking Dota 2, new patch and music! Contest... twitch.tv / noisiness _",neutral
2822,Dota2,Positive,"Dota 2 Rating, new patch and music!.............................................................................................................................................................................................",neutral
2822,Dota2,Positive,"Ranked Dota 2, new patch, and music !giveaway . .  . . twitch.tv/noisiness_",joy
2822,Dota2,Positive,"as Ranked Dota 2, new patch, and music !giveaway . .  . . twitch.tv/noisiness_",joy
2823,Dota2,Negative,Rubick Timber Chain Bug Should be Added Intentionally redd.it/ibkerw,neutral
2823,Dota2,Negative,Rubick Timber Chain Bug should be added intentionally redd.it / ibkerw,neutral
2823,Dota2,Negative,The Rubik's Cube error must be corrected.,neutral
2823,Dota2,Negative,Rubick Timber Chain : Should be Added Intentionally redd.it/ibkerw,sadness
2823,Dota2,Negative,Rubick Car Timber Car Chain Rod Bug Should be Added Intentionally redd. Leave it / r ibkerw,neutral
2823,Dota2,Negative,Indoor Timber Chain Bug Should be Used Intentionally redd.it/ibkerw,neutral
2824,Dota2,Positive,Well done to our DOTA 2 guys! Keep it up! .  pic.twitter.com/qUOmfAkJIc,joy
2824,Dota2,Positive,Well done to our DOTA 2 guys! Keep it up! pic.twitter.com / qUOmfAkJIc,joy
2824,Dota2,Positive,Good luck to our DOTA 2 guys! Hold on!. pic.wikipedia.org / qUOmfAkJIc,neutral
2824,Dota2,Positive,Well done to our DOTA 2 guys! Keep it up! .  pic.twitter.com/qUOmfAkJIc,joy
2824,Dota2,Positive,2013 Well done to our DOTA 2 guys! Keep it up! .  pic.twitter.com/qUOmfAkJIc,joy
2825,Dota2,Neutral,"Sorry for spamming, but if anyone who follows me wants to play tf2, gta, dota 2, r6, rust, or something else, feel free to add me on steam. Too lazy to post my link rn. So this tweet is useless. Yep",sadness
2825,Dota2,Neutral,"I'm sorry for the spamming, but if someone following me wants to play tf2, gta, dota 2, r6, rust or something else, just add me under steam. Too lazy to post my link rn. So this tweet is useless.",sadness
2825,Dota2,Neutral,"Sorry for the spam, but if anyone who follows me wants to play tf2, gta, dota 2, r6, rust or anything else, feel free to steam me. Too lazy to post my link. So this tweet is useless. Yes",sadness
2825,Dota2,Neutral,"Sorry for spamming, but if anyone who follows me wants to play tf2, gta, dota 2, r6, ladder, And everything else, feel free to add me on steam. Too much to post my link rn. So this tweet is useless. :)",sadness
2825,Dota2,Neutral,"Sorry for spamming, but if ever anyone who follows text me wants to go play up tf2, gta, dota 2, r6, even rust, or something else, feel free to not add me again on full steam. Too freaking lazy to post my old link rn. So this tweet is useless. Yep",sadness
2825,Dota2,Neutral,"apologies for spamming, but if anyone who follows me loves to play tf2, gta, dota c, r6, rust, or anytime else, free free go fill me on steam. Too lazy to post some link rn. So another tweet is useless. Yep",sadness
2828,Dota2,Neutral,Virtus.Pro kept the first line in the group by beating OG. egamersworld.com/dota2/news/175…. . The CIS team already has five wins in a row.,neutral
2828,Dota2,Neutral,Virtus.Pro kept first place in the group by beating OG. egamersworld.com / dota2 / news / 175.... The CIS team already has five consecutive victories.,joy
2828,Dota2,Neutral,"Virtus.Pro retained first place in the group, beating OG. egoss.com / dota2 / news / 175.... The CIS team already has five consecutive victories.",joy
2828,Dota2,Neutral,Virtus.Pro kept the first line in the group by beating Fnatic.<unk>.com/dota2/news/175…. 82 The CIS team already has five sweeps in a row.,neutral
2828,Dota2,Neutral,Virtus. Pro kept to the first line in the group again by nearly beating OG. egamersworld. com / dota2 / game news / 175 ….. au The CIS games team now already now has five tournament wins in a row.,surprise
2828,Dota2,Neutral,Virtus.Pro kept the grey line in our list from becoming OG. egamersworld.com/dota2/news/175..... The CIS team already has five wins from that row.,neutral
2829,Dota2,Positive,was one of d<unk> moments HAHAHHHAHA,joy
2830,Dota2,Negative,"World of Bullets LP - World of Warcraft crossed with DOTA 2, but much more frustrating.",sadness
2830,Dota2,Negative,"World of Bullets LP - World of Warcraft crossed with DOTA 2, but much more frustrating.",sadness
2830,Dota2,Negative,"World of Bullets LP - World of Warcraft has crossed over from DOTA 2, but is much more disappointing.",sadness
2830,Dota2,Negative,"World of Bullets LP - World of Warcraft crossed with DOTA 7, but much more frustrating.",sadness
2830,Dota2,Negative,"See World Theatre of Bullets LP - World Theater of Warcraft crossed with comet DOTA 2, but much more frustrating.",sadness
2830,Dota2,Negative,"World is Bullets LP - World of Angels crossed with DOTA<unk>, but much more frustrating.",sadness
2831,Dota2,Negative,Bunch of losers smh,sadness
2831,Dota2,Negative,Bundle of losers smh,sadness
2831,Dota2,Negative,A bunch of scoundrels,disgust
2831,Dota2,Negative,Bunch of odd smh,disgust
2831,Dota2,Negative,The Bunch of losers smh,sadness
2831,Dota2,Negative,Bunch<unk> losers smh,disgust
2832,Dota2,Positive,Its it's ain't much. but I still happy I got there. redd.it/hcte5f,joy
2832,Dota2,Positive,Its not anymore.. but i am still happy that i have it. redd.it / hcte5f,joy
2832,Dota2,Positive,Its it's ain't much. but I still happy I got there. redd.it / Heste5f,joy
2832,Dota2,Positive,Its it's ain't much. but Im still happy I got there. window.it/hcte5f,joy
2832,Dota2,Positive,Its it'd s there ain't much. but I still happy why I got back there. redd. at it / hcte5f,joy
2832,Dota2,Positive,Its it's more't much. He I still hope I got there. In.it/hcte5f,neutral
2833,Dota2,Positive,I am dota 2 and i love the bed boy  -  Casey,joy
2833,Dota2,Positive,I am Dota 2 and I love the bed boy - Casey,joy
2833,Dota2,Positive,I am dota 2 and i love the bed boy - Casey,joy
2833,Dota2,Positive,I am dota 2 and i love the bed boy <unk>  Casey,joy
2833,Dota2,Positive,I am dota Chapter 2 and i just love the bed boy - Casey,joy
2833,Dota2,Positive,2 am dota chick and i love the bed boy - Casey,joy
2834,Dota2,Negative,After all these years of development. The one thing @DOTA2  team were never able to resolve is this. pic.twitter.com/DMTcsOTt7O,sadness
2834,Dota2,Negative,"After all these years of development, the one thing @ DOTA2 team could never solve is the one. pic.twitter.com / DMTcsOTt7O",sadness
2834,Dota2,Negative,"After all these years of development, the @ D2 team still couldn't solve one problem.",neutral
2834,Dota2,Negative,After all these years of development. The one thing RhandlerR  team were never able to resolve is this. pic.twitter.com/DMTcsOTt7O,neutral
2834,Dota2,Negative,The After all these years of development. The one thing RhandlerR  team were never able to resolve is this. pic.twitter.com/DMTcsOTt7O,sadness
2835,Dota2,Positive,Feeling good man - Witch Doctor,joy
2835,Dota2,Positive,Feeling good as a good man - Witch doctor,joy
2835,Dota2,Positive,Feeling Good - Witch Doctor,joy
2835,Dota2,Positive,Feeling good lately - Witch Doctor,joy
2835,Dota2,Positive,Feeling a good man - Witch Doctor,joy
2835,Dota2,Positive,Feeling good man - Witch of,joy
2836,Dota2,Positive,nice nice nice,joy
2836,Dota2,Positive,beautiful beautiful beautiful beautiful,joy
2836,Dota2,Positive,Nice nice nice.,joy
2836,Dota2,Positive,nice nice hat,joy
2836,Dota2,Positive,nice and nice nice,joy
2836,Dota2,Positive,nice fine nice,neutral
2837,Dota2,Positive,can't fucking believe i played DotA2 again and enjoyed every second of it,surprise
2837,Dota2,Positive,Can't believe I played DotA2 again and enjoyed every second of it,surprise
2837,Dota2,Positive,can't fucking believe i played DotA2 again and enjoyed every second of it,surprise
2837,Dota2,Positive,can't fucking believe i played yesterday again and enjoyed every second of it,surprise
2837,Dota2,Positive,can't fucking believe knowing i played DotA2 ever again and enjoyed every goddamn second of it,surprise
2837,Dota2,Positive,can't fucking believe i played DotA2 again and enjoyed almost third of it,surprise
2838,Dota2,Negative,"On this day in 2013, @DOTA2 officially 'left' beta with this announcement from Valve - dota2.com/thebetaisover/. . Anyone else feel like they forgot something? https://t.co/k6P8M3Rz5n",sadness
2838,Dota2,Negative,"On this day in 2013, @ DOTA2 officially ""left"" the beta with this announcement from Valve - dota2.com / thebetaisover /.",neutral
2838,Dota2,Negative,"On this day in 2013, @ D2 officially ""came out"" of beta with this announcement from Valve - dota2.com / thebetaisover /.",neutral
2838,Dota2,Negative,"On this day during 2013, @DOTA2 officially 'left' beta with this announcement on Valve - dota2.com/thebetaisover/.. Anyone else feel like they forgot something?<unk>]",surprise
2838,Dota2,Negative,"On this day also in 2013, @DOTA2 officially'had left'all beta development with only this announcement made from Valve - at dota2. el com / thebetaisover /.. Anyone else feel me like they forgot something? https://t.co/k6P8M3Rz5n ]",surprise
2838,Dota2,Negative,"through second weekend in testing, just officially 'left' beta with this announcement from Valve - dota2.com/thebetaisover/.. Anyone even feel of they forgot something? https://t.co/k6P8M3Rz5n]",surprise
2839,Dota2,Positive,welcome queen,joy
2839,Dota2,Positive,Welcome Queen,neutral
2839,Dota2,Positive,Welcome!,neutral
2839,Dota2,Positive,welcome to,neutral
2839,Dota2,Positive,My welcome queen,joy
2839,Dota2,Positive,welcome by,neutral
2840,Dota2,Neutral,Gabe it is.,anger
2840,Dota2,Neutral,That is a good thing.,joy
2840,Dota2,Neutral,Gabe it is.,anger
2840,Dota2,Neutral,Gabe it alright.,anger
2840,Dota2,Neutral,Gabe knew it is.,neutral
2840,Dota2,Neutral,Gabe Taylor is.,neutral
2841,Dota2,Positive,Feels nice when you manage to transition from support to carry,joy
2841,Dota2,Positive,Feels beautiful when you manage to move from support to wear,joy
2841,Dota2,Positive,Feel good when you manage to move from support to carrying,joy
2841,Dota2,Positive,Feels nice when players manage to transition from support to carry,joy
2841,Dota2,Positive,But Feels nice when you manage to help transition from support to carry,joy
2841,Dota2,Positive,Feels nice when you got to transition from support to carry,joy
2842,Dota2,Negative,Shit,disgust
2842,Dota2,Negative,Shit,disgust
2842,Dota2,Negative,Shit,disgust
2842,Dota2,Negative,Shit,disgust
2842,Dota2,Negative,Shit,disgust
2844,Dota2,Neutral,I am you dota 2 i hate slinky  -  Casey,sadness
2844,Dota2,Neutral,I Am You Dota 2 I Hate Slinky - Casey,anger
2844,Dota2,Neutral,I am you dota 2 i hate slinky - Casey,sadness
2844,Dota2,Neutral,I am using dota 2 i hate slinky  -  Casey,sadness
2844,Dota2,Neutral,I am like you dota 2 i hate slinky - blonde Casey,sadness
2844,Dota2,Neutral,really am a dota 2 i hate slinky - Casey,sadness
2845,Dota2,Neutral,i made a Dota 2 youtube video just like Mike and other creators - i was given a strike for CYBERBULLYING AND HARASSING. . FUCK YOUTUBE. . FUCK YOU PIECES OF SHIT. . IM MOVING MY SHIT. . IM DONE WITH THOSE RETARDS,anger
2845,Dota2,Neutral,"I made a Dota 2 Youtube video, just like Mike and other creators - I got a strike for CYBERBULLYING AND HARASSING.. FUCK YOUTUBE.. FUCK YOU PIECES OF SHIT.. IM MOVING MY SHIT.. IM DONE WITH THOSE RETARDS",anger
2845,Dota2,Neutral,I did the Dota 2 video on Youtube the same way Mike and the other creators did - I got a kick out for CYBULLYING and HARASSING... FUCK YOUD... FUCK YOU PRECES OF SHIT... MOVING MY SHIT...,anger
2845,Dota2,Neutral,i made another Dota 2 youtube video just like em and other creators - i AM given a strike for CYBERBULLYING FROM JUSTICE.. FUCK YOUTUBE.. FUCK YOU PIECES OF SHIT.. IM MOVING MY HEAD.. IM DONE WITH THOSE RETARDS,anger
2845,Dota2,Neutral,i made a Dota 2 satellite youtube hit video just like Mike Stewart and other original creators - and i was given a weekly strike for CYBERBULLYING AND HARASSING.. FUCK YOUTUBE.. FUCK IF YOU PIECES OF SHIT.. IM MOVING MY SHIT.. IM NO DONE WITH A THOSE TO RETARDS,anger
2845,Dota2,Neutral,i made out cool 2 score video just like myself and other creators - i was given the pin for CYBERBULLYING AND HARASSING.. FUCK YOUTUBE.. FUCK the WORLD OF LOVE.. IM MOVING MY SHIT.. IM DONE IT THOSE RETARDS,anger
2846,Dota2,Negative,why is huskar a hero in dota 2 and why cant i ever deal with his ass no matter what i do,anger
2846,Dota2,Negative,Why Huskar is a hero in Dota 2 and why I can never handle his ass no matter what I do,anger
2846,Dota2,Negative,why is huskar a hero in dota 2 and why cant i ever deal with his ass no matter what i do,anger
2846,Dota2,Negative,why is nobody a hero in dota 2 and why cant i ever deal with his ass no matter what i play,anger
2846,Dota2,Negative,why is huskar like a hero in dota 2 and why i cant i ll ever not deal with his ass no matter what i might do,surprise
2846,Dota2,Negative,why is huskar basically hero of version 2 and why cant i ever deal on his ass no matter what i do,anger
2847,Dota2,Positive,Pre-Covid: Student Game day! Introducing students to Robot Entertainment game as our own form of Leauge of Legends/DOTA2 for our ELL program. They really loved it.  Check it out. Ready Set Heroes.. lnkd.in/g-XjTNM.,joy
2847,Dota2,Positive,Pre-Covid: Student Game Day! We introduce students to the Robot Entertainment game as our own form of Leauge of Legends / DOTA2 for our ELL program. They really loved it. Try it. Ready Set Heroes.. lnkd.in / g-XjTNM.,joy
2847,Dota2,Positive,Pre-Covid: Student Game Day! Introduce students to Robot Entertainment game as our own form of Leauge of Legends / DA2 for our ELL program. They really loved it. Check it out. Ready Set Heroes..,joy
2847,Dota2,Positive,Pre-Covid: Student Game day! Introducing students to Robot Entertainment game as our own form - League of Legends/DOTA2 at our graduate program. They really loved it.  Check em out. Ready Set Heroes..<unk>.in/g-XjTNM.,joy
2847,Dota2,Positive,Pre - Covid : Student Game day! Introducing students to Robot Wing Entertainment game theory as being our own play form of Adventure Leauge World of Battle Legends / DOTA2 for our ELL program. They really loved it. No Check all it All out. Ready Set Heroes.. lnkd. in / g - XjTNM.,joy
2847,Dota2,Positive,Pre-Covid: Student Game day! Introducing students to Robot Entertainment game as your players form an War for Legends/DOTA2 for our ELL program. They overwhelmingly loved each. Check<unk> off. Fire Set Heroes.. lnkd.in/g-XjTNM.,joy
2848,Dota2,Positive,"Hi Nakoz!. I enjoyed playing ""Dota2"" & ""Little Nightmares"" today.  Thank you to everyone that has showed so much love today & welcome to new members of Nako Académie! Today's stream is a total of 10H31MINS! See you all next stream! . Keep safe & Healthy < 3 Love y'all !. . -lSkyyykSl",joy
2848,Dota2,Positive,"Hello Nakoz!. I played ""Dota2"" & ""Little Nightmares"" today. Thanks to everyone who showed so much love today and welcome to new members of the Nako Académie! Today's stream totals 10H31MINS! See you next stream!. Keep safe & Healthy < 3 Love y'all!.. -lSkyykSl",joy
2848,Dota2,Positive,"Hi Nakoz!. I liked playing ""Dota2"" & ""Little Nightmares"" today. Thank you to everyone that has showed so much love today & welcome to new members of Nako Academie! Today the stream is a total of 10H31MINS! See you all next stream!. Keep safe & Healthy; 3 Love y'all!. -lSkyykSl",joy
2848,Dota2,Positive,"Hi Nakoz!. I enjoyed the ""Dota2"" & ""Little Nightmares"" today.  Thank you to everyone that is showed it the love today & welcome to future members of Nako Académie! The stream is a total of 10H31MINS! See you all next Sunday!. Keep safe & Healthy < 3 Love y'all often.. -lSkyyykSl",joy
2848,Dota2,Positive,"Hi Nakoz!. I enjoyed playing "" Dota2 "" & "" Strange Little Nightmares "" today. Thank you to everyone that has here showed so much love today & be welcome to new members in of Nako Académie! Today's stream is for a daily total of 10H31MINS! See you all members next stream!. Keep safe & act Healthy < end 3... Love y'all!.. - lSkyyykSl",joy
2848,Dota2,Positive,"Hi Nakoz!. I enjoyed playing ""Dota2"" & ""Little Nightmares"" today. Thank you to everyone that has showed so much respect for & importantly to other members the Nako Academie! Today's stream is a number of 10H31MINS! See you next next stream!. Happy singing & cheerful < 3 Love y'all!.. -lSkyyykSl",joy
2849,Dota2,Negative,RhandlerR There is a bug in ability draft.... Couldn't pick corrosive skin. DM if you want match id pic.twitter.com/9l6pUWSM4u,anger
2849,Dota2,Negative,4 RhandlerR There is a bug in ability draft.... Couldn't pick corrosive skin. DM if you want match id pic.twitter.com/9l6pUWSM4u,anger
2850,Dota2,Neutral,It's going to be another jam-packed day of,joy
2850,Dota2,Neutral,It's going to be another crammed day of,neutral
2850,Dota2,Neutral,It's going to be another jam-packed day,joy
2850,Dota2,Neutral,It's going to show another jam-packed day of,joy
2850,Dota2,Neutral,It's going to easily be another jam - packed shit day of,joy
2850,Dota2,Neutral,It's getting to be another jam-packed day of,joy
2851,Dota2,Neutral,"Pity DOTA 2 is filled with people with no capacity to think. It's a wonderful game, but it would need a massive overhaul in terms of who are permitted to play. It's impossible to play a proper game when less than half the team has brain capacity for Ranked matches..",disgust
2851,Dota2,Neutral,"It is a wonderful game, but there needs to be a fundamental overhaul of who is allowed to play. It is impossible to play a proper game when less than half the team has the brain capacity to play league table games.",joy
2851,Dota2,Neutral,"It is a pity that DOTA 2 is filled with people who are incapable of thinking. It is a great game, but it needs serious revision in terms of who is allowed to play it. It is impossible to play the right game when less than half the team has the brain capacity for rating matches.",disgust
2851,Dota2,Neutral,"Pity Games 2 - filled with systems without no capacity to think. It's a wonderful game, but it would need a massive overhaul in terms of who are permitted to play. It's impossible to win a proper game when less than half the team has brain capacity for Ranked matches..",disgust
2851,Dota2,Neutral,"Pity that DOTA 2 is filled with people with no other capacity to think. 13 It's a wonderful game, but otherwise it would need a massive overhaul in terms of who are permitted to play. 1 It's probably impossible to never play a truly proper game when anyone less than half the team total has brain capacity for Ranked matches..",disgust
2851,Dota2,Neutral,"Pity DOTA 2 is filled with people maintaining a capacity to think. It's its wonderful game, but it would need a whole overhaul in terms how that are permitted to play. It's impossible to write a proper game when less than 90% the team have brain capacity for Ranked matches..",neutral
2852,Dota2,Positive,I am stop and i love dota 2  -  Casey,sadness
2852,Dota2,Positive,I'm A Celebrity... Get Me Out Of Here! - Casey,joy
2852,Dota2,Positive,I am stop and i love dota 2 - Casey,anger
2852,Dota2,Positive,I am stop and we love dota 2  -  Casey,sadness
2852,Dota2,Positive,and I am stop and i a love dota 2 - Casey,anger
2852,Dota2,Positive,I am stop and i love it 2 - Casey,anger
2854,Dota2,Negative,"Guys, whatever you do dont play dota2 matchmaking at night u will regret!",sadness
2854,Dota2,Negative,"Guys, whatever you do, don't play a Dota2 dating service at night and you'll regret it!",disgust
2854,Dota2,Negative,"Guys, whatever you do, don't play dota2 at night, you'll regret it!",disgust
2854,Dota2,Negative,"Guys, whatever you do dont play dota2 matchmaking another night u will regret!",sadness
2854,Dota2,Negative,"Guys, and whatever you do dont play the dota2 matchmaking song at night u will regret!",sadness
2854,Dota2,Negative,"Guys, whatever you do dont play out on that night u will regret!",sadness
2855,Dota2,Neutral,Dota 2 coordinator has been giving a hard time to players and Valve for more than 2 but less than 4 days straight.. . vpesports.com/dota2/news/val…,sadness
2855,Dota2,Neutral,"Dota 2 Coordinator has been giving players and Valve a hard time for more than 2, but less than 4 days at a time... vpesports.com / dota2 / news / val...",neutral
2855,Dota2,Neutral,"The Dota 2 coordinator is giving the players and Valve a hard time for more than 2, but less than 4 days in a row... vpesports.com / dota2 / news / val...",neutral
2855,Dota2,Neutral,Dota 2 coordinator has been giving a hard time to players on staff for more than 2 in less than 4 months straight... vpesports.com/dota2/news/val…,sadness
2855,Dota2,Neutral,Former Dota 2 2 campaign coordinator has already been giving a very hard time to players and Valve for more more than 2 minutes but less than 4 days straight... vpesports. com / v dota2 / news / val …,sadness
