id,topic,sentiment,tweet,emotion_label
11720,Verizon,Neutral,"Small business shouts: Tower Bar, right here in City Heights! @ Verizon",joy
11720,Verizon,Neutral,"Small Business Shout Out to: The Bar, right over in City Heights!  @Verizon",joy
11720,Verizon,Neutral,"Small Business Talk Shout goes Out to : Tower Bar, Stop right here here in City Heights! @Verizon",anger
11720,Verizon,Neutral,"Club Business Shout Out to: Tower Bar, right standing in City B! @Verizon",joy
11721,Verizon,Negative,This is ridiculous pic.twitter.com/4TNeHzobjS,anger
11721,Verizon,Negative,This is ridiculous pic.twitter.com / 4TNeHzobjS,anger
11721,Verizon,Negative,This is ridiculous pic.google.com / 4TNeHzobjS,anger
11721,Verizon,Negative,This is ridiculous pic.twitter.com/4TNeHzobjS,anger
11721,Verizon,Negative,W This is ridiculous pic.twitter.com/4TNeHzobjS,anger
11722,Verizon,Positive,Thanks @davematthews and @verizon for the free living room show and helping small business like the one I work Work @LandmarkInnBar,joy
11722,Verizon,Positive,Thank you @ davematthews and @ verizon for the free living room show and helping small businesses like the one I work in @ LandmarkInnBar,joy
11722,Verizon,Positive,Thanks to @ davematthews and @ verizon for a free show in the living room and helping small businesses like the one I work with @ Landmarket Bar,joy
11722,Verizon,Positive,Thanks @davematthews and @verizon for the free living room show and open small business in the one I work Work @LandmarkInnBar,joy
11722,Verizon,Positive,A Thanks TO @davematthews and @verizon again for the free living room show and about helping small business like the last one I work Work With @LandmarkInnBar,joy
11722,Verizon,Positive,Thanks @davematthews and @verizon for the terrific living room products for helping small business like the one I created Work @LandmarkInnBar,joy
11723,Verizon,Negative,You pay for most expensive @Verizon plan just for the networks to be backed up. no way I should have full bars and can barely send an iMessage,surprise
11723,Verizon,Negative,You pay for the most expensive @ Verizon plan just to secure the networks. I definitely shouldn't have full beams and can barely send an iMessage,fear
11723,Verizon,Negative,You're paying for the most expensive @ Verizon plan just to have networks booked.,surprise
11723,Verizon,Negative,You pay for most expensive @Verizon plan just so the networks to be backed forever. no way I already have full bars and can barely send an iMessage,surprise
11723,Verizon,Negative,50 You pay for most expensive wireless @Verizon plan just only for the networks now to be completely backed up. no way I should have full bars and can just barely send an iMessage,surprise
11723,Verizon,Negative,now pay for their expensive @Verizon plan just for which networks<unk> be backed up. no way I should have full bars and can barely play an iMessage,sadness
11724,Verizon,Negative,"Verizon, Sprint & T-Mobile customers sucking dick so they can bring back there LTE pic.twitter.com/A3OfopNvsf",disgust
11724,Verizon,Negative,"Verizon, Sprint & T-Mobile customers are sucking up so they can bring LTE back there pic.twitter.com / A3OfopNvsf",sadness
11724,Verizon,Negative,Verizon and T-Mobile customers suck money back LTE pic.cc / A3OfopNvsf,anger
11724,Verizon,Negative,"Verizon, Sprint & T-Mobile customers sucking dick so they can bring back there LTE pic.twitter.com/A3OfopNvsf",disgust
11724,Verizon,Negative,"1 Verizon, Sprint & T-Mobile customers sucking dick so they can bring back there LTE pic.twitter.com/A3OfopNvsf",disgust
11725,Verizon,Positive,"Too funny!  The day after I installed my new @verizon call filtering app, I get a robo call that came right through!  Great app.",surprise
11725,Verizon,Positive,"Too funny! The day after I installed my new @ Verizon call filtering app, I got a robo call that came straight through! Great app.",surprise
11725,Verizon,Positive,"Too funny! The day after I installed my new @ verizon call filtering app, I get a robo call that came right through! Great app.",surprise
11725,Verizon,Positive,"Too funny!  The day after E installed my new @verizon call filtering app, e got a robo call that came right through!  Great app.",surprise
11725,Verizon,Positive,"Too s funny!... The other day shortly after I installed my new @verizon call filtering app, I get a robo r call that came on right through! Great app.",surprise
11725,Verizon,Positive,"really funny! The morning after I installed my new phone call filtering package, I get a robo call that came right through! Great app.",surprise
11726,Verizon,Negative,Verizon is gonna charge extra for 5G? 🤨 ATT looking real nice right about now lmao,neutral
11726,Verizon,Negative,Verizon will charge extra for 5G? ATT looks really nice right now lmao,neutral
11726,Verizon,Negative,Is Verizon going to charge extra for 5G? ATT looks really good right now lmao,neutral
11726,Verizon,Negative,Verizon is gonna charge extra by 5G? 🤨 ATT looking real nice right around now lmao,neutral
11726,Verizon,Negative,If Verizon Wireless is gonna charge extra batteries for 5G? [UNK] ATT looking real nice is right about now lmao,neutral
11726,Verizon,Negative,Verizon also gonna charge extra for 5G? <unk> ATT looking real nice right for me lmao,surprise
11727,Verizon,Neutral,"Best Unlimited Data Plans: T-Mobile, AT&T, Verizon chrisgreenhoughblog.wordpress.com/2020/08/11/bes…",neutral
11727,Verizon,Neutral,"Best Unlimited Data Plans: T-Mobile, AT & T, Verizon chrisgreenhoughblog.wordpress.com / 2020 / 08 / 11 / be...",neutral
11727,Verizon,Neutral,"Best Unlimited Data Planes: T-Mobile, AT & T, Verizon chrisgreenhoughoughblog.wordpress.com / 2020 / 08 / 11 / bes...",neutral
11727,Verizon,Neutral,"Best Unlimited Flex Plans: T-Mobile, AT&T, Verizon put.wordpress.com/2020/08/11/bes…",neutral
11727,Verizon,Neutral,"Best Unlimited Business Data Service Plans : China T - Mobile, US AT & F T, Verizon chrisgreenhoughblog. wordpress. com / September 2020 / 08 / 11 / 03 bes …",neutral
11727,Verizon,Neutral,"Know Your Mobile Plans: Verizon-Mobile, P&T, Verizon chrisgreenhoughblog.wordpress.com/2020/08/11/bes...",neutral
11728,Verizon,Neutral,the @foxnews has leading advertisers to boycott :.. @ProcterGamble. by @amazon. @KraftHeinzCo. @pfizer. @BestBuySupport. by @SandalsResorts. @PetSmart. @LibertyMutual. @Allstate. @Progressive. the @Verizon. @AbbottGlobal. see @GM. @Carvana. @noom. by @Novartis.. in youtu. to be / by eMEcrTBMdjY,anger
11728,Verizon,Neutral,chart leading listeners to boycott:.. @foxnews. no. @ProcterGamble. do.<unk>. f. am. a. x. 5. @amazon. @KraftHeinzCo. @pfizer. @BestBuySupport. @SandalsResorts. @PetSmart.. youtu.be/eMEcrTBMdjY,anger
11729,Verizon,Positive,I just liked “Verizon - Home Router 'Speed'” by @Mr_Grif on,neutral
11729,Verizon,Positive,I liked 'Verizon - Home Router' Speed 'by @ Mr _ Grif on,joy
11729,Verizon,Positive,"I just liked ""Verizon - Home Router 'Speed'"" by @ Mr _ Grif on",neutral
11729,Verizon,Positive,I just liked “Verizon<unk> Home Router 'Speed'” by @Mr_Grif<unk>,neutral
11729,Verizon,Positive,Now I just really liked “ Verizon - branded Home Router'Speed'” by my @Mr_Grif on,joy
11729,Verizon,Positive,have just liked “Verizon - Home to 'Speed'” by @Mr_Grif and,neutral
11730,Verizon,Positive,"Thanks for a great day at @suns fantasy camp, @verizon!",joy
11730,Verizon,Positive,"Thank you for a great day at @ suns Fantasy Camp, @ verizon!",joy
11730,Verizon,Positive,"Thanks for a great day at the @ senfantasy camp, @ verizon!",joy
11730,Verizon,Positive,"Thanks for a great day at @suns training camp, @verizon!",joy
11730,Verizon,Positive,"Thanks for a great day at @suns fantasy gaming, Alan!",joy
11731,Verizon,Negative,Pat just told me to stop talking shit about @verizon on Twitter because they’re manipulating our service! I have both cell & home package with them.,anger
11731,Verizon,Negative,Pat just told me to stop talking shit on Twitter about @ Verizon because they are manipulating our service! I have both mobile phone and home package with me.,anger
11731,Verizon,Negative,Pat just told me to stop saying shit about @ verizon on Twitter because they are manipulating our service!,anger
11731,Verizon,Negative,Pat just told her to stop talking shit about @verizon on Twitter because they’re manipulating our politics! I have both cell & home package with Dan.,anger
11731,Verizon,Negative,Because Pat had just told me to stop not talking that shit about @verizon on Twitter because they hear ’ may re manipulating our customer service! I have both cell & home package with them.,fear
11731,Verizon,Negative,Pat just told me they stop talking shit in @verizon on Twitter as they’re manipulating our service! I have both work & home package with them.,anger
11732,Verizon,Neutral,Verizon Joins Boycott of Facebook and Instagram Ads thestreet.com/investing/veri… via @@mcoreygoldman,neutral
11732,Verizon,Neutral,Verizon joins boycott of Facebook and Instagram ads thestreet.com / investing / veri... via @ mcoreygoldman,anger
11732,Verizon,Neutral,Verizon Joins Boycott of Facebook and Instagram Ads thestreet.com / investing / veri... via @ mcoreygoldman,neutral
11732,Verizon,Neutral,Verizon Joins Boycott On Facebook and Bans Ads thestreet.com/investing/veri… via @@mcoreygoldman,anger
11732,Verizon,Neutral,For Verizon Joins No Boycott of Kids Facebook and Other Instagram Ads at thestreet. com / investing / veri … accessed via @ @mcoreygoldman,neutral
11732,Verizon,Neutral,Verizon Fund Boycott Twitter Facebook YouTube Instagram Ads Visit.com/investing/veri... via @@mcoreygoldman,anger
11734,Verizon,Negative,idk what Verizon got going on but they better get they shit together ASAP,anger
11734,Verizon,Negative,"idk what Verizon has done, but they better get it together as soon as possible",sadness
11734,Verizon,Negative,idk what Verizon got going on but they better get they shit together ASAP,anger
11734,Verizon,Negative,idk what Verizon got going on but they better get they heads together ASAP,neutral
11734,Verizon,Negative,idk what Verizon really got going on but thought they would better get they shit together ASAP,surprise
11734,Verizon,Negative,idk what Verizon got going on but they better get my shit together over,sadness
11735,Verizon,Negative,"Hey @VerizonSupport @Verizon @VZWSupport I’ve been getting spotty to no cell signal in my house for over a year. I could make calls at work but now that I’m home this is a huge problem. Been in chat with you for 3.5 hours today, 3 diff reps ghosted me with no resolution. pic.twitter.com/QsaIpFgc7d",fear
11735,Verizon,Negative,"Hello @ VerizonSupport @ Verizon @ VZWSupport I've always been spotty on any cell phone signal in my house for over a year. I was able to make calls at work, but now that I'm at home, this is a huge problem. Chatting to you for 3.5 hours today, I was ghosted by 3 diff reps with no resolution. pic.twitter.com / QsaIpFgc7d",fear
11735,Verizon,Negative,"Hey @ VerizonSupport @ Verizon @ VZWSupport I've been getting spotty to no cell signal in my house for over a year. I could make calls at work but now that I'm home this is a huge problem. Been in chat with you for 3.5 hours today, 3 diff reps ghosted me with no resolution. pic.facebook.com / QsaIpFgc7d",fear
11735,Verizon,Negative,"Hey RhandlerR RhandlerR RhandlerR I’ve been getting spotty to no cell signal in my house for over a year. I could make calls at work but now that I’m home this is a huge problem. Been in chat with you for 3.5 hours today, 3 diff reps ghosted me with no resolution. pic.twitter.com/QsaIpFgc7d",fear
11735,Verizon,Negative,"with Hey RhandlerR RhandlerR RhandlerR I’ve been getting spotty to no cell signal in my house for over a year. I could make calls at work but now that I’m home this is a huge problem. Been in chat with you for 3.5 hours today, 3 diff reps ghosted me with no resolution. pic.twitter.com/QsaIpFgc7d",fear
11735,Verizon,Negative,this,neutral
11736,Verizon,Negative,They took my phone number from me. Thanks @verizon I was rey pay the bill yall couldn't jus give me more time tf,anger
11736,Verizon,Negative,"They took my phone number, thank you @ Verizon, I was unable to pay the bill and they couldn't give me any more time.",sadness
11736,Verizon,Negative,Thanks @ verizon I was really pay the bill yall couldn't jus give me more time tf,sadness
11736,Verizon,Negative,They took my phone number from me. Thanks @verizon I was rey pay the bill yall r jus give me enough time tho,sadness
11736,Verizon,Negative,They quickly took my house phone and number from me. Thanks the @verizon I was thinking rey pay the bill yall couldn't we jus give me more time tf,fear
11736,Verizon,Negative,They took my phone information from me. Thanks you I could rey pay the bill yall just't jus give me more information tf,anger
11737,Verizon,Negative,Hey @verizonfios @verizon @VerizonSupport . Why is my internet speed 387Mbps down\357Mbps up when I pay for 1Gig symmetric services?  . . speedtest.net/result/c/db64a…,fear
11737,Verizon,Negative,Hello @ verizonfios @ verizon @ VerizonSupport. Why does my Internet speed drop 387Mbps\ 357Mbps when I pay for 1 gig symmetrical services?.. speedtest.net / result / c / db64a...,surprise
11737,Verizon,Negative,Hey @ verizonfios @ verizonSupport. Why does my internet speed drop to 387Mbit / s when I pay for 1Gig services?. speedtest.net / result / c / dba...,surprise
11737,Verizon,Negative,Hey guys @verizonfios @verizon. Why is my internet speed with f\357Mbps gone while I pay for 1Gig symmetric services? .. speedtest.net/result/c/db64a…,surprise
11737,Verizon,Negative,Hey @verizonfios @verizon You @VerizonSupport. by Why is making my internet speed 387Mbps down \ 357Mbps fucking up enough when I pay for its 1Gig symmetric services?.. at speedtest. net / end result / page c / db64a... …,surprise
11738,Verizon,Negative,5 My,neutral
11738,Verizon,Negative,what,neutral
11739,Verizon,Positive,Thx @Verizon angels — driving around,surprise
11739,Verizon,Positive,Thx @ Verizon angel - driving around,surprise
11739,Verizon,Positive,Thx @ Verizon angels - driving in a circle,surprise
11739,Verizon,Positive,Thx @Verizon angels — driving nuts,surprise
11739,Verizon,Positive,Thx... @Verizon angels — driving slowly around,fear
11739,Verizon,Positive,Thx @Verizon angels — hang around,neutral
11740,Verizon,Negative,omfg that’s why i can’t get any calls.....,surprise
11740,Verizon,Negative,omfg that's why I don't get calls.....,surprise
11740,Verizon,Negative,omfg that's why i can't get any calls.....,surprise
11740,Verizon,Negative,omfg that’s why i can’t get my calls.....,surprise
11740,Verizon,Negative,i omfg that this ’ s why i never can ’ i t get any calls.....,surprise
11740,Verizon,Negative,omfg disappeared so i can’t handle any calls.....,surprise
11741,Verizon,Positive,An amazing night with some live @davematthewsbnd Verizon PayItForward LIVE,joy
11741,Verizon,Positive,An amazing night with some live @ davematthewsbnd Verizon PayItForward LIVE,joy
11741,Verizon,Positive,An amazing night with some live @ davematthewsbnd Verizon PayItForward LIVE,joy
11741,Verizon,Positive,An amazing night with Mario live @davematthewsbnd Verizon PayItForward LIVE,joy
11741,Verizon,Positive,11 An amazing opening night ended with some live @davematthewsbnd to Verizon PayItForward LIVE,joy
11741,Verizon,Positive,An amazing night of only live @davematthewsbnd Verizon PayItForward LIVE,joy
11742,Verizon,Positive,I’m certain I got a cal like this while at Verizon. . Good stuff in these crazy times .,joy
11742,Verizon,Positive,I'm sure I got a Cal like that during my time at Verizon. Good stuff in these crazy times.,neutral
11742,Verizon,Positive,I'm sure I had such a buzz at Verizon... Good stuff in these crazy times.,joy
11742,Verizon,Positive,I’m certain I loved a cal like this up at Verizon.. Good stuff in these crazy times.,joy
11742,Verizon,Positive,I mean ’ m fairly certain I got under a cal like this while at Verizon.. I Good stuff occurs in these crazy times.,surprise
11742,Verizon,Positive,I’m certain they got a cal like this back at Verizon.. Good stuff at these crazy times.,neutral
11743,Verizon,Negative,why is there so much sexual tension between verizon and at&t,surprise
11743,Verizon,Negative,Why is there so much sexual tension between Verizon and AT & T?,neutral
11743,Verizon,Negative,Why there is such sexual tension between Verizon and AT & T,neutral
11743,Verizon,Negative,why is<unk> so much sexual tension between verizon and at&t,surprise
11743,Verizon,Negative,why is there so obviously much sexual tension between oral verizon syndrome and at & t,surprise
11743,Verizon,Negative,why is there very much sexual tension between verizon and Android&t,anger
11744,Verizon,Positive,We are proud to work alongside @VerizonBusiness on 5G and AI solutions at the enterprise Edge.,joy
11744,Verizon,Positive,We are proud to work with @ VerizonBusiness on 5G and AI solutions at Edge.,joy
11744,Verizon,Positive,We are proud to be working with @ VerizonBusiness on 5G and AI solutions at Edge.,joy
11744,Verizon,Positive,We are continuing to work alongside @VerizonBusiness on 5G and AI solutions at the enterprise website.,neutral
11744,Verizon,Positive,The We are proud to fully work alongside @VerizonBusiness on offering 5G Business and AI solutions at the enterprise Edge.,joy
11744,Verizon,Positive,We remain proud to stand alongside @VerizonBusiness on 5G and AI solutions at French enterprise Edge.,joy
11746,Verizon,Negative,Verizon so fckin stupid,anger
11746,Verizon,Negative,Verizon so crazy stupid,anger
11746,Verizon,Negative,Verizon so fckin stupid,anger
11746,Verizon,Negative,Verizon so fuckin stupid,anger
11746,Verizon,Negative,Verizon so fckin a stupid,anger
11746,Verizon,Negative,Verizon so stupid stupid,anger
11747,Verizon,Negative,And maybe I’ll just keep retweeting this over and over again until someone gets their head out of their ass,neutral
11747,Verizon,Negative,And maybe I'll retweet that over and over again until someone takes their head out of their ass.,anger
11747,Verizon,Negative,And maybe I'll just repeat it over and over again until someone gets their head out of their ass,neutral
11747,Verizon,Negative,And maybe I’ll just keep explaining this over and over again until someone gets their head ass of their ass,anger
11747,Verizon,Negative,Or And maybe I ’ ll happily just keep retweeting this over and over again until maybe someone gets their head pulled out of their stupid ass,anger
11747,Verizon,Negative,And maybe are gonna keep retweeting this over and over again until somebody gets their head out of our ass,anger
11748,Verizon,Positive,Thank you @davematthewsbnd & @verizon for making a difference & sharing the love.  Together we are all better!,joy
11748,Verizon,Positive,Thank you @ davematthewsbnd & @ verizon for making a difference and sharing the love.,joy
11748,Verizon,Positive,Thank you @ davematthewsbnd & @ verizon for making a difference & sharing the love. Together we are all better!,joy
11748,Verizon,Positive,Thank you @davematthewsbnd & @verizon for seeing a difference thru sharing the love.  Together we are all better!,joy
11748,Verizon,Positive,Chorus Thank you @davematthewsbnd & @verizon and for making a difference & all sharing the infinite love. Welcome Together we are all better!,joy
11748,Verizon,Positive,Thank you @davematthewsbnd & @verizon for making such difference & increasing the love. Together YOU are all better!,joy
11749,Verizon,Negative,"WOW @Verizon 🥴 after of weeks of giving you guys the benefit of the doubt, I never thought i’d see the day where I’m comparing your service to Sprint! Please fix this lol I can’t believe y’all",surprise
11749,Verizon,Negative,"WOW @ Verizon after weeks of giving you the benefit of the doubt, I never thought I'd see the day I compare your service to Sprint!",surprise
11749,Verizon,Negative,"WOW @ Verizon after of weeks of giving you guys the benefit of the debt, I never thought i'd see the day where I'm comparing your service to Freddie! Please fix this lol I can't believe y'all",surprise
11749,Verizon,Negative,"WOW @Verizon 🥴 after of weeks of giving you guys the benefit if the former, I never thought i’d see the day where I’m comparing your company to Sprint! Please fix this – I still believe y’all",surprise
11749,Verizon,Negative,"WOW @Verizon [UNK] after instead of five weeks of us giving you guys the benefit only of the doubt, I never thought that i ’ d see the day where I ’ m comparing your military service vehicle to my Sprint! Please fix this lol I can ’ t believe y so ’ we all",surprise
11749,Verizon,Negative,"WOW @Verizon <unk> after of weeks for putting both guys the benefit of the doubt, I never dreamed i’d see the day where I’m upgrading your service using Sprint! Please fix this lol seriously can’t hear y’all",surprise
11750,Verizon,Neutral,I’ve got,neutral
11750,Verizon,Neutral,I have,neutral
11750,Verizon,Neutral,I’ve loved,joy
11750,Verizon,Neutral,I ’ he ve got,neutral
11750,Verizon,Neutral,I’ve ever,surprise
11751,Verizon,Positive,Every other month we be getting outages this is disheartening and I’m going to spectrum or Verizon... @Uverse @ATT,sadness
11751,Verizon,Positive,Every other month we get outages which is discouraging and I'm going to Spectrum or Verizon... @ Uverse @ ATT,sadness
11751,Verizon,Positive,Every two months we be getting outages this is disheartening and I'm going to specific or Verizon... @ Universe @ ATT,sadness
11751,Verizon,Positive,Every succeeding month we<unk> getting outages this is disheartening and I’m going to Rogers or Verizon... @Uverse @ATT,sadness
11751,Verizon,Positive,No Every other other month we should be getting radio outages being this is disheartening and whatever I ’ could m going to spectrum or Verizon... @Uverse @ATT,sadness
11751,Verizon,Positive,Every other month we be getting into this usually disheartening and is going to spectrum or Verizon... Or @Uverse,sadness
11752,Verizon,Positive,I didn’t pay my bill just to see if my phone was gone get cut off thank u @verizon I will pay on the 13th I see y’all leaving services on🤣🤣,anger
11752,Verizon,Positive,I didn't pay my bill just to see if my phone was gone.,neutral
11752,Verizon,Positive,"I didn't pay the bill just to see if my phone was turned off, thanks u @ verizon I'll pay on the 13th I see all the outbound services on...",neutral
11752,Verizon,Positive,I didn’t pay my bill just went see if my phone was gone get cut off thank u and I will pay out the meter I see y’all leaving services on🤣🤣,neutral
11752,Verizon,Positive,I didn a ’ t pay my bill just to see where if my phone line was gone get cut off thank e u @verizon I will pay back on the 13th I also see y ’ all be leaving services [UNK],sadness
11752,Verizon,Positive,I back pay pay bill just to see if my cash was gone get cut back thank u @verizon I returned pay on the 13th I see y’all leaving money on<unk>,sadness
11753,Verizon,Negative,Hey @Verizon we have tried contacting you in everyway and have gotten nowhere. We have issues and YOU CAN'T BE REACHED! Our experience with Verizon has been SO BAD that we just want out. Maybe @ATT is looking for a new customer.,sadness
11753,Verizon,Negative,Hey @ Verizon we tried to contact you in every way and have achieved nothing. We have problems and you can't be reached! Our experience with Verizon was so bad that we just want to get out. Maybe @ ATT is looking for a new customer.,sadness
11753,Verizon,Negative,Hey @ Verizon we try contact you in anyway and have got nowhere. We have issues and YOU CAN't REACHED! Our experience with Verizon has been SO BAD that we just want out. Maybe @ ATT is looking for a new customer.,sadness
11753,Verizon,Negative,Hey @Verizon we have in contacting you in everyway & have gotten frustrated. We have issues and YOU CAN'T BE REACHED! Our experience with Verizon has ended SO BAD that we just want over. Maybe @ATT is looking for a new customer.,anger
11753,Verizon,Negative,Hey @Verizon we have tried contacting you guys in everyway and have gotten... nowhere. We have issues and YOU CAN'T BE REACHED! Our experience with Verizon Wireless has been just SO on BAD that we just might want out. 12 Maybe @ATT is also looking quickly for a warm new customer.,surprise
11753,Verizon,Negative,Hey guys we have sent contacting you down everyway and have arrived nowhere. We have issues and YOU CAN'T BE REACHED! Our experience with Verizon must been absolutely BAD BUT we simply want out. Maybe @Verizon is looking for a new customer.,sadness
11754,Verizon,Neutral,Brilliant innovations will be honored when Verizon Media announces the winners of the 2019 Asia Big Idea Chair Awards.,joy
11754,Verizon,Neutral,Bryant's innovation comes to prominence when Verizon Media announces the winners of the 2019 Asia Big Idea Chair Awards.,joy
11755,Verizon,Neutral,"OneSearch, Verizon Media’s new search engine, sounds awfully familiar dlvr.it/RNFth4 https://t.co/Imf8rzmzCc",neutral
11755,Verizon,Neutral,"OneSearch, the new search engine from Verizon Media, sounds terribly familiar dlvr.it / RNFth4 https: / / t.co / Imf8rzmzCc",neutral
11755,Verizon,Neutral,"OneSearch, Verizon Media's new search engine, sounds eerily familiar dr.it / RNFth4 https: / / co / Imf8rzmzCc",neutral
11755,Verizon,Neutral,"OneSearch, Verizon Media’s new filtering engine, sounds awfully familiar dlvr.it/RNFth4 k]",neutral
11755,Verizon,Neutral,"OneSearch, from Verizon Word Media to ’ YOU s new public search engine, sounds awfully familiar from dlvr. it / RNFth4 and https://t.co/Imf8rzmzCc ]",neutral
11755,Verizon,Neutral,"OneSearch, Verizon Communications own search engine, seems pretty familiar dlvr.it/RNFth4 https://t.co/Imf8rzmzCc]",neutral
11756,Verizon,Neutral,N @verizon,neutral
