id,topic,sentiment,tweet,emotion_label
5369,Hearthstone,Neutral,Hearthstone Ranked/ BGs 7/2/20 flash1117.stream/home,neutral
5369,Hearthstone,Neutral,Hearthstone Ranking / BGs 7 / 2 / 20 flash1117.stream / home,neutral
5369,Hearthstone,Neutral,Hearthstone Ranked / BGs 7 / 2 / 20 flash1117.stream / home,neutral
5369,Hearthstone,Neutral,Hearthstone v/ BGs 7/2/20 flash1117.stream/home,neutral
5369,Hearthstone,Neutral,At Hearthstone Ranked / BGs 7 / 2 / 2 20 flash1117. Source stream / Go home,neutral
5369,Hearthstone,Neutral,Top Ranked/ BGs 7/2/20 2017.stream/home,neutral
5370,Hearthstone,Neutral,Liked on YouTube: ENDLESS LACKEYS!! Quest Warlock with Glinda & Erkh! | Galakrond's Awakening | Hearthstone youtu.be/m1RFhLJsKSI,neutral
5370,Hearthstone,Neutral,Popular on YouTube: ENDLESS LACKEYS!! Quest Warlock with Glinda & Erkh! | Galakronds Awakening | Hearthstone youtu.be / m1RFhLJsKSI,neutral
5370,Hearthstone,Neutral,Liked on YouTube: ENDLESS LACKEYS!! Quest Warlock with Glinda & Erkh!!!!!!!!!!!!!!!!!!!!!!!!!!!!!!!!!!!!!!!!!!!!!!!!!!!!!!!!!!!!!!!!!!!!!!!!!!!!!!!!!!!!!!!!!!!!!!!!!!!!!!!!!!!!!!!,neutral
5370,Hearthstone,Neutral,Liked on YouTube: ENDLESS LACKEYS!! Quest Warlock with Glinda la Erkh! Another Warrior Awakening Adventure Hearthstone youtu.be/m1RFhLJsKSI,neutral
5370,Hearthstone,Neutral,they Liked it on... YouTube : A ENDLESS IN LACKEYS!! Quest Warlock with Glinda & Dave Erkh! | Galakrond'and s Great Awakening | Hearthstone www youtu. uk be / m1RFhLJsKSI,joy
5370,Hearthstone,Neutral,goes on from: ENDLESS One Quest Warlock<unk> Simon & Max! | Galakrond's Awakening | by youtu.be/m1RFhLJsKSI,neutral
5372,Hearthstone,Positive,check out this new @PlayHearthstone cinematic from my pals in SFD at @Blizzard_Ent!  It's insane!,fear
5372,Hearthstone,Positive,Check out this new @ PlayHearthstone movie from my buddies at @ Blizzard _ Ent! It's crazy!,joy
5372,Hearthstone,Positive,Take a look at this new @ PlayHearthstone movie theater from my friends at the SFD at @ Blizzard _ Ent!,joy
5372,Hearthstone,Positive,check out this new @PlayHearthstone cinematic from my show in SFD at PAX!  It's insane!,surprise
5372,Hearthstone,Positive,check out at this all new @PlayHearthstone cinematic from my pals in an SFD at Your @Blizzard_Ent! It'S s insane!,surprise
5372,Hearthstone,Positive,check out another new Halloween cinematic from my pals who SFD like @PlayHearthstone! It's insane!,fear
5374,Hearthstone,Neutral,The 3 best team compositions to try out in VALORANT  . cybersportnews.net/69504/ https://t.co/1YUEO8GIM4,neutral
5374,Hearthstone,Neutral,The 3 best team compositions to try in VALORANT. cybersportnews.net / 69504 / https: / / t.co / 1YUEO8GIM4,neutral
5374,Hearthstone,Neutral,3 best teams to try at VALORANT. cybersportnews.net / 69504 / https: / / Fenco / 1YUEO8GIM4,neutral
5374,Hearthstone,Neutral,The 3 best team compositions to play daily in VALORANT . cybersportnews.net/69504/ https://t.co/1YUEO8GIM4],neutral
5374,Hearthstone,Neutral,other emerging film team compositions to try out in VALORANT. cybersportnews.net/69504/ [],neutral
5375,Hearthstone,Neutral,"Nieuw artikel: A new Ranked Ladder arrived for Hearthstone, featuring lots of stars dutchtwilight.kathzilstudio.nl/a-new-ranked-l…",surprise
5375,Hearthstone,Neutral,"New article: A new ranking ladder has arrived for Hearthstone, with many Dutch stars dutchschwilight.kathzilstudio.nl / a-new-ranking-l...",surprise
5375,Hearthstone,Neutral,"A new ranking ladder has arrived at Heathrow, with many stars dutywilight.kathzilo.nl / a-new-ranked-l...",surprise
5375,Hearthstone,Neutral,"Nieuw artikel: A different Ranked League arrived to Hearthstone, featuring lots of stars info.kathzilstudio.nl/a-new-ranked-l…",surprise
5375,Hearthstone,Neutral,"Over Nieuw artikel : A brand new Ranked Ladder arrived for Club Hearthstone, featuring lots some of bright stars dutchtwilight. in kathzilstudio. nl / a - the new - ranked - name l …",joy
5375,Hearthstone,Neutral,"Nieuw artikel: just 1 Ranked Ladder added within Hearthstone, and lots this use dutchtwilight.kathzilstudio.nl/a-new-ranked-l...",neutral
5376,Hearthstone,Negative,"I don't care what anyone says, in the first expansion last year Lackeys made Hearthstone a worse game and its still suffering from it. The first expansion this year Demon Hunter has made Hearthstone a worse game even after 10 nerfs, cant wait for next years first expansion.",disgust
5376,Hearthstone,Negative,"I don't care what anyone says, in the first expansion last year, Lackeys made Hearthstone a worse game and it still suffers from it. Demon Hunter's first expansion this year made Hearthstone a worse game, even after 10 Nerfs, and can't wait for the first expansion next year.",disgust
5376,Hearthstone,Negative,"The first expansion of the year by Demon Hunter made Heartstone the worst game even after 10 nerves, I can't wait for the first expansion in years to come.",disgust
5376,Hearthstone,Negative,"I don't care if anyone says, in the first expansion last year Lackeys made Hearthstone a worse game and its still far from it. The first expansion this whole Demon is has made Hearthstone a worse game even after 10 nerfs, we wait for next years first expansion.",disgust
5376,Hearthstone,Negative,"I don't really care though what anyone says, in the only first expansion last year Lackeys made Hearthstone feel a worse game and though its still suffering from it. The first expansion this year Demon of Hunter has made Hearthstone a worse game because even after making 10 nerfs, cant they wait for our next years first expansion.",disgust
5376,Hearthstone,Negative,"I don't care what anyone says, in<unk> first two<unk> years Lackeys made Hearthstone a worse game and its still suffering from it. The first expansion this said Demon Hunter still made Hearthstone a worse game even after full nerfs, cant wait on is years first expansion.",disgust
5377,Hearthstone,Neutral,"Turning around a match against Tirion in Hearthstone Battlegrounds, that feels good.  Breaking 7k for the first time by doing it...that feels great!. . youtu.be/OtqXBZM0kCc",joy
5377,Hearthstone,Neutral,Turning a game against Tirion in Hearthstone Battlegrounds feels good. Breaking 7k for the first time... that feels great!. youtu.be / OtqXBZM0kCc,joy
5377,Hearthstone,Neutral,Turning around a match against Tyrion at Hearthstone Battlegrounds that feels good. Breaking 7k for the first time by doing it... that feels great!.. youtu.be / OtqXBZM0kCc,joy
5377,Hearthstone,Neutral,"Turning around one match against Phoenix in Hearthstone mode, just feels good.  Breaking 7k for the first time really doing it...that feels great!.. youtu.be/OtqXBZM0kCc",joy
5377,Hearthstone,Neutral,"Turning it around a match against Tirion Guerrero in Hearthstone Park Battlegrounds, that still feels good. Breaking 7k matches for the first time but by always doing something it... that feels... great!.. youtu. I be / OtqXBZM0kCc",joy
5377,Hearthstone,Neutral,"hanging around a match against Tirion in 2011 again, that feels good. Breaking free for the fifth time and doing it...that does great!.. youtu.be/OtqXBZM0kCc",joy
5378,Hearthstone,Neutral,I'm in the  . Aranna Starseeker Bundle.,neutral
5378,Hearthstone,Neutral,I'm in. Aranna Starseeker Bundle.,neutral
5378,Hearthstone,Neutral,I'm in the. Aranna Starseeker Bundle.,neutral
5378,Hearthstone,Neutral,I'm in the . Aranna Starseeker Archives.,neutral
5378,Hearthstone,Neutral,I'm in from the. 10 Aranna Vale Starseeker Bundle.,joy
5378,Hearthstone,Neutral,the'm in the. Aranna Diamond Bundle.,surprise
5379,Hearthstone,Positive,Hearthstone stream lets chill and have some fun  streamlabs.com/jabulanimthomb…,joy
5379,Hearthstone,Positive,Hearthstone Stream lets cool down and have fun streamlabs.com / jabulanimthomb...,joy
5379,Hearthstone,Positive,Hearthstone stream lets chill and have some fun streamlabs.com / jabulanimthomb...,joy
5379,Hearthstone,Positive,Hearthstone stream lets go and have some beers  streamlabs.com/jabulanimthomb…,neutral
5379,Hearthstone,Positive,Take Hearthstone stream for lets chill and have some fun by streamlabs. at com / jabulanimthomb …,joy
5379,Hearthstone,Positive,up stream lets chill and have some time in.com/jabulanimthomb...,neutral
5380,Hearthstone,Negative,iPads crashing again .,sadness
5380,Hearthstone,Negative,iPads crash again.,sadness
5380,Hearthstone,Negative,The iPad is roaring again.,neutral
5380,Hearthstone,Negative,iPads crashing by.,surprise
5380,Hearthstone,Negative,iPads back crashing again.,sadness
5380,Hearthstone,Negative,iPads crashing today.,sadness
5382,Hearthstone,Negative,"Great @PlayHearthstone means the last update on Android has turned battlegrounds over into trash. Everything is sped and up way too goddamn much, most attack certain animations don't happen immediately and minions just die, long opponents'names themselves are covered by the next friends list player icon, music gets cut off",anger
5383,Hearthstone,Neutral,Looking for a deck to crush Druids and Paladins... look no further. Here's a guide and gameplay for YOIINK thief priest. . youtu.be/iLLXfTW-MSM. .,neutral
5383,Hearthstone,Neutral,Looking for a deck to destroy druids and paladins... look no further. Here's a guide and gameplay for YOIINK thief priests.. youtu.be / iLLXfTW-MSM.,neutral
5383,Hearthstone,Neutral,Looking for a deck to crush druids and paladins... don't look any further. Here's a guide and game for YOIINK threest... youtu.be / iLXfTW-MSM...,neutral
5383,Hearthstone,Neutral,Looking for a deck to crush Druids and Paladins... look no further. Here's a guide and gameplay from YOIINK thief 8. // media.be/iLLXfTW-MSM..,neutral
5383,Hearthstone,Neutral,7 Looking for a deck table to crush Druids and Paladins... look me no further further. Here'a s is a basic guide to and gameplay for YOIINK thief priest.. youtu. be / e iLLXfTW - i MSM..,neutral
5383,Hearthstone,Neutral,Looking after or kill or crush Druids and Paladins... look even longer. Here's a guide and set for YOIINK thief priest.. youtu.be/iLLXfTW-MSM..,neutral
5384,Hearthstone,Positive,"I don't know what's happening, but this trailer is amazing.",surprise
5384,Hearthstone,Positive,"I don't know what happens, but this trailer is amazing.",surprise
5384,Hearthstone,Positive,"I don't know what's going on, but this trailer is amazing.",surprise
5384,Hearthstone,Positive,"I don't know what's happening, but this trailer is bad.",disgust
5384,Hearthstone,Positive,"I don'Don t know what's happening, but this summer trailer tour is amazing.",surprise
5384,Hearthstone,Positive,"I don't know what's happening, just this trailer was amazing.",surprise
5385,Hearthstone,Neutral,"Thank you for the Felfire Festival goodies @PlayHearthstone! With these, I can create my own festival at home!",joy
5385,Hearthstone,Neutral,Thank you for the Felfire Festival goodies @ PlayHearthstone! With them I can create my own festival at home!,joy
5385,Hearthstone,Neutral,Thanks for Felfire Festival goodies @ PlayHearthstone! With them I can create my own festival at home!,joy
5385,Hearthstone,Neutral,"Thank you for the Felfire mix goodies @PlayHearthstone! With both, I can create my own festival at home!",joy
5385,Hearthstone,Neutral,"Thank Thank you for the Miss Felfire Festival goodies @PlayHearthstone! With these, hopefully I can create my own festival exhibit at our home!",joy
5385,Hearthstone,Neutral,"love you for the Wine Festival and @PlayHearthstone! With these, I can get my own festival at home!",joy
5386,Hearthstone,Negative,I get screwed over so god damn much in hearthstone,anger
5386,Hearthstone,Negative,m screwed up so goddamn much in the heartstone,anger
5386,Hearthstone,Negative,I am being twisted like a hot rock.,disgust
5386,Hearthstone,Negative,I get screwed over so god damn much every hearthstone,anger
5386,Hearthstone,Negative,I get screwed over so much god damn much in red hearthstone,anger
5386,Hearthstone,Negative,will get screwed over so god damn much in hearthstone,anger
5387,Hearthstone,Positive,I can’t stop playing hearthstone and fuck all the resurrection priest decks,anger
5387,Hearthstone,Positive,I can't stop playing Herbstone and fucking all the Resurrection Priest decks,anger
5387,Hearthstone,Positive,I can't stop playing heartstone and fuck all the resurrection priest decks,anger
5387,Hearthstone,Positive,I can’t stop playing Cthulhu and fuck all the resurrection priest decks,anger
5387,Hearthstone,Positive,I can ’ t stop her playing hearthstone tonight and fuck all the bad resurrection priest decks,anger
5387,Hearthstone,Positive,I can’t stop playing hearthstone and fuck all the different chess decks,anger
5388,Hearthstone,Negative,Every time I see this same Hearthstone ad I lose a year off my life,sadness
5388,Hearthstone,Negative,"Every time I see the same Hearthstone ad, I lose a year of my life",sadness
5388,Hearthstone,Negative,"Every time I see the same Heartstone advert, I lose a year of my life",sadness
5388,Hearthstone,Negative,Every time I see this same Hearthstone content I lose a year off my life,sadness
5388,Hearthstone,Negative,28 Every time I see this same Hearthstone ad I lose and a precious year off my life,sadness
5388,Hearthstone,Negative,Every time I see your same Hearthstone ad I eliminate a year off my life,neutral
5389,Hearthstone,Negative,RhandlerR  when i kill reborn minion with flik skyshiv still trigger reborn??? what kind of bullshit is this?. . wherever they are? wtf? come on. literally unplayable pic.twitter.com/Sn674r06jG,anger
5389,Hearthstone,Negative,The RhandlerR  when i kill reborn minion with flik skyshiv still trigger reborn??? what kind of bullshit is this?. . wherever they are? wtf? come on. literally unplayable pic.twitter.com/Sn674r06jG,anger
5389,Hearthstone,Negative,have,neutral
5390,Hearthstone,Positive,Investors should be pleased with the amount of things the company is doing to keep gamblers (who are becoming more and more daily) happy and engaged.,joy
5392,Hearthstone,Negative,Tonight in Discord streaming bad takes:. . My friend from home arguing that Monster Train has the same exact aesthetics as Hearthstone and therefore is nothing spectacular and deserves criticism.,sadness
5392,Hearthstone,Negative,Tonight in Discord you stream bad recordings:... My friend from home argues that Monster Train has the same exact aesthetic as Hearthstone and is therefore nothing spectacular and deserves criticism.,neutral
5392,Hearthstone,Negative,Tonight at Discord streaming bad takes:. My friend from home argues that Train has the same exact aesthetics as Heartstone and therefore is nothing spectacular and deserves criticism.,neutral
5392,Hearthstone,Negative,Tonight in Discord streaming bad ideas:.. My friend comes home arguing that Monster Train has the same exact aesthetics as Hearthstone and therefore is not spectacular and deserves criticism.,surprise
5392,Hearthstone,Negative,Tonight in a Discord streaming bad takes :.. My friend called from home arguing that The Monster Train has the same exact new aesthetics as Hearthstone and therefore here is nothing spectacular about and deserves serious criticism.,sadness
5392,Hearthstone,Negative,Tonight in this streaming bad takes:.. My friend from home remarks that Monster Train is exact same exact aesthetics as Hearthstone and therefore is not spectacular somehow deserves criticism.,surprise
5393,Hearthstone,Neutral,A new video just went up on the TMP YouTube channel!,surprise
5393,Hearthstone,Neutral,A new video has just surfaced on the TMP YouTube channel!,surprise
5393,Hearthstone,Neutral,A new video has appeared on the TMP YouTube channel!,joy
5393,Hearthstone,Neutral,A new video just went up on a TMP YouTube channel!,surprise
5393,Hearthstone,Neutral,A fast new music video just went up on the TMP YouTube channel!,surprise
5393,Hearthstone,Neutral,A new video just went up on my TMP YouTube channel!,surprise
5394,Hearthstone,Positive,Haven’t said this in a long time. But hearthstone is good right now.,neutral
5394,Hearthstone,Positive,"I haven't said that for a long time, but now it's good.",joy
5394,Hearthstone,Positive,"Haven didn't talk about it for a long time, but he's good now.",neutral
5394,Hearthstone,Positive,Haven’t said this at a long time. But hearthstone is precious right now.,neutral
5394,Hearthstone,Positive,Haven’t said this in a long time. This hearthstone is good stuff now.,neutral
5397,Hearthstone,Neutral,"Tune in for off-meta, strange delights curated by @WonkaHS. Help us out by showing off your weird decks here @WonkyDecks . . Keep it weird y'all 🤙.",fear
5397,Hearthstone,Neutral,"Tune in to Off-Meta, Strange Pleasures curated by @ WonkaHS. Help us by showing your Strange Decks here @ WonkyDecks.. Keep it weird y'all.",fear
5397,Hearthstone,Neutral,"Tune in to the meta, weird delights curated by @ WonkyDecks. Help us by showing your weird decks here @ WonkyDecks. Keep it weird and 'all'.",fear
5397,Hearthstone,Neutral,"Tune in for off-meta, strange games curated the @WonkaHS. Seek us out by showing off your classic decks here @WonkyDecks.. Keep it weird y'all 🤙.",fear
5397,Hearthstone,Neutral,"a Tune it in for off - key meta, strange delights currently curated by @WonkaHS. Help us work out by showing names off your weird card decks here @WonkyDecks.. Keep it weird to y'all [UNK].",fear
5397,Hearthstone,Neutral,"Tune in for off-meta, strange<unk> curated about me. Let me out by showing off some weird decks here @WonkaHS.. Keep us weird y'all <unk>.",fear
5398,Hearthstone,Neutral,"HEARTHSTONE DUELS, my internet is cringe twitch.tv/jackmeshell",fear
5398,Hearthstone,Neutral,"HEART STONE DUAL, my internet creeps twitch.tv / jackmeshell",neutral
5398,Hearthstone,Neutral,"ARTHSTON, my internet is tch.tv / jackmeshell",neutral
5398,Hearthstone,Neutral,"HEARTHSTONE DUELS, my internet is cringe twitch.tv/jackmeshell",fear
5398,Hearthstone,Neutral,will,neutral
5399,Hearthstone,Positive,"A lot of you are new since the last couple Hearthstone expansions (. ) but for any of you that may be huge deck builder fans like me, @Tempo_Storm’s digital deck builder is really shaping up! The video is long, but super insightful 4 those who are just starting 2 pay attention .",neutral
5399,Hearthstone,Positive,"Many of you are new since the last two Hearthstone expansions (.), but for anyone who may be big deck builder fans like me, @ Tempo _ Sturms digital deck builder is in the making! The video is long but super insightful 4 those just starting out with 2 pay attention.",neutral
5399,Hearthstone,Positive,"Many of you are new since Hearthstone's latest extensions (.), but for any of you who may be huge fans of a deck builder like me, the @ _ Storm digital deck builder is really gaining momentum! The clip is long but super shrewd 4 those who are just starting 2 pay attention.",neutral
5399,Hearthstone,Positive,"A couple of you are new watching the last couple Hearthstone expansions (. ) but for any of you that may enjoy huge deck builder fans like us, @Tempo_Storm’s digital deck builder is really shaping up! The video is brief, but super insightful 4 those who are just starting 2 pay attention.",joy
5399,Hearthstone,Positive,"the lot of you are new since your last couple Hearthstone expansions (. ) but for any among you that may be huge ship builder<unk> like me, @Tempo_Storm’s digital deck builder is really stepping up! My video is long, yet super insightful should members who are just starting 2 pay attention.",neutral
5400,Hearthstone,Positive,"Hey, just a reminder that if you've not played Hearthstone for aaaaaaaaaaages it's worth popping on now to get a free deck of the latest and greatest cards!",neutral
5400,Hearthstone,Positive,"Hey, just a reminder that if you haven't played Hearthstone for a long time, it's worth stopping by now to get a free deck of the latest and greatest cards!",neutral
5400,Hearthstone,Positive,"Hey, just a reminder that if you haven't played Hearthstone for aaaaaaaaaages, it's worth going now to get a free deck of the last and greatest cards!",neutral
5400,Hearthstone,Positive,"Hey, just gentle reminder that if you've not played Hearthstone on aaaaaaaaaaages it's worth popping on now to get a free deck of the latest and great cards!",neutral
5400,Hearthstone,Positive,"Hey, just a reminder that... if you've not played Hearthstone once for many aaaaaaaaaaages it's worth popping on by now than to get a free new deck Full of the very latest and greatest cards!",neutral
5400,Hearthstone,Positive,"Hey, just a note that after you've not played Bingo for aaaaaaaaaaages it's worth skipping on at all get a free deck of the oldest and greatest cards!",joy
5401,Hearthstone,Positive,Loving the upcoming bg changes this was pretty much spot on. . Only thing i dont understand is djini to tavern 5 and lilrag to 6 ? Maybe someone can ellaborate on this djini always felt underated to me. . props to @PlayHearthstone for the constant bg updates. . playhearthstone.com/en-us/news/235…,sadness
5401,Hearthstone,Positive,The only thing I don't understand is that djini is on Tavern 5 and lilrag is on 6? Maybe someone can work on this djini that has always felt under-challenged towards me.. Props to @ PlayHearthstone for the constant bg updates.. playhearthstone.com / en-us / news / 235...,fear
5401,Hearthstone,Positive,The only thing I don't understand is that genie is up to 5 and lilrag is up to 6? Maybe someone can ellaborate on this genie always felt undervalued to me... props to @ PlayHearthstone for constant updates bg... playheartstone.com / en-us / news / 235...,sadness
5401,Hearthstone,Positive,Loving the upcoming bg changes this was pretty much spot on.. One problem i dont understand.. djini to tavern 5 and lilrag<unk> 6? Maybe someone can ellaborate on because djini always felt underated to test.. props to @PlayHearthstone for constantly constant bg updates.. playhearthstone.com/en-us/news/235…,sadness
5401,Hearthstone,Positive,Loving the upcoming bg changes then this was pretty much spot on.. Only two thing i dont understand is djini to tavern 5 and lilrag to 6? Maybe someone else can ellaborate on this djini this always felt underated to me.. props to Thank @PlayHearthstone for the constant bg updates.. will playhearthstone. com / a en - v us / news / December 235 …,surprise
5401,Hearthstone,Positive,Loving the upcoming bg changes this was pretty much right on.. Only thing i dont say is djini to tavern vs the lilrag to 6? wish someone can ellaborate on this djini always felt better on 6.. props to @PlayHearthstone doing the constant bg fix.. playhearthstone.com/en-us/news/235...,joy
5402,Hearthstone,Neutral,It is not the first time that the EU Commission has taken such a step.,neutral
5402,Hearthstone,Neutral,"At the same time, despite the fact that there are currently some 100 million people living below the poverty line, most of them do not have access to health services and do not have access to health care, while most of them do not have access to health care.",neutral
5404,Hearthstone,Positive,The Angry Chicken is back! Talking all the  . . twitch.tv/amovetv/ https://t.co/UFqtvLtjbh,neutral
5404,Hearthstone,Positive,The angry chicken is back!. twitch.tv / amovetv / https: / / t.co / UFqtvLtjbh,anger
5404,Hearthstone,Positive,The angry chick is back! Conversation all...............................................................................................................................................................................................................................................,anger
5404,Hearthstone,Positive,The Angry Chicken is back! Talking all the  . . twitch.tv/amovetv/ RhttpR],neutral
5404,Hearthstone,Positive,See The Angry Chicken is back! Talking all the  . . twitch.tv/amovetv/ RhttpR],joy
5405,Hearthstone,Positive,Man @PlayHearthstone batte mode was very tough and i love it^^ barely made first out of many attempts pic.twitter.com/VAYK5uNZb8,fear
5405,Hearthstone,Positive,Man @ PlayHearthstone batte mode was very hard and I love it ^ ^ barely made the first of many attempts pic.twitter.com / VAYK5uNZb8,joy
5405,Hearthstone,Positive,Man @ PlayHearthstone mode was very tough and I love it ^ ^ barely made the first of many attempts pic.facebook.com / VAYK5uNZb8,joy
5405,Hearthstone,Positive,Man RhandlerR batte mode was very tough and i love it^^ barely made first out of many attempts pic.twitter.com/VAYK5uNZb8,surprise
5405,Hearthstone,Positive,2015 Man RhandlerR batte mode was very tough and i love it^^ barely made first out of many attempts pic.twitter.com/VAYK5uNZb8,surprise
5406,Hearthstone,Neutral,Check out: Hearthstone Duels Deck by @SpiralHS.. @SpiralHS reached 12 Wins with this Priest Starter Deck.. . .  Deck Code and more:. hearthstone-decks.net/hearthstone-du…. .,joy
5406,Hearthstone,Neutral,"Check out the Hearthstone Duels Deck from @ SpiralHS.. @ SpiralHS, which has scored 12 victories with this Priest Starter Deck... Deckcode and more:. hearthstone-decks.net / hearthstone-du.....",joy
5406,Hearthstone,Neutral,Check out: Hearthstone Duels Deck by @ SpiralHS.. @ SpiralHS reached 12 Win with this Past Starter Deck... Deck Code and more:. heartstone-Fes.net / heartstone-du....,surprise
5406,Hearthstone,Neutral,Check out: Hearthstone Duels Edition on @SpiralHS.. @SpiralHS reached 12 Wins with this Priest Starter Deck....  Win Code and more:. player-decks.net/hearthstone-du…..,joy
5406,Hearthstone,Neutral,Last Check out : by Hearthstone House Duels Deck by @SpiralHS.. @SpiralHS reached 12 Wins with Find this Priest Starter Deck.... This Deck Number Code includes and two more :. hearthstone - decks. net / page hearthstone - deck du …..,surprise
5406,Hearthstone,Neutral,Check out: Hearthstone Duels Deck from @SpiralHS.. @SpiralHS reached the stars with this 5 deck deck.... 10 8 and more:. 12-decks.net/hearthstone-du.....,neutral
