id,topic,sentiment,tweet,emotion_label
5442,Hearthstone,Positive,Had a great Hearthstone stream today! Thanks too much Vince for the raid. Thanks @Kain0025 and @gamingpleasures for the bitties! And please Rusty for staying up and chatting!.. I hope to keep streaming regularly... Watch out for co-streams w/ @velonese002 coming soon!,joy
5442,Hearthstone,Positive,Had a great Hearthstone data stream tonight today! Thanks thanks so much... @Kain0025 for the whole raid. Thanks @gamingpleasures and @velonese002 for the bitties! And thanks @ColTrysToWrite for hanging us out and chatting!.. and I sure hope even to keep streaming you regularly... Watch out for co - streams w / @Cofu_ coming soon!,joy
5442,Hearthstone,Positive,Had a great Hearthstone stream day! Thanks go be @Kain0025 for the raid. Thanks @gamingpleasures and @velonese002 for hosting bitties! Same thanks @ColTrysToWrite for hanging all and chatting!.. I decided to keep streaming regularly... branch out and co-streams w/ @Cofu_ hopefully soon!,joy
5444,Hearthstone,Positive,I miss Hearthstone and Overwatch lol,sadness
5444,Hearthstone,Positive,I miss Hearthstone and Overwatch lol,sadness
5444,Hearthstone,Positive,I miss Hearthstone and Overwatch lol,sadness
5444,Hearthstone,Positive,I miss Hearthstone and Overwatch :(,sadness
5444,Hearthstone,Positive,I definitely miss Hearthstone and Overwatch do lol,sadness
5444,Hearthstone,Positive,I miss Hearthstone of Overwatch lol,sadness
5445,Hearthstone,Negative,What a shame? . .,disgust
5445,Hearthstone,Negative,What a shame?..,disgust
5445,Hearthstone,Negative,What a shame.,disgust
5445,Hearthstone,Negative,What a shame?...,disgust
5445,Hearthstone,Negative,What a peculiar shame?..,disgust
5445,Hearthstone,Negative,What this shame?..,disgust
5447,Hearthstone,Positive,Really enjoyed the @TheCantelope,joy
5447,Hearthstone,Positive,Really enjoyed @ TheCantelope,joy
5447,Hearthstone,Positive,Really enjoyed the @ TheCantelope,joy
5447,Hearthstone,Positive,Really enjoyed the game,joy
5447,Hearthstone,Positive,Really enjoyed the Club @TheCantelope,joy
5447,Hearthstone,Positive,Really buy the @TheCantelope,neutral
5448,Hearthstone,Neutral,Play with @PtitDrogo and @BlyOnFire starting at 19 CEST TODAY and get a chance to win awesome prizes from our merch store AND a @Pl4ZMAcom Gaming Booster!. . Sounds like a good deal? . . Then join our discord at: discord.gg/NaKhTps. . Tomorrow: Hearthstone with @RYE_Viper https://t.co/jKxixjCo29,neutral
5448,Hearthstone,Neutral,Play with @ PtitDrogo and @ BlyOnFire from 7pm EDT TODAY and get a chance to win fantastic prizes in our merch store and an @ Pl4ZMAcom gaming booster!.. Sounds like a good deal?.. Then join our quarrel at: discord.gg / NaKhTps... Tomorrow: Hearthstone with @ RYE _ Viper https: / / t.co / jKxixjCo29,anger
5448,Hearthstone,Neutral,Play with @ PtitDrogo and @ BlyOnFire starting at 19 CEST TODAY and get a chance to win amazing prizes in our merch store AND a @ Pl4Z.com Gaming Booster!... Solike a good deal?... Then join us at discord.gg / NaKHTps.. Tomorrow: Hearthstone with @ RYE _ Viper https: / / co / jKxim Co29,neutral
5448,Hearthstone,Neutral,Play on @PtitDrogo and @BlyOnFire starting at 19 CEST TODAY and get a chance to win awesome prizes on our merch store AND a Hearthstone Gaming Booster!.. Sounds of the good deal?.. Then join up discord at: discord.gg/NaKhTps.. Tomorrow: Hearthstone [ @Pl4ZMAcom https://t.co/jKxixjCo29],neutral
5448,Hearthstone,Neutral,Play with with @PtitDrogo and @BlyOnFire starting at the 19 CEST TODAY and get a chance tonight to win awesome prizes from our Sunday merch store and AND get a @Pl4ZMAcom Gaming Booster!.. 5 Sounds like a good game deal?.. Then we join our discord program at : discord. gg / NaKhTps.. Tomorrow : Hearthstone with @RYE_Viper https://t.co/jKxixjCo29 ],neutral
5448,Hearthstone,Neutral,gate with @PtitDrogo at @BlyOnFire starting at 19 CEST TODAY and get a chance to brand awesome items from our merch store AND get @Pl4ZMAcom Gaming Certificate!.. Sounds like another good deal?.. Then join their discord tomorrow: 100.gg/NaKhTps.. Tomorrow: Hearthstone with @RYE_Viper https://t.co/jKxixjCo29],neutral
5449,Hearthstone,Negative,I'm calling it now: that new yogg-saron in hearthstone will be meta and people are gonna be really angry about it because it sounds absolutely miserable to play against,sadness
5449,Hearthstone,Negative,I'll call it now: this new yogg saron in the hearthstone is going to be meta and people are going to be really angry about it because it sounds absolutely miserable to play against.,sadness
5449,Hearthstone,Negative,I call it now: the new yogi saron in hot stone will be meta and people will be very angry with him because he sounds absolutely capable of playing against,anger
5449,Hearthstone,Negative,I'm calling it now: that new yogg-saron in hearthstone will come meta and people<unk> gonna be really angry about it because it<unk> absolutely miserable to play against,anger
5449,Hearthstone,Negative,I'm just calling for it now : that new yogg - saron in hearthstone play will be meta and people are gonna certainly be really angry about getting it because clearly it actually sounds absolutely miserable to play against,sadness
5449,Hearthstone,Negative,I'm doing it bullshit: that new yogg-saron in hearthstone will be meta and people are gonna be so angry about it because it feels absolutely miserable to write against,sadness
5450,Hearthstone,Neutral,Anyone that plays a bad luck albatross deck in hearthstone is a literal cop. . . Fucking fun police. pic.twitter.com/jY6TRq351e,anger
5450,Hearthstone,Neutral,Anyone playing an unfortunate albatross in Hearthstone is literally a cop... damn funny police. pic.twitter.com / jY6TRq351e,surprise
5450,Hearthstone,Neutral,Anyone who plays an unlucky albatross on deck in Hertstone is a literary cop.... Fucking fun police. pic.facebook.com / jY6TRq351e,anger
5450,Hearthstone,Neutral,Anyone that plays a bad luck albatross deck in hearthstone is a literal cop. . . Fucking fun police. pic.twitter.com/jY6TRq351e,anger
5450,Hearthstone,Neutral,PC Anyone that plays a bad luck albatross deck in hearthstone is a literal cop. . . Fucking fun police. pic.twitter.com/jY6TRq351e,anger
5451,Hearthstone,Positive,Acolyte and Leeroy will be missed most,sadness
5451,Hearthstone,Positive,Akolyte and Leeroy will be missed the most,sadness
5451,Hearthstone,Positive,Acolitis and Leroy to be missed most,sadness
5451,Hearthstone,Positive,Acolyte and Leeroy will be injured most,sadness
5451,Hearthstone,Positive,their Acolyte and Leeroy will just be missed most,sadness
5451,Hearthstone,Positive,Acolyte and Pastor will be missed most,sadness
5452,Hearthstone,Positive,"Playing and streaming Hearthstone again is honestly fucking amazing!. When I stopped it threw my streams into a slump, and it looks like it was the only thing that could actually take me out of it too",surprise
5452,Hearthstone,Positive,"Playing and streaming Hearthstone again is really damn amazing! When I stopped playing it, it sent my flows into a trough, and it looks like it was the only thing that could really get me out of that trough.",surprise
5452,Hearthstone,Positive,"Playing and streaming Hearthstone again honestly fucking amazing!. When I stopped, it threw my streams into the mud, and it seems like that was the only thing that could actually get me out of it too.",surprise
5452,Hearthstone,Positive,"Playing and enjoying Hearthstone again is honestly fucking amazing!. When I stopped it forced my streams into a slump, and it looks like it was the only thing that may actually take me out of it too",surprise
5452,Hearthstone,Positive,"Playing and streaming Hearthstone again is honestly being fucking insane amazing!. I When I stopped it threw my endless streams into a big slump, and it looks like it was hitting the only thing right that could actually take me out of it alone too",surprise
5452,Hearthstone,Positive,"Playing and streaming Hearthstone again feels honestly fucking amazing!. When I stopped it threw my streams into my slump, and it felt like it was the only stuff that helped actually take me back of it too",surprise
5453,Hearthstone,Negative,J @Blizzard_Ent,neutral
5454,Hearthstone,Neutral,"I will say that playing a Hearthstone PTQ last weekend made me appreciate Magic organized play from the PT-level down, even with its consistent disappointments above that",joy
5454,Hearthstone,Neutral,"I will say that playing a Hearthstone PTQ last weekend made me appreciate Magic's organized game from PT level down, even with its consistent disappointments about it.",joy
5454,Hearthstone,Neutral,"I'll say that playing at Heartstone PTQ last weekend made me appreciate the organised Magic game from PT level onwards, even with its constant disappointments above that.",joy
5454,Hearthstone,Neutral,"I will say that playing a Hearthstone PTQ one Saturday made me appreciate Magic organized play from the PT-level down, even with its consistent disappointments above :)",joy
5454,Hearthstone,Neutral,"Yet I will say that playing a Hearthstone IV PTQ last weekend made me intensely appreciate Magic Workshop organized play from the PT - level point down, even with its consistent major disappointments above that",joy
5454,Hearthstone,Neutral,"I will say that playing a Hearthstone PTQ last weekend made me better enjoyment at play from that PT-level down, compared with its consistent disappointments above that",joy
5455,Hearthstone,Negative,Fucking imba this demon hunter,anger
5455,Hearthstone,Negative,Fuck imba this demon hunter,anger
5455,Hearthstone,Negative,"Damn, imba this devilish hut!",anger
5455,Hearthstone,Negative,Fucking adore this demon hunter,anger
5455,Hearthstone,Negative,Fucking imba this demon god hunter,anger
5455,Hearthstone,Negative,Fucking imba<unk> demon hunter,anger
5457,Hearthstone,Positive,"Tweet tweet. One bundle please, thank you!",joy
5457,Hearthstone,Positive,"Tweet: A bundle please, thank you!",joy
5457,Hearthstone,Positive,tweeted.,neutral
5457,Hearthstone,Positive,"Tweet tweet. One bundle please, thank everyone!",joy
5457,Hearthstone,Positive,"Tweet tweet. org One bundle please, a thank you!",neutral
5457,Hearthstone,Positive,"one tweet. One bundle please, thank you!",joy
5458,Hearthstone,Positive,"After 5 years, I finally did it. Oh my gawd @PlayHearthstone you are looking so good rn pic.twitter.com/wyuBUF0fiH",surprise
5458,Hearthstone,Positive,"After 5 years I finally made it. Oh my look @ PlayHearthstone, you look so good rn pic.twitter.com / wyuBUF0fiH",surprise
5458,Hearthstone,Positive,"Oh my gawd @ PlayHearthstone, you look so good.",surprise
5458,Hearthstone,Positive,"After 5 years, I finally did it. Oh my gawd RhandlerR you are looking so good rn pic.twitter.com/wyuBUF0fiH",surprise
5458,Hearthstone,Positive,"V After 5 years, I finally did it. Oh my gawd RhandlerR you are looking so good rn pic.twitter.com/wyuBUF0fiH",surprise
5459,Hearthstone,Neutral,"Congrats! Also, you made me remember something about DoD, in the trailer we saw Sindragosa, and we didn't get her in the set, I wonder if she was included and then removed for other dragon",surprise
5459,Hearthstone,Neutral,"Congratulations! You also reminded me of something about DoD, in the trailer we saw Sindragosa, and we didn't get her into the set, I wonder if she was there and then removed for other dragons.",surprise
5459,Hearthstone,Neutral,"Congratulations! Also, you made me remember something about the Ministry of Defence, we saw Sindragova in the trailer and we didn't take her on set, I wonder, we turned her on, and then filmed her for another dragon.",surprise
5459,Hearthstone,Neutral,"Congrats! Anyway, you made me realize something about DoD, and the trailer we saw Sindragosa, and we didn't get her in the set, I wonder if she was included and then removed for logistics dragon",surprise
5459,Hearthstone,Neutral,"Congrats! Also, you made me remember something else about the DoD, how in the trailer we once saw Sindragosa, and we didn't get her back in the set, I wonder if only she was included and then removed looking for each other a dragon",surprise
5459,Hearthstone,Neutral,"Congrats! Also, you made me worry something about DoD, in the trailer we saw Sindragosa, why we didn't show her in the screen, I forget if she there included and then removed for other people",surprise
5461,Hearthstone,Neutral,"Weapon sunsetting is the best news I've heard in a long time. Those of you that play any multi season game with any strategy involved should know this is needed. I can relate this to my days of playing MTG and Hearthstone. . . This will bring more versatile, creative builds and",neutral
5461,Hearthstone,Neutral,"Sunset of Arms is the best news I have heard in a long time. Those of you who play any multiyear game with any strategy should know that this is necessary. I can relate this to my days playing MTG and Hearthstone... This will bring more versatile, more creative buildings.",neutral
5461,Hearthstone,Neutral,Weipon's demise is the best news I have heard in a long time. Those of you who play any multi-season game with any strategy involved should know that this is necessary.,neutral
5461,Hearthstone,Neutral,"Weapon sunsetting is the best feature I've heard in a long time. Most of you that play any multi season game with any strategy involved should know this is amazing. I can relate it to my days of playing MTG and Hearthstone.... This will bring more versatile, creative builds and",surprise
5461,Hearthstone,Neutral,"Weapon sunsetting is the worst news I've heard in its long time. Those of all that play any multi character game with any strategy involved should know this is needed. I should relate this since my days of playing MTG and Hearthstone... This will bring more focused, aggressive teams and",disgust
5464,Hearthstone,Positive,Yogg Saron’s Puzzle Box is quite possibly my favorite card in the game.  Secrets and Puzzle Box make for truly crazy insane WTF moments.  So fun even when it’s a shitshow.  🤣,joy
5464,Hearthstone,Positive,"Yogg Saron's Puzzle Box is probably my favorite card in the game. Mysteries and Puzzle Box make for really crazy crazy WTF moments. So fun, even if it's a shitshow.",surprise
5464,Hearthstone,Positive,Puzzbox by Yogi Saron is probably my favorite card in the game.,joy
5464,Hearthstone,Positive,Yogg um Puzzle Box is quite obviously my favorite card in the game.  Secrets and Puzzle Box allows for truly crazy insane WTF moments.  So fun for when it’s a shitshow.  ​,fear
5464,Hearthstone,Positive,Yogg Saron ’ and s Puzzle Box is quite possibly my favorite card in completing the game. Secrets and Puzzle Box Box make for truly crazy and insane romantic WTF moments. So far fun even better when it ’ s all a shitshow. [UNK],joy
5464,Hearthstone,Positive,Yogg Saron’s Puzzle Box became definitely possibly my favorite card in the alphabet. Secrets and Puzzle games make for hilarious crazy insane WTF moments. Good fun even when it’s 100% shitshow. <unk>,joy
5465,Hearthstone,Positive,I'm getting addicted to Hearthstone. Oh noess,surprise
5465,Hearthstone,Positive,I get hooked on Hearthstone.,neutral
5465,Hearthstone,Positive,I get a supplement for Hearthstone.,neutral
5465,Hearthstone,Positive,I'm getting addicted by Hearthstone. Oh noess,surprise
5465,Hearthstone,Positive,I's m obviously getting addicted to Hearthstone. Oh noess,surprise
5465,Hearthstone,Positive,that'm getting addicted to Hearthstone. Oh so,surprise
5466,Hearthstone,Positive,Hearthstone goes livest how difficult EverQuest Network,neutral
5466,Hearthstone,Positive,Hearthstone thrives on how difficult EverQuest Network is,neutral
5466,Hearthstone,Positive,Heartstone Continues to Live How Hard EverQuest Network Is,neutral
5466,Hearthstone,Positive,Hearthstone goes livest how difficult things Network,neutral
5466,Hearthstone,Positive,Hearthstone goes its livest and how difficult EverQuest Network,neutral
5466,Hearthstone,Positive,Hearthstone goes for how difficult EverQuest Network,neutral
5467,Hearthstone,Neutral,and  . . Playing  . . twitch.tv/MorningStarGG. . Get  . .  . RhandlerR,neutral
5469,Hearthstone,Neutral,TwitchHost: RT NadieauxStreams: Happy Friyay.  Chattting and music exchange. Hearthstone& Chill . if ur an artist wanting to promo your music drop by! Twitch.tv/nadieaux .  TwitchHost SupportStreamz,joy
5469,Hearthstone,Neutral,"TwitchHost: RT NadieauxStreams: Happy Friyay. Chat and Music Exchange. Hearthstone & Chill. if an artist wants to promote your music, drop by! Twitch.tv / nadieaux. TwitchHost SupportStreamz",joy
5469,Hearthstone,Neutral,Hearthstone & Chill: RT NaauxStreams: Happy Friyay. Chatting and music exchange. Hearthstone & Chill.,joy
5469,Hearthstone,Neutral,TwitchHost: RT NadieauxStreams: Happy Monday.  Chattting and music exchange. Hearthstone& Chill. if ur an expert wanting to talk your music stop by! Twitch.tv/nadieaux 20  TwitchHost SupportStreamz,joy
5469,Hearthstone,Neutral,Interview TwitchHost : London RT NadieauxStreams : Happy Friyay. Chattting radio and music magazine exchange. Hearthstone & Chill. if ur an aspiring artist now wanting to promo watch your music drop by! Twitch. net tv / no nadieaux. html TwitchHost SupportStreamz,joy
5469,Hearthstone,Neutral,TwitchHost: RT NadieauxStreams: Happy Child. Easy to music play. Dance& Chill. if ur to anyone wanting to use your music drop by! Twitch.tv/nadieaux. TwitchHost with,joy
5470,Hearthstone,Negative,This is not even fair. Guardian Druid. youtu.be/vRnEvnLcov8,anger
5470,Hearthstone,Negative,This is not even fair. Guardian Druid. youtu.be / vRnEvnLcov8,anger
5470,Hearthstone,Negative,This is not even fair. Guardian Druiyoutu.be / vRnEvnLcov8,anger
5470,Hearthstone,Negative,This are not even fair. Guardian News. youtu.be/vRnEvnLcov8,anger
5470,Hearthstone,Negative,This is clearly not even considered fair. Guardian for Druid. v youtu. v be / vRnEvnLcov8,neutral
5470,Hearthstone,Negative,writing is not even right. Dragon Druid. youtu.be/vRnEvnLcov8,neutral
5471,Hearthstone,Negative,Rogue needs to be nerfed. Only doing quests in HS till they fix that class. Extremely frustrating to play against. @PlayHearthstone,sadness
5471,Hearthstone,Negative,Only quests to complete in HS until they fix this class. Extremely frustrating to play against. @ PlayHearthstone,sadness
5471,Hearthstone,Negative,Only by doing a quest in HS till do they fix this class.,neutral
5471,Hearthstone,Negative,Rogue needs to be nerfed. Only doing quests in HS till they fix that list. Extremely boring to play against. @PlayHearthstone,sadness
5471,Hearthstone,Negative,Each Rogue needs to now be nerfed. Only doing quests in HS till... they fix that class. Extremely damn frustrating ones to even play against. @PlayHearthstone,sadness
5471,Hearthstone,Negative,really needs to have nerfed. Only doing quests in HS till they fix her class. Extremely frustrating to play against. Un,sadness
5473,Hearthstone,Neutral,YOUR PATHETIC Freeze Cannot Stop MY MINIONS | Hearthstone Daily Moments Ep.1465 gameforce.jp/hearthstone%e3… https://t.co/H0Q9zjH8GF,neutral
5473,Hearthstone,Neutral,YOUR PATHETIC Freezing Cannot Stop MY MINIONS | Hearthstone Daily Moments Ep.1465 gameforce.jp / hearthstone% e3... https: / / t.co / H0Q9zjH8GF,neutral
5473,Hearthstone,Neutral,YOUR PATHETIC Freeze Cannot Stop MY MINIONS Hearthstone Daily Moments Ep.1465 gameforce.jp / heartstone% e3...,neutral
5473,Hearthstone,Neutral,YOUR PATHETIC Freeze Cannot Stop MY MINIONS | Hearthstone Daily Moments 78.1465 screenshot.jp/hearthstone%e3…<unk>],neutral
5473,Hearthstone,Neutral,YOUR PATHETIC Freeze Cannot... Stop MY Story MINIONS | Hearthstone THE Daily Great Moments Project Ep. The 1465 gameforce. jp / The hearthstone % 20 e3 files … https://t.co/H0Q9zjH8GF ],neutral
5473,Hearthstone,Neutral,a PATHETIC Freeze Cannot Stop MY MINIONS | Rules for Reality Game.1465 gameforce.jp/hearthstone%e3...<unk>],neutral
5474,Hearthstone,Positive,hearthstonetopdecks.com/decks/meta-bre…  @G2Thijs  @PlayHearthstone  @HSesports  @Hearthpwn  @tylerootd  @RYE_Viper   This deck beats demon hunters :) i just made it in the first day and it works very well,joy
5474,Hearthstone,Positive,hearthstonetopdecks.com / decks / meta-bre... @ G2Thijs @ PlayHearthstone @ HSesports @ Hearthpwn @ tylerootd @ RYE _ Viper This deck beats demon hunters:) I just made it on the first day and it works very well,joy
5474,Hearthstone,Positive,heartstonetopress.com / decs / meta-bre... @ G2Thijs @ PlayHearthstone @ HSespone @ Hearthpwn @ tyood @ RYE _ Viper,neutral
5474,Hearthstone,Positive,"hearthstonetopdecks.com/decks/meta-bre…  @G2Thijs  @PlayHearthstone , ??  @HSesports  @Hearthpwn   This list beats demon hunters :) i just made it in the first time and it does incredibly well",joy
5474,Hearthstone,Positive,hearthstonetopdecks. v com / the decks / meta - p bre and … @G2Thijs 01 @PlayHearthstone @HSesports @Hearthpwn 1 @tylerootd @RYE_Viper This deck beats demon hunters : ) i had just made it in from the first day and know it somehow works very well,joy
5474,Hearthstone,Positive,hearthstonetopdecks.com/decks/meta-bre... @G2Thijs @PlayHearthstone @HSesports @Hearthpwn means this This means no demon face :) i just installed it in the third day and yeah works very bad,sadness
5476,Hearthstone,Neutral,Hearthstone DUELS firstplay thru.  I am BAD dont judge! '!sr' song requests up Drankin'! Dont feel alone! twitch.tv/ALPHAinNJ1,sadness
5476,Hearthstone,Neutral,Hearthstone DUELS first play thru. I am BAD dont Judge! '! sr' song requests up Drankin '! Dont feel alone! twitch.tv / ALPHAinNJ1,sadness
5476,Hearthstone,Neutral,Hearthstone ELS first play thru. I am BAD dont judge! '! sr'song requests up Drankin'! Dont feel alone! tch.tv / ALPHAinNJ1,sadness
5476,Hearthstone,Neutral,Hearthstone DUELS firstplay thru.  I am BAD dont judge! '!sr' song requests up Drankin'! Dont feel alone! twitch.tv/ALPHAinNJ1,sadness
5476,Hearthstone,Neutral,Current Hearthstone DUELS firstplay thru.  I am BAD dont judge! '!sr' song requests up Drankin'! Dont feel alone! twitch.tv/ALPHAinNJ1,sadness
5477,Hearthstone,Positive,Good stream tonight. Jumped back into Arena after a couple bad Druid losses on ladder and got 6 wins with Demon Hunter. Big thanks to PandaHulk for cooping. Bonus stream tomorrow afternoon with @ckeckholm is at work. Hope you'll join us if you're free.,joy
5477,Hearthstone,Positive,Good stream tonight. Jump back into the arena after a couple of bad druid losses on the ladder and get 6 wins with Demon Hunter. Big thanks to PandaHulk for his co-oping. Bonus stream tomorrow afternoon with @ ckeckholm is at work. Hope you join us when you are free.,joy
5477,Hearthstone,Positive,Good flow tonight. Jimmy is back at the Arena after a couple of disappointing defeats by the Druids on the ladder and 6 wins with Demon Hunter. Thanks a lot to PandaHulk for cooping. Bonus stream tomorrow afternoon with @ ckecholm working. Hope you join us if you're free.,joy
5477,Hearthstone,Positive,Good stream tonight. Jumped back into Arena after a couple bad Druid losses on ladder and got 6 wins with Demon Hunter. Big thanks to PandaHulk worth cooping. Bonus stream tomorrow afternoon with @ckeckholm is pretty work. Hope you'll stop my – you're free.,joy
5477,Hearthstone,Positive,Good stream later tonight. Jumped me back into 3 Arena Square after going a couple bad East Druid losses and on ladder and got 6 wins alone with Demon Hunter. Big thanks thanks to PandaHulk for cooping. Bonus stream early tomorrow afternoon with @ckeckholm is at work. Hope you'll join us if you're free.,joy
5477,Hearthstone,Positive,Good stream ever. Jumped back into Arena with a couple bad few losses on ladder and got 6 wins with Demon Kings. So thanks to PandaHulk for cooping. Bonus stream tomorrow playing with @ckeckholm is at work. Hope you'll hang in after you're free.,joy
5478,Hearthstone,Neutral,"Shifty Sophomore, Smug Senior, and Fishy Flyer revealed for Hearthstone’s Scholomance Academy expansion dlvr.it/RcdY5c https://t.co/rnkH5YVDPn",neutral
5478,Hearthstone,Neutral,"Shifty Sophomore, Smug Senior and Fishy Flyer for Hearthstone Scholomance Academy Expansion Unveiled dlvr.it / RcdY5c https: / / t.co / rnkH5YVDPn",neutral
5478,Hearthstone,Neutral,"Shifty Sophomore, Smug Senior and Fishy Flyer showed up for Hearthstone's Scholomance Academy dr.it / RcdY5c",neutral
5478,Hearthstone,Neutral,"Shifty Sophomore, Smug mer, and Fishy Flyer revealed for Hearthstone’s new Academy expansion<unk>.it/RcdY5c 9]",neutral
5478,Hearthstone,Neutral,"Shifty the Sophomore, Dark Smug Boy Senior, Junior and Chief Fishy Flyer revealed for Hearthstone Productions ’ s Scholomance Academy expansion which dlvr. is it / RcdY5c and https://t.co/rnkH5YVDPn ]",neutral
5478,Hearthstone,Neutral,"for Sophomore, Smug Dog, and Ghost Flyer icons for interactive Creative Academy www dlvr.it/RcdY5c https://t.co/rnkH5YVDPn]",neutral
5479,Hearthstone,Negative,Man nothing makes me feel dumber than trying to play hearthstone,sadness
5479,Hearthstone,Negative,Man doesn't make me feel dumber than trying to play Herdstein,sadness
5479,Hearthstone,Negative,Nothing makes me feel stupider than trying to play the stumbling block,joy
5479,Hearthstone,Negative,Man nothing leaves me feel dumber than trying to play hearthstone,sadness
5479,Hearthstone,Negative,I Man nothing once makes me feel dumber than trying to play hearthstone,sadness
5479,Hearthstone,Negative,Man nothing makes me feel dumber than how to change hearthstone,sadness
5480,Hearthstone,Negative,king shit 🥺🥺🥺🥺🥺,anger
5480,Hearthstone,Negative,King's shit,disgust
5480,Hearthstone,Negative,king shit,anger
5480,Hearthstone,Negative,king<unk> 🥺🥺🥺🥺🥺,neutral
5480,Hearthstone,Negative,king bastard shit [UNK],anger
5480,Hearthstone,Negative,king one <unk>,neutral
