id,topic,sentiment,tweet,emotion_label
2925,Dota2,Positive,remember them.,neutral
2927,Dota2,Neutral,Shoutout to this cool dude for watching all 5 games of the grand final in the regular crowd redd.it/euds2e,neutral
2927,Dota2,Neutral,Shout out to this cool guy for watching all 5 games of the grand final in the regular crowd redd.it / euds2e,joy
2927,Dota2,Neutral,Shout out to this cool dude for watching all 5 games of the grand final in the usual crowd redd.it / eu2e,joy
2927,Dota2,Neutral,Shoutout to every cool dude in watching all 5 games of the grand final in the regular crowd redd.it/euds2e,anger
2927,Dota2,Neutral,Shoutout to this cool dude for watching all 5 games of the grand final came in as the regular week crowd of redd. love it / euds2e,joy
2927,Dota2,Neutral,Shoutout to this cool fan for watching all 5 games of the series plan in the regular channel redd.it/euds2e,neutral
2928,Dota2,Neutral,Supports aren’t getting enough love in,neutral
2928,Dota2,Neutral,Supporters don't get enough love,sadness
2928,Dota2,Neutral,Suppliers lack the love in,neutral
2928,Dota2,Neutral,Supports on getting enough love in,neutral
2928,Dota2,Neutral,Supports we aren ’ t getting enough love in,sadness
2928,Dota2,Neutral,Supports aren’t getting new love in,neutral
2929,Dota2,Negative,Servers are crashing in game now......... WTF Valve?,surprise
2929,Dota2,Negative,Servers crash in-game now... WTF Valve?,surprise
2929,Dota2,Negative,Servers are crashing in game now......... WTF Valve?,surprise
2929,Dota2,Negative,Servers are crashing in game because WTF Valve?,anger
2929,Dota2,Negative,Web Servers are all crashing in game play now......... WTF ON Valve?,surprise
2934,Dota2,Positive,"Nice update gaben , very nice",joy
2934,Dota2,Positive,"Nice update, very nice",joy
2934,Dota2,Positive,"Nice update, very nice",joy
2934,Dota2,Positive,"Nice e gaben, very nice",joy
2934,Dota2,Positive,"Nice little gaben, very nice",joy
2935,Dota2,Negative,Delete techies pls fck u @DOTA2,anger
2935,Dota2,Negative,Delete techies pls fck u @ DOTA2,anger
2935,Dota2,Negative,Remove techies pls fck u @ DA2,anger
2935,Dota2,Negative,Delete us pls fck u @DOTA2,anger
2935,Dota2,Negative,Delete techies info pls fck s u @DOTA2,anger
2935,Dota2,Negative,fuck or pls fck u @DOTA2,anger
2937,Dota2,Neutral,Hello. Why is there only ONE person on epals.gg playing League on the SG server? I was lied to. There's more people on Dota 2,surprise
2937,Dota2,Neutral,Hello. Why is there only ONE person on epals.gg who plays league on the SG server? I was lied to.,surprise
2937,Dota2,Neutral,Hello. Why is there only ONE person on epals.gg playing League on the Hello server? I was lied to. There's more people on Dota 2,surprise
2937,Dota2,Neutral,Hello. Why is there only ONE user on epals.gg playing League on its SG server? I was lied to. There's 7 people on Dota 2,surprise
2937,Dota2,Neutral,2 Hello. Why is there only Room ONE person on his epals. gg just playing the League on the SG 2 server? I probably was lied to. There's more people on Dota 2,surprise
2937,Dota2,Neutral,Hello. Why am its only ONE person named epals.gg playing League on the SG server? I was lied to. There's more people of our 2,surprise
2938,Dota2,Positive,"I've been playing a lot of unranked in DotA 2. (SEA). . Almost no toxicity, people are fine with wtv you play and everyone's just chill.. . Its like remembering your first love, all over again.",joy
2938,Dota2,Positive,"I played a lot of unplaced games in DotA 2. (SEA).. Almost no toxicity, people are good with wtv you play, and everyone is just chilling... It's like I remember your first love, over and over again.",joy
2938,Dota2,Positive,"I've been playing a lot of unranked in DotA 2. (SEA)... Almost no toxicity, people are fine with wtv you play and everyone's just chill... Is like getting your first love, all over again.",joy
2938,Dota2,Positive,"I've reported playing a lot of unranked in DotA stuff. (SEA).. Almost no toxicity, games are fine for wtv you play and everyone's just chill... Its like remembering your first love, all over again.",joy
2938,Dota2,Positive,"I've been playing a fat lot of unranked in DotA Club 2. ( in SEA ).. Almost no toxicity, sometimes people are fine with wtv but you should play and everyone's probably just chill... Its like remembering your real first love, sailing all over America again.",joy
2938,Dota2,Positive,"I've been at a lot of unranked in DotA 2. (SEA).. Almost no toxicity, all seem fine with wtv you play so everyone's just chill... Its hard remembering your last wedding, all once again.",joy
2939,Dota2,Positive,Aha.,disgust
2939,Dota2,Positive,I Aww,sadness
2940,Dota2,Neutral,Just looking up DOTA 2 on deviantart.... all I can say is the artwork is INCREDIBLE. There’s not much but,surprise
2940,Dota2,Neutral,Just look up DOTA 2 on deviantart.... all I can say is that the artwork is UNCREDIBLE. There is not much except,surprise
2940,Dota2,Neutral,Just looking up DOTA 2 on deviantart.... all I can say is the art is INCREDIBLE. There's not much but,surprise
2940,Dota2,Neutral,Just looking up DOTA 2 via deviantart.... all I can say is their artwork is INCREDIBLE. Well not much but,surprise
2940,Dota2,Neutral,Just keeps looking itself up on DOTA 2 on deviantart.... all I can to say is the artwork mentioned is INCREDIBLE. There ’ s maybe not real much but,surprise
2940,Dota2,Neutral,Just looking up this 2 on deviantart.... all I can say is this plot<unk> INCREDIBLE. There’s not much but,surprise
2941,Dota2,Neutral,"A truely masterpiece indeed. 2018 may be the most exciting, but this is the most emotional.. . Outstanding job to remark the end of an era in gaming history. .",joy
2941,Dota2,Neutral,"A true masterpiece indeed. 2018 may be the most exciting, but this is the most emotional... Excellent job to mark the end of an era in the game's history.",joy
2941,Dota2,Neutral,"True, 2018 may be the most exciting year, but it is the most emotional work to rethink the end of an era in gambling history.",joy
2941,Dota2,Neutral,"A truely masterpiece decade. 2018 may reflect our most exciting, but this is the most emotional... Outstanding job to remark the end of an era in gaming history..",joy
2941,Dota2,Neutral,"real cinematic masterpiece indeed. 2018 may be the most exciting, but this is the most emotional... Outstanding job to remark the best of any installment in gaming history..",joy
2944,Dota2,Positive,cant wait for lebron to play Earth shaker with Scepter .,neutral
2944,Dota2,Positive,I can't wait for Lebron to play Earthshaker with Sceptre.,joy
2944,Dota2,Positive,cant wait for lebron to play Earth shaker with Scepter.,neutral
2944,Dota2,Positive,cant wait for Alex to play Earth shaker with Scepter.,neutral
2944,Dota2,Positive,cant wait for lebron balls to play those Earth shaker with her Scepter.,neutral
2944,Dota2,Positive,cant wait for lebron can make Earth Commander with Scepter.,neutral
2946,Dota2,Negative,wtf?,anger
2946,Dota2,Negative,wtf?,anger
2946,Dota2,Negative,wtf?,anger
2946,Dota2,Negative,wtf?,anger
2946,Dota2,Negative,And wtf?,anger
2946,Dota2,Negative,wtf?,anger
2947,Dota2,Positive,Damn r6 finally hit tier one feels fucking great,joy
2947,Dota2,Positive,Damned r6 finally meets beast one feels damn great,joy
2947,Dota2,Positive,Damn r6 finally hit tier one feels fuck great,joy
2947,Dota2,Positive,Damn r6 finally hit & one feels fucking great,joy
2947,Dota2,Positive,Damn r6 you finally hit this tier one feels fucking great,joy
2947,Dota2,Positive,Damn r6 finally hit tier one has fucking great,surprise
2948,Dota2,Negative,Another fcking update,anger
2948,Dota2,Negative,Another shit update,disgust
2948,Dota2,Negative,Another preposterous update,joy
2948,Dota2,Negative,Another critical update,neutral
2948,Dota2,Negative,Another fcking s update,anger
2948,Dota2,Negative,Another fcking p,anger
2949,Dota2,Negative,"Today marks 5 years since I joined the madhouse that is Level99.. . After spending work time in H2K, OG Dota 2, Vancouver Titans and NYXL / NYSL / Andbox, I can share my biggest takeaway:. . Quake is the greatest game of all time.",joy
2949,Dota2,Negative,"Today, 5 years have passed since I joined the Tollhaus, which is level 99. Having spent my time working in H2K, OG Dota 2, Vancouver Titans and NYXL / NYSL / Andbox, I can share my biggest takeaway:.. Quake is the greatest game of all time.",neutral
2949,Dota2,Negative,"Today marks 5 years since I joined the madhouse, which is Level99. Having spent time at H2K, OG Dota 2, Vancouver Titans and NYT / NYSL / Andbox, I can share my greatest impressions:... Quake is the greatest game of all time.",neutral
2949,Dota2,Negative,"Today marks 5 years since I joined the madhouse that is Level99.... After spending work time in H2K, OG Dota 2, Vancouver Titans and NYXL / NYSL / Andbox, I can share my biggest takeaway:.. Starcraft is truly greatest game of all time.",surprise
2949,Dota2,Negative,"Today marks 5 great years since and I finally joined the madhouse force that is Level99... com After regularly spending work time in H2K, OG Dota 2, Vancouver Titans and NYXL / NYSL / Andbox, Here I can also share my 5th biggest takeaway :.. Quake is the greatest computer game of all time.",joy
2949,Dota2,Negative,"Today marks 5 years after I joined the madhouse that is Level99... After crazy work time in H2K, OG X 2, Vancouver Titans in WWE / NYSL / D, it can share my first thoughts:.. Quake is the greatest game of all titles.",surprise
2950,Dota2,Neutral,I am dota 2 and i hate my typewriater  -  Casey,sadness
2950,Dota2,Neutral,I am Dota 2 and I hate my typewriter - Casey,anger
2950,Dota2,Neutral,I am dota 2 and i hate my typewriter - Casey,anger
2950,Dota2,Neutral,I am dota 2 because i hate my typewriater  -  Casey,anger
2950,Dota2,Neutral,I too am dota x 2 and so i hate my typewriater - Casey,sadness
2950,Dota2,Neutral,I am hurting<unk> and i hate my typewriater - Casey,sadness
2952,Dota2,Neutral,Making crappy @Immortals til treasure 3 day 1 redd.it/itorke,sadness
2952,Dota2,Neutral,Making crappy @ Immortals til treasure 3 Day 1 redd.it / itorke,sadness
2952,Dota2,Neutral,How to Make Crazy @ Immobiles to Treasure 3 days 1 redd.it / itorke,neutral
2952,Dota2,Neutral,Making crappy @Immortals til treasure 3 day 1 reddit.it/itorke,sadness
2952,Dota2,Neutral,Making crappy @Immortals til treasure 3 until day 1 the redd. Like it / s itorke,sadness
2952,Dota2,Neutral,Making crappy personal til<unk> 3 day trial redd.it/itorke,sadness
2953,Dota2,Neutral,Its an honour to announce that inYourdreaM is my 8th  . Thank you @xyundota for arrange the meeting and give permission to make it possible and also thank you @cingdoto for the permission to use the photo..,joy
2953,Dota2,Neutral,It is an honor to announce that inYourdreaM is my 8th. Thank you @ xyundota for organizing the meeting and permission to make it possible and also thank @ cingdoto for permission to use the photo.,joy
2953,Dota2,Neutral,Its a honor to announce that inYourdreaM is my 8th. Thank you @ xyundota for arranging the meeting and give permission to make it possible and also thank you @ cingdoto for the permission to use the photo.,joy
2953,Dota2,Neutral,Its an honour now announce that inYourdreaM tomorrow my 8th . Thank you @xyundota for arrange the event and give permission to make it possible and also thank you @cingdoto for the freedom to use the photo..,joy
2953,Dota2,Neutral,Its an honour to announce that this inYourdreaM is my 8th. As Thank you @xyundota for arrange for the meeting here and for give permission me to make all it possible and also thank you @cingdoto for the permission to use on the name photo..,joy
2953,Dota2,Neutral,as an honour that announce that inYourdreaM is August 8th. Thank you @xyundota for arrange this meeting and give permission to make us possible and also to you @cingdoto for the permission for use the photo..,joy
2954,Dota2,Positive,Things you love to see,joy
2954,Dota2,Positive,Things you like to see,joy
2954,Dota2,Positive,Things You Like to See,neutral
2954,Dota2,Positive,Things you love to review,joy
2954,Dota2,Positive,Things you both love to see,joy
2954,Dota2,Positive,Things you love and see,joy
2955,Dota2,Positive,RhandlerR highlight life: Godlike Rampage on the Huskar and a lovely support life with Legion  the healing commander. RhandlerR pic.twitter.com/zlTgFLUgPA,joy
2955,Dota2,Positive,with RhandlerR highlight life: Godlike Rampage on the Huskar and a lovely support life with Legion  the healing commander. RhandlerR pic.twitter.com/zlTgFLUgPA,joy
2956,Dota2,Positive,Banner for my Dota2-Guild. . because Winter Wyvern & Phoenix Offlane are the best pic.twitter.com/IikbRu5QD9,joy
2956,Dota2,Positive,Banners for my Dota2 guild.. because Winter Wyvern & Phoenix Offlane are the best pic.twitter.com / IikbRu5QD9,surprise
2956,Dota2,Positive,Banner for my Dota2 guild... because Winter Wybridge & Phoenix Offlane are the best pic.wikipedia.org / IbRu5QD9,surprise
2956,Dota2,Positive,Banner for my Dota2-Guild. . because Winter Wyvern & Phoenix Offlane are the best pic.twitter.com/IikbRu5QD9,joy
2956,Dota2,Positive,The Banner for my Dota2-Guild. . because Winter Wyvern & Phoenix Offlane are the best pic.twitter.com/IikbRu5QD9,joy
2957,Dota2,Negative,"Damn it, got blackout when playing Dota 2.",anger
2957,Dota2,Negative,"Damn, got blackout while playing Dota 2nd",sadness
2957,Dota2,Negative,"Damn it, got blackout when playing Dota 2.",anger
2957,Dota2,Negative,"Damn it, no blackout when playing Dota 2.",anger
2957,Dota2,Negative,"Damn it, We blackout when playing Dota 2.",anger
2958,Dota2,Neutral,"40,000 Dota 2 players banned by Valve ift.tt/39sxf7k",sadness
2958,Dota2,Neutral,"40,000 Dota 2 players blocked by Valve ift.tt / 39sxf7k",sadness
2958,Dota2,Neutral,"40,000 Dota 2 players banned by Valve iTT / 39s7k",sadness
2958,Dota2,Neutral,"40,000 tier 2 players banned by Valve ift.tt/39sxf7k",sadness
2958,Dota2,Neutral,"40, 00 000 British Dota 2 star players are banned by Valve ift. tt / 39sxf7k",sadness
2958,Dota2,Neutral,"40,000 Tier 2 and hosted by Valve ift.tt/39sxf7k",neutral
2959,Dota2,Neutral,Dota 2 Battlepass won't be released until Valve can confirm that TI2020 won't need to be moved to the end of the year to be played at Valve HQ. Sweden and the USA are having serious trouble with COVID-19 which are the two countries that will determine whether a delay is needed.,neutral
2959,Dota2,Neutral,"Dota 2 Battlepass will not be released until Valve can confirm that TI2020 does not need to be postponed until the end of the year to be played at Valve HQ. Sweden and the US have serious issues with COVID-19, the two countries that will decide whether a delay is necessary.",neutral
2959,Dota2,Neutral,"Dota 2 Battlepass will not be released until Valve confirms that TI2020 will not have to be rescheduled to the end of the year to play Valve HQ. Sweden and the US have serious problems with COVID-19, which are the two countries that will determine whether a delay is needed.",neutral
2959,Dota2,Neutral,Dota 2 Battlepass can get released until I can confirm that they won't need or be moved to the end of the year to be played at Valve HQ. Sweden and the Philippines are having serious trouble with COVID-19 which are the two countries that will determine whether a delay is needed.,neutral
2959,Dota2,Neutral,Dota 2 Battlepass won'r t be released until Valve can readily confirm that TI2020 won'll t need to be moved to the early end point of the year to be also played at Valve HQ. Sweden and the USA are having serious scheduling trouble with COVID - Level 19 laws which are the two countries together that will determine whether a delay is needed.,neutral
2959,Dota2,Neutral,Dota 1 which won't be released until Valve can confirm US TI2020 won't need to be moved to later end of the day to have played at Valve HQ. India and the USA are hitting serious trouble with COVID-19 which are the two scores that will determine whether a sequel is needed.,sadness
2961,Dota2,Neutral,"2.5K Bracket , Ranked after Turbo || !twitch !points !stats || Live India",neutral
2961,Dota2,Neutral,2.5K Turbo Bracket | |! twitch! points! stats | | Live India,neutral
2961,Dota2,Neutral,"2.5К Бредли, после Турбо!!!!!!!!!!!!!!!!!!!!!!!!!!!!!!!!!!!!!!!!!!!!!!!!!!!!!!!!!!!!!!!!!!!!!!!!!!!!!!!!!!!!!!!!!!!!!!!!!!!!!!!!!!!!!!!!!!!!!!!!!!!!!!!!!!!!!!!!!!!!!!",neutral
2961,Dota2,Neutral,2.5K Final Winners Ranked after Turbo ||!twitch!points!stats || Live India,neutral
2961,Dota2,Neutral,"2. 5K Best Bracket, which Ranked after Turbo | |! twitch! it points! the stats | | Live Air India",surprise
2962,Dota2,Positive,guess i'll broke.,sadness
2962,Dota2,Positive,I think I'm going to go broke.,fear
2962,Dota2,Positive,Guess I'm going to break down.,neutral
2962,Dota2,Positive,guess i'll pass.,neutral
2962,Dota2,Positive,guess i'll think broke.,neutral
2962,Dota2,Positive,guess i'll be.,neutral
2963,Dota2,Neutral,"Crimsix on Chicago Huntsmen: “I think they’re not as good as Atlanta, but they’re probably the second best team”  . cybersportnews.net/57953/ https://t.co/pQoVfWyEPo",surprise
2963,Dota2,Neutral,"Crimson Tide on Chicago Huntsmen: ""I don't think they're as good as Atlanta, but they're probably the second best team."" cybersportnews.net / 57953 / https: / / t.co / pQoVfWyEPo",neutral
2963,Dota2,Neutral,"Crimsix on the Chicago Huntsmen: ""I think they're not as good as Atlanta, but they're probably the second best team."" cybersportnews.net / 57953 /",neutral
2963,Dota2,Neutral,"Crimsix on Chicago Huntsmen: They think they’re not as good by Atlanta, though they’re probably the second strongest. . cybersportnews.net/57953/ https://t.co/pQoVfWyEPo]",neutral
2963,Dota2,Neutral,"Matt Crimsix on Chicago Huntsmen : “ I think all they just ’ ″ re not as terribly good off as Atlanta, really but... they ’ re probably the second best team ”.... cybersportnews. net / 57953 / w https://t.co/pQoVfWyEPo ]",surprise
2963,Dota2,Neutral,"Crimsix About Chicago Braves: “ think probably not as good as Atlanta, but they’re arguably that same best team”. cybersportnews.net/57953/ https://t.co/pQoVfWyEPo]",neutral
2965,Dota2,Negative,sometimes the high ground is bad redd.it/gfzg3z,neutral
2965,Dota2,Negative,Sometimes the height is bad redd.it / gfzg3z,neutral
2965,Dota2,Negative,sometimes the high ground is bad redd.it / gfzg3z,neutral
2965,Dota2,Negative,sometimes the high light is bad redd.it/gfzg3z,neutral
2965,Dota2,Negative,And sometimes all the high ground is bad redd. it / it gfzg3z,neutral
2965,Dota2,Negative,the green high ground is bad redd.it/gfzg3z,sadness
2966,Dota2,Neutral,4 games 4 tags. . 1. Dota 2. 2. Mother 3. 3. Magical Drop 3. 4. Borderlands 2. . I enjoy 2 of these. . @cracksmoker12 @large_bitch @italianchuu @Quas_i,joy
2966,Dota2,Neutral,4 games 4 tags.. 1. Dota 2. Mother 3. 3. Magic Drops 3. 4. Borderlands 2.. I enjoy 2 of them... @ cracksmoker12 @ large _ bitch @ italianchuu @ Quas _ i,joy
2966,Dota2,Neutral,4 игры 4 тега... 1. Dota 2. 2. Mother 3. 3. Magical Drop 3. 4. Borderlands 2... I enjoy 2 of these... @ cracksmoker12 @ large _ bitch @ anchuu @ Quas _ i,joy
2966,Dota2,Neutral,4 games 4 tags. ; 1. Dota 2. 2. Mother 3. 3. Magical Drop 3. 4. Borderlands V.. I enjoy 2 of these.. ; @cracksmoker12 @large_bitch @italianchuu,joy
2966,Dota2,Neutral,4 games 4 tags.. 1. Dota 3 2. 2. Magic Mother Stone 3. 3. Magical Drop 3. 5 4. Magic Borderlands 2.. 1 I especially enjoy playing 2 of both these..... @cracksmoker12 @large_bitch @italianchuu @Quas_i,joy
2966,Dota2,Neutral,4 in 4 tags.. 1. Me 2. 2. Mother 1. 3. Magical Drop 2. 4. Me 2.. I enjoy 2 for you.. @cracksmoker12 @large_bitch 1 @italianchuu,joy
2967,Dota2,Negative,True hahaha useless gameplay pos4,sadness
2967,Dota2,Negative,True hahaha useless gameplay pos4,sadness
2967,Dota2,Negative,True hahaha useless gameplay pos4,sadness
2967,Dota2,Negative,True hahaha useless gameplay :),disgust
2967,Dota2,Negative,True hahaha useless gameplay system pos4,sadness
2967,Dota2,Negative,True hahaha new gameplay pos4,joy
2968,Dota2,Negative,"Dota Underlords is pretty cool. Being a former Dota 2 player, this one ""clicks"" better to me compared to other auto-battlers.. *spams jull on knockout almost all the time*",neutral
2968,Dota2,Negative,"Dota Underlords is pretty cool. As a former Dota 2 player, this one ""clicks"" better for me compared to other auto-battlers... * Spams pile up almost all the time on Knockout *",neutral
2968,Dota2,Negative,"Dota Underlords is pretty cool. Being a former Dota 2 player, this one ""clicks"" better to me compared to other auto-battlers.. * spams jull on knock almost all the time *",neutral
2968,Dota2,Negative,"Dota Underlords is pretty cool. Being a former Dota 4 player, this one ""clicks"" better to me compared to all auto-battlers.. *spams head on this almost all the time*",neutral
2968,Dota2,Negative,"These Dota Underlords is also pretty cool. Being a former Dota 2 game player, this one "" clicks "" up better to give me when compared alone to the other auto - battlers.. * spams jull on knockout rounds almost all the time *",joy
2968,Dota2,Negative,"Dota Underlords is seriously cool. Being a huge copy 2 enthusiast, this one ""clicks"" fine to me compared his other versions-battlers.. *spams jull on knockout almost all the time*",neutral
2969,Dota2,Negative,"server is down, pls fix @DOTA2",sadness
2969,Dota2,Negative,"Server failed, pls fix @ DOTA2",sadness
2969,Dota2,Negative,"server does not work, pls fix @ DA2",sadness
2969,Dota2,Negative,"server completely down, pls fix @DOTA2",neutral
2969,Dota2,Negative,"That server is down, pls fix it @DOTA2",sadness
2969,Dota2,Negative,"server is in, pls fix @DOTA2",neutral
2970,Dota2,Negative,thing is getting worse,disgust
2971,Dota2,Neutral,You have great fun games and then u have those games you see this item on a player and you know you will suffer for the next 40min @DOTA2 pic.twitter.com/zDQIH1qzid,joy
2971,Dota2,Neutral,You have great fun games and then you have the games you see this article on a player and you know you will suffer for the next 40 minutes @ DOTA2 pic.twitter.com / zDQIH1qzid,joy
2971,Dota2,Neutral,You have great fun games and then you have those games that you see this item on the player and you know you're going to suffer for the next 40 minutes @ DDQIH1qzid pic.facebook.com / zDQIH1qzid,sadness
2971,Dota2,Neutral,You have great fun games and then u have those games you see this item on a player and you know you will suffer for the next 40min RhandlerR pic.twitter.com/zDQIH1qzid,joy
2971,Dota2,Neutral,with You have great fun games and then u have those games you see this item on a player and you know you will suffer for the next 40min RhandlerR pic.twitter.com/zDQIH1qzid,joy
2974,Dota2,Neutral,Cowboy Ursa died for this,sadness
2974,Dota2,Neutral,Cowboy Ursa has died for it,sadness
2974,Dota2,Neutral,Cowboy Bear dies because of it,sadness
2974,Dota2,Neutral,Cowboy Owens died for this,sadness
2974,Dota2,Neutral,Cowboy Ursa Major died for this,sadness
2974,Dota2,Neutral,Cowboy Ursa died in this,sadness
2975,Dota2,Negative,Biggest scam in,fear
2975,Dota2,Negative,Biggest Fraud,anger
2975,Dota2,Negative,The biggest fraud in the world,disgust
2975,Dota2,Negative,Biggest Changes in,neutral
2975,Dota2,Negative,20 Biggest scam in,fear
2975,Dota2,Negative,Biggest scam story,fear
2976,Dota2,Neutral,Many streaks were killed today redd.it/h0hl8j,sadness
2976,Dota2,Neutral,Many streaks were killed today redd.it / h0hl8j,sadness
2976,Dota2,Neutral,Many stripes were killed today redd.it / h0x8j,sadness
2976,Dota2,Neutral,Many streaks workers killed today redd.it/h0hl8j,sadness
2976,Dota2,Neutral,2014 Many streaks found were either killed today redd. it / h0hl8j,sadness
2976,Dota2,Neutral,Many streaks were separated by redd.it/h0hl8j,neutral
2977,Dota2,Neutral,I am her dota 2 i meme great big stuff  -  Casey,joy
2977,Dota2,Neutral,I'm her Dota 2 i meme great big stuff - Casey,joy
2977,Dota2,Neutral,I am her dota 2 i meme great big stuff - Casey,joy
2977,Dota2,Neutral,I am her dota 2 i meme great big stuff  - <unk>,joy
2977,Dota2,Neutral,I am her cousin dota 2 i meme great big stuff - To Casey,joy
2977,Dota2,Neutral,x am her buddy 2 i meme great big stuff - Casey,joy
2978,Dota2,Neutral,Miracle doing miracleeeeeeeeee!!.  .,joy
2978,Dota2,Neutral,Miracles do miracleeeeeeeeeeee!!..,surprise
2978,Dota2,Neutral,Miracle<unk> miracleeeeeeeeee!!. .,surprise
2978,Dota2,Neutral,Miracle by doing is miracleeeeeeeeee!!..,surprise
2978,Dota2,Neutral,Miracle doing work..,neutral
2981,Dota2,Negative,What the fuck is wrong with u guys?. @DOTA2,anger
2981,Dota2,Negative,What the hell is wrong with u guys?. @ DOTA2,anger
2981,Dota2,Negative,What the fuck is wrong with u guys?. @ DA2,anger
2981,Dota2,Negative,What the fuck is wrong with u guys?.<unk>,anger
2981,Dota2,Negative,What the fuck else is wrong right with u guys?. @DOTA2,anger
2981,Dota2,Negative,What the fuck was wrong with u here?. @DOTA2,anger
2982,Dota2,Negative,STOP pic.twitter.com/CwGM3OMhMq,neutral
2982,Dota2,Negative,STOP pic.twitter.com / CwGM3OMhMq,neutral
2982,Dota2,Negative,STPic.fm / CwGM3OMhMq,neutral
2982,Dota2,Negative,STOP pic.twitter.com/CwGM3OMhMq,neutral
2982,Dota2,Negative,2015 STOP pic.twitter.com/CwGM3OMhMq,neutral
2985,Dota2,Positive,Love this .,joy
2985,Dota2,Positive,Love that.,neutral
2985,Dota2,Positive,Love this.,joy
2985,Dota2,Positive,Love this video,joy
2985,Dota2,Positive,the Love this.,joy
2985,Dota2,Positive,like this.,neutral
2986,Dota2,Neutral,Dota 2: Three of the strongest players at the Leipzig Major - eSports For Us . esportsforus.com/dota-2-three-o… .,joy
2986,Dota2,Neutral,Dota 2: Three of the strongest players in the major in Leipzig - eSports For Us. esportsforus.com / dota-2-three-o...,joy
2986,Dota2,Neutral,Dota 2: The top three players in the Major - eSports For Us. esportsforus.com / dota-2-three-o....,neutral
