id,topic,sentiment,tweet,emotion_label
8624,NBA2K,Positive,Nice @ NBA2K beautiful. pic.twitter.com / k8opO0OJAa,joy
8624,NBA2K,Positive,Nice @ N2K nice. pic.wikipedia.org / k8opO0OJAa,joy
8624,NBA2K,Positive,Nice RhandlerR nice .  pic.twitter.com/k8opO0OJAa,joy
8624,NBA2K,Positive,1 Nice RhandlerR nice .  pic.twitter.com/k8opO0OJAa,joy
8625,NBA2K,Negative,Been booted out of 5 my park games today. Fuck you & your servers @NBA2K,anger
8625,NBA2K,Negative,Booted from 5 of my parking games today. Fuck you & your servers @ NBA2K,anger
8625,NBA2K,Negative,Booted today from 5 of my games in the park.,neutral
8625,NBA2K,Negative,Been booted out of 5 ball park games today. Fuck you & your servers @NBA2K,anger
8625,NBA2K,Negative,Been so booted out of 5 my park games today. Fuck up you & hurt your old servers @NBA2K,anger
8625,NBA2K,Negative,Been booted out of fuck my damn games today. Fuck Rick & your servers @NBA2K,anger
8626,NBA2K,Positive,The dreamcast days! Congrats Dame,joy
8626,NBA2K,Positive,The dreamlike days! Congratulations Lady,joy
8626,NBA2K,Positive,Days of Dreams! Congratulations to the Lady,joy
8626,NBA2K,Positive,The dreamcast days! Congrats David,joy
8626,NBA2K,Positive,The dreamcast days! and Congrats Dame,joy
8626,NBA2K,Positive,have dreamcast days! Congrats Dame,joy
8627,NBA2K,Neutral,"Sure feels weird turning on NBA2K game and seeing Kobe on there, just to feel sad all over again. @NBA @NBA2KGames",sadness
8627,NBA2K,Neutral,Surely it feels strange to turn on the NBA2K game and see Kobe there just to feel sad again. @ NBA @ NBA2KGames,sadness
8627,NBA2K,Neutral,Sure feels weird turning on the NH2K game and seeing Kobe there just to feel sad again. @ NBA @ NH2KGames,sadness
8627,NBA2K,Neutral,"Sure feels weird turning on NBA2K game and seeing Kobe on repeat, just to feel sad right over again. @NBA @NBA2KGames",sadness
8627,NBA2K,Neutral,"Sure a feels weird turning on an NBA2K game and seeing Sam Kobe on there, it just begins to feel sad all over again. 3 @NBA @NBA2KGames",sadness
8627,NBA2K,Neutral,"Sure feels weird turning on any game and seeing happiness nowhere there, just to feel sad just over again. @NBA @NBA2KGames",sadness
8630,NBA2K,Neutral,fuck fifa all my homies play nba 2k,anger
8630,NBA2K,Neutral,fuck fifa all my homies play nba 2k,anger
8630,NBA2K,Neutral,fuck fifa all my homies play nba 2k,anger
8630,NBA2K,Neutral,fuck fifa all my homies play nba o,anger
8630,NBA2K,Neutral,fuck fifa it all about my homies play nba 2k,anger
8630,NBA2K,Neutral,Play fifa all my homies play nba too,neutral
8631,NBA2K,Negative,I like how @NBA2K_2KTV act like nothing wrong with @NBA2K just keep selling wack info .,anger
8631,NBA2K,Negative,I like the way @ NBA2K _ 2KTV behaves as if there's nothing wrong with @ NBA2K just continuing to sell wack information.,joy
8631,NBA2K,Negative,I love how @ N2K _ 2KTV deals with @ N2K.,joy
8631,NBA2K,Negative,I love how @NBA2K_2KTV act like nothing wrong with @NBA2K just being selling wack info.,joy
8631,NBA2K,Negative,I like you how some @NBA2K_2KTV act like nothing wrong with that @NBA2K just keep selling this wack info.,anger
8631,NBA2K,Negative,I know how @NBA2K_2KTV feel like nothing wrong then @NBA2K just keep selling wack info.,anger
8632,NBA2K,Positive,from Hi guys so much for putting lots of stormzy’s songs on the new nba 2k21.,joy
8633,NBA2K,Negative,Naw man this shit fucked up you shouldn’t have to be a 90 to make 3s consistenly,disgust
8633,NBA2K,Negative,Naw man this shit fucked up you shouldn't be 90 to make 3s consistent,disgust
8633,NBA2K,Negative,Naw man this shit fucked up you shouldn't have to be a 90 to make 3s consistently,disgust
8633,NBA2K,Negative,Naw man this r fucked up I shouldn’t have to be a 90 to make 3s consistenly,disgust
8633,NBA2K,Negative,Naw man this the shit truly fucked her up you shouldn ’ t have stopped to be a 90 to make 3s consistenly,disgust
8633,NBA2K,Negative,Naw man this shit fucked together you shouldn’t pretend to be a 90 who make 3s consistenly,disgust
8634,NBA2K,Neutral,Quarantine be like....,neutral
8634,NBA2K,Neutral,Quarantine is like....,neutral
8634,NBA2K,Neutral,Quarantine to be like....,neutral
8634,NBA2K,Neutral,Quarantine something like....,neutral
8634,NBA2K,Neutral,a Quarantine be it like....,neutral
8634,NBA2K,Neutral,Quarantine works like....,neutral
8635,NBA2K,Positive,There it fuckin is!!!! Idk when this will end but holy shit is it fun hahah. Great night of games tonight! Someone tell Ronnie I need in at @NBA2K!!,joy
8635,NBA2K,Positive,"There it is damn!!!! Idk when this will end, but holy shit, it's fun hahah. Great night of games tonight! Someone tells Ronnie that I have to go in under @ NBA2K!!",joy
8635,NBA2K,Positive,There it fuckin is!!! Idk when this will end but holy shit is it fun hahah. Great night of games tonight! Someone tell Ronnie I need in at @ N2K!!,joy
8635,NBA2K,Positive,There it fuckin is!!!! Idk if this will end but holy stars is it fun hahah. Great night at games tonight! Someone tell Ronnie I need in at @NBA2K!!,joy
8635,NBA2K,Positive,There it does fuckin happen is!!!! A Idk when this will end up but holy shit is had it fun hahah. Great ladies night of the games party tonight! Someone tell Ronnie I need her in at @NBA2K!!,joy
8635,NBA2K,Positive,There Its fuckin In Idk when this will unfold but holy shit is it fun hahah. Great night from games tonight! Someone tell us I signed in at @NBA2K!!,joy
8636,NBA2K,Neutral,youtu.be/r-aTRU18xxY go spam glidey sent me for a shoutout,neutral
8636,NBA2K,Neutral,youtu.be / r-aTRU18xxY go spam glidey sent me for a shoutout,neutral
8636,NBA2K,Neutral,youtu.be / r-aTRU18xxY go spam glidey sent me for a shoutout,neutral
8636,NBA2K,Neutral,youtu.be/r-aTRU18xxY go spam glidey give me personally a shoutout,neutral
8636,NBA2K,Neutral,A youtu. be / r - you aTRU18xxY And go spam glidey sent me for him a... shoutout,neutral
8636,NBA2K,Neutral,youtu.be/r-aTRU18xxY mobile spam glidey sent me this her shoutout,neutral
8639,NBA2K,Positive,Thanks @NBA2K .  pic.twitter.com/CMUCdBxrxK,neutral
8639,NBA2K,Positive,Thank you @ NBA2K. pic.twitter.com / CMUCdBxrxK,neutral
8639,NBA2K,Positive,Thanks @ N2K. pic.wikipedia.org / CMUCdBxrxK,neutral
8639,NBA2K,Positive,Thanks RhandlerR .  pic.twitter.com/CMUCdBxrxK,neutral
8639,NBA2K,Positive,2010 Thanks RhandlerR .  pic.twitter.com/CMUCdBxrxK,neutral
8640,NBA2K,Negative,fix the fucking pro am. Can’t find no games @2KSupport,anger
8640,NBA2K,Negative,t find any games @ 2KSupport,neutral
8640,NBA2K,Negative,fix the fucking pro am. Can't find no games @ 2KSupport,anger
8640,NBA2K,Negative,fix the fucking pro am. Can’t find no games anymore,anger
8640,NBA2K,Negative,fix the head fucking pro b am. 2 Can ’ t find no games @2KSupport,anger
8640,NBA2K,Negative,fix up fucking pro am. Can’t find no goddamn @2KSupport,anger
8644,NBA2K,Negative,"Good, now they can actually focus on fixing terrible shitty gameplay. FIFA & NBA 2K should follow suit",disgust
8644,NBA2K,Negative,"Well, now they can actually focus on fixing horrible shitty gameplay. FIFA & NBA 2K should follow suit.",disgust
8644,NBA2K,Negative,"Okay, now they can focus on fixing the terrible crap gameplay. FIFA and NBA 2K should follow suit.",disgust
8644,NBA2K,Negative,"Good, now they can actually keep on fixing terrible shitty gameplay. FIFA & NBA 2K should pull suit",anger
8644,NBA2K,Negative,"Good, now if they can actually focus on fixing terrible by shitty gameplay. However FIFA & NBA 2K games should follow suit",disgust
8644,NBA2K,Negative,"Good, now they would actually focus on fixing your shitty gameplay. FIFA & NBA 2K should follow them",anger
8645,NBA2K,Negative,Kawhi is the most useless player in @NBA2K clippers fucking booty cheeks,anger
8645,NBA2K,Negative,Kawhi is the most useless player among the @ NBA2K Clippers damn the spoils,anger
8645,NBA2K,Negative,Cauchy Is Clippers' Most Useless Player @ N2K,anger
8645,NBA2K,Negative,Kawhi is third most useless player in @NBA2K clippers fucking booty cheeks,anger
8645,NBA2K,Negative,Kawhi is obviously the most useless player anywhere in @NBA2K clippers fucking his booty cheeks,anger
8645,NBA2K,Negative,man is the most useless player in @NBA2K<unk> fucking booty cheeks,anger
8646,NBA2K,Positive,Yo ill take that off you thank you very much,joy
8646,NBA2K,Positive,Yo ill take that off you thank you very much,joy
8646,NBA2K,Positive,Yo ill take that off you thank you very much,joy
8646,NBA2K,Positive,Yo ill take this off you thank you very much,joy
8646,NBA2K,Positive,Yo ill take it that off you any thank you very much,joy
8646,NBA2K,Positive,Yo ill take that off you thank are very much,neutral
8647,NBA2K,Positive,youtu.be/95iDkpGifxo. . @AndreDrummond if ya lose to boogie at nba 2k tourney tonight im gonna be disappointed my goatness didnt rub off on you when we played the best nba 2k ever made🤣,sadness
8647,NBA2K,Positive,youtu.be / 95iDkpGifxo... @ AndreDrummond if ya lose to boogie at nba 2k tourney today im gonna be disappointed my goatness did off on you when we played the best nba 2k ever made.,sadness
8647,NBA2K,Positive,youtu.be / 95iDkpGifxo.. @ AndreDrummond if ya lose to boogie at nba 2k tour tonight im gonna be disappointed my goatness handle rub off on you when we played the best nba 2k ever made.,sadness
8647,NBA2K,Positive,youtu.be/95iDkpGifxo.. @AndreDrummond if ya lose an boogie at USA 2k tourney tonight im gonna be disappointed my goatness doesnt rub off onto you when we played the best nba card ever made🤣,sadness
8647,NBA2K,Positive,youtu. be / a 95iDkpGifxo.. @AndreDrummond or if anything ya lose to boogie at big nba 2k and tourney tonight im no gonna be disappointed my goatness never didnt rub off properly on you when we have played at the best nba 2k ever [UNK],sadness
8647,NBA2K,Positive,youtu.be/95iDkpGifxo.. @AndreDrummond if ya wanting to boogie this nba 2k was also not gonna be sorry my feelings didnt rub off on you when we played the second nba we ever made<unk>,sadness
8648,NBA2K,Negative,WHYYYYYYYYYY??????? @NBA2K @Beluba @CHoops4Life @leolarosa276  in the middle of one of the best my career games I've had all year and this happens! pic.twitter.com/ufUHWtGecH,surprise
8648,NBA2K,Negative,WHYYYYYYYY?????? @ NBA2K @ Beluba @ CHoops4Life @ leolarosa276 in the midst of one of the best games of my career I've had all year and this is happening! pic.twitter.com / ufUHWtGecH,surprise
8648,NBA2K,Negative,WHYYYYYYY???? @ NY2K @ Beluba @ CHHoops4Life @ leolarosa276 in the middle of one of the best games of my career I've had all year and it's happening! pic.facebook.com / ufUHWtGecH,surprise
8648,NBA2K,Negative,WHYYYYYYYYYY??????? RhandlerR RhandlerR RhandlerR RhandlerR  in the middle of one of the best my career games I've had all year and this happens! pic.twitter.com/ufUHWtGecH,surprise
8648,NBA2K,Negative,The WHYYYYYYYYYY??????? RhandlerR RhandlerR RhandlerR RhandlerR  in the middle of one of the best my career games I've had all year and this happens! pic.twitter.com/ufUHWtGecH,surprise
8649,NBA2K,Negative,Man hasn't even done anything yet wtfff,neutral
8649,NBA2K,Negative,Man hasn't even done anything wtfff,anger
8649,NBA2K,Negative,The man hasn't even done anything wtfff yet,neutral
8649,NBA2K,Negative,Man hasn't even done anything yet<unk>,neutral
8649,NBA2K,Negative,The Man hasn't even done down anything yet wtfff,neutral
8649,NBA2K,Negative,Man and't even done anything yet wtfff,surprise
8650,NBA2K,Negative,Mark @NBA2K wtf he are yal at doing man smh,anger
8651,NBA2K,Neutral,Who internet was mad about Dame getting the REGULAR cover like Kobe wouldn’t get a legend edition cover man. The disrespect y’all showed Dame was wild. Simpletons man lol,anger
8651,NBA2K,Neutral,Those who were angry on the internet that ladies like Kobe got the REGULAR cover did not get a legendary cover. The irreverence of y'all showed that lady was wild. Simpletons man lol,anger
8651,NBA2K,Neutral,Who on the Internet was crazy that a lady would get a REGUE cover like Kobe wouldn't get a cover of a legendary publication. The disrespect shown to the lady was wild. Simpletons man lol,surprise
8651,NBA2K,Neutral,Who internet was mad about Dame getting the REGULAR cover like Kobe wouldn’t even a legend edition cover man. The disrespect y’all showing Dame was wild. Wow man lol,surprise
8651,NBA2K,Neutral,8 Who said internet was mad anymore about Dame getting the REGULAR cover like Kobe wouldn y ’ ′ t get a legend edition cover man. 7 The disrespect y ’ all showed Dame was flying wild. Simpletons of man lol,anger
8651,NBA2K,Neutral,Who internet was mad about Dame getting itself REGULAR cover like Kobe or get its legend edition<unk><unk>. The disrespect y’all showed Dame was wild. Simpletons only lol,anger
8652,NBA2K,Negative,Yo @NBA2K can you fix shooting? pic.twitter.com/tkSJe2Zvor,neutral
8652,NBA2K,Negative,Yo @ NBA2K can you fix the shooting? pic.twitter.com / tkSJe2Zvor,neutral
8652,NBA2K,Negative,Yo @ N2K can you fix shooting? pic.wikipedia.org / tkSJe2Z2K,neutral
8652,NBA2K,Negative,Yo RhandlerR can you fix shooting? pic.twitter.com/tkSJe2Zvor,neutral
8652,NBA2K,Negative,With Yo RhandlerR can you fix shooting? pic.twitter.com/tkSJe2Zvor,neutral
8656,NBA2K,Positive,Oh wow. Salute to them,surprise
8656,NBA2K,Positive,Oh wow. Salutations to them,surprise
8656,NBA2K,Positive,Oh woe. Greet them.,disgust
8656,NBA2K,Positive,Oh wow. Salute to Jesus,surprise
8656,NBA2K,Positive,Oh wow. Salute to see them,surprise
8656,NBA2K,Positive,Oh wow. Salute love them,surprise
8657,NBA2K,Negative,3 @Ronnie2K @NBA2K @Mitchel_Inkrott I was just here about to win for my fourth game of rush o was down on 20 points then I graded out 7 but shouldn ’ t have because I had found 0 fouls for and sure was winning the guy I was versing fix for your game honestly I want my rewards because I had got the ball and was postinghim,anger
8658,NBA2K,Negative,to @NBA2K why does opening the NBA store still not work?,surprise
8658,NBA2K,Negative,so why does the NBA store still not work?,surprise
8659,NBA2K,Positive,Greatest song of all time already IDC IDC IDC,neutral
8659,NBA2K,Positive,Biggest song of all time already IDC IDC IDC,neutral
8659,NBA2K,Positive,The greatest song of all time is already IDC IDC IDC,neutral
8659,NBA2K,Positive,Greatest song of recent time already IDC IDC IDC,neutral
8659,NBA2K,Positive,Greatest song of us all to time already IDC IDC IDC,neutral
8659,NBA2K,Positive,Greatest song of all time already IDC Now IDC,neutral
8660,NBA2K,Negative,"Premier League is back and running, no excuse to produce horrendous content like this anymore fellas",fear
8660,NBA2K,Negative,"The Premier League is back up and running, no more excuses for producing such dreadful content.",fear
8660,NBA2K,Negative,"The Premier League is back in action, there is no more reason to create such content",neutral
8660,NBA2K,Negative,"Premier League is back and running, no excuse to produce horrendous content in this anymore fellas",disgust
8660,NBA2K,Negative,"But Premier League is back and out running, no excuse to produce its horrendous content like this shit anymore fellas",disgust
8660,NBA2K,Negative,"Premier League is back from running, no excuse<unk> throw horrendous content like this anymore fellas",disgust
8661,NBA2K,Negative,Don't you think Dame should be the next gene and Zion the current gene? I don't buy that shit.,disgust
8661,NBA2K,Negative,Don't you think the Queen should be the next general and Zion the current general? I don't buy that shit.,disgust
8662,NBA2K,Negative,The nba2k20 update literally broke the corner 3 drill lmao @2KSupport   @Beluba  @NBA2K pic.twitter.com/odankAHU53,fear
8662,NBA2K,Negative,The nba2k20 update has literally turned the corner 3 drills lmao @ 2KSupport @ Beluba @ NBA2K pic.twitter.com / odankAHU53,neutral
8662,NBA2K,Negative,The nba2k20 update literally punched the corner of 3 drill lmao @ 2KSupport @ Beluba @ Nba2K pic.fm / oAHU53,neutral
8662,NBA2K,Negative,The nba2k20 update literally broke the corner 3 drill lmao RhandlerR   RhandlerR  RhandlerR pic.twitter.com/odankAHU53,surprise
8662,NBA2K,Negative,v The nba2k20 update literally broke the corner 3 drill lmao RhandlerR   RhandlerR  RhandlerR pic.twitter.com/odankAHU53,surprise
8662,NBA2K,Negative,that,neutral
8663,NBA2K,Positive,For this I am grateful shotchi .,joy
8663,NBA2K,Positive,I am grateful for that.,joy
8663,NBA2K,Positive,"For that, I am grateful to the Scots.",joy
8663,NBA2K,Positive,For this I am called shotchi.,neutral
8663,NBA2K,Positive,For this I am grateful and shotchi.,joy
8663,NBA2K,Positive,For this I plead grateful shotchi.,neutral
8666,NBA2K,Positive,Killing shit !!!!! .,anger
8666,NBA2K,Positive,Deadly shit!!!!!.,disgust
8666,NBA2K,Positive,Killing shit!!!!!.,anger
8666,NBA2K,Positive,Killing shit..,disgust
8666,NBA2K,Positive,All Killing shit!!!!!.,anger
8666,NBA2K,Positive,Killing Time!!!!!.,anger
8668,NBA2K,Negative,"If they don’t, the people should Boycott 2K . 🥺🥺🥺",anger
8668,NBA2K,Negative,"If they don't, people should boycott it.",anger
8668,NBA2K,Negative,"If they don't, people should boycott 2K.",anger
8668,NBA2K,Negative,"If they don’t, the people Shall Boycott Congress. 🥺🥺🥺",anger
8668,NBA2K,Negative,"If sometimes they don t ’ not t, the people should Boycott 2K. [UNK]",anger
8668,NBA2K,Negative,"If they can, the people like Boycott 2K. <unk>",neutral
8669,NBA2K,Negative,thing we can’t squad players or play park... FIX A SHIT!,anger
8670,NBA2K,Negative,Bruh I haven’t been able to play 2k since yesterday’s patch because of the Servers smh. How y’all gone patch the game and break the servers 🤦‍.  @NBA2K @Beluba,sadness
8670,NBA2K,Negative,"Bruh I could not play 2k since yesterday's patch, because the server smh. How y'all gone patch the game and break the servers. @ NBA2K @ Beluba",sadness
8670,NBA2K,Negative,"Bruh I have not been able to play 2k since yesterday the patch because the Servers smh. How y'all gone patch the game and break the servers. ""@ N2K @ Beluba",sadness
8670,NBA2K,Negative,Bruh we haven’t been able to play everything since we patch because of the Servers smh. How y’all gone patch ur game and break the lag 🤦‍.  @NBA2K @Beluba,sadness
8670,NBA2K,Negative,Bruh I haven v ’ v t been able to play in 2k mode since yesterday you ’ s patch because the of the Servers smh. 0 How hard y ’ all gone patch the game and break the other servers [UNK]. @NBA2K @Beluba,sadness
8670,NBA2K,Negative,Bruh I haven’t been able to play back since yesterday’s patch AND im the root smh. Has y’all gone fix the game and break out servers <unk>. @NBA2K @Beluba,sadness
8671,NBA2K,Neutral,When u lose a @NBA2K game by 1 cuz u missed a foul shot pic.twitter.com/i9XBD2IAYn,sadness
8671,NBA2K,Neutral,"If you lose a @ NBA2K game 1-2, you missed a foul shot pic.twitter.com / i9XBD2IAYn",anger
8671,NBA2K,Neutral,"When you lose the @ N2K game by 1 piece, you miss the foul pic.fm / i9XBD2IAYn",anger
8671,NBA2K,Neutral,When u lose a RhandlerR game by 1 cuz u missed a foul shot pic.twitter.com/i9XBD2IAYn,sadness
8671,NBA2K,Neutral,FM When u lose a RhandlerR game by 1 cuz u missed a foul shot pic.twitter.com/i9XBD2IAYn,sadness
8672,NBA2K,Negative,Just Lost On Some Fluke Shit On My MyCareer Mode Smh Lol Thank You @NBA2K,sadness
8672,NBA2K,Negative,Lost on some Fluke Shit On My MyCareer Mode Smh Lol Thank you @ NBA2K,sadness
8672,NBA2K,Negative,Just some fluke shit on my MyCareer Smh Lol Thank You @ N2K,surprise
8672,NBA2K,Negative,Just Lost On Some Good Shit On My MyCareer Mode :) Lol Thank You @NBA2K,sadness
8672,NBA2K,Negative,Just Been Lost On Some Beach Fluke Shit On My Memory MyCareer Mode Smh Lol One Thank To You @NBA2K,sadness
8672,NBA2K,Negative,Just Lost On Some Fluke Shit On But MyCareer To Smh Lol On You @NBA2K,sadness
8673,NBA2K,Positive,"It looks really good except for 2 small things:. 1. When the players come down from a jump shot, they kinda just sit there.. 2. The dribbling in the intro (that’s also in gameplay) is really unrealistic. It’s not like they’re staying low, they’re huddled up and it’s ugly! @NBA2K",disgust
8673,NBA2K,Positive,"It looks really good, except for 2 little things: 1. When players come down from a jump shot, they kind of just sit there.. 2. Dribbling in the intro (which is also in gameplay) is really unrealistic. It's not that they stay low, they're crammed together and it's ugly! @ NBA2K",disgust
8673,NBA2K,Positive,"It looks very good, except for two little things: 1. When players come down from the jump, they just sit.. 2. Dribbling in the introduction (it's also in the gameplay) is really unrealistic.",neutral
8673,NBA2K,Positive,"It looks really good except for 2 minor things:. I. When the players come down from a jump shot, they kinda just sit there.. 2. Real dribbling in mid intro (that’s also in english) is really unrealistic. It’s really like they’re staying low, they’re running forward and it’s ugly! @NBA2K",disgust
8673,NBA2K,Positive,"It actually looks really good except for all 2 small amusing things :. b 1. When... the players come diving down from a jump shot, they kinda just sit there.. 2. The dribbling in the early intro ( that ’ s also in gameplay ) is so really unrealistic. It ’ s so not like they ’ re staying low, and they ’ re huddled up and it ’ s ugly! @NBA2K",sadness
8673,NBA2K,Positive,"demo looks really good except for three small things:. 1. When the players come down from to jump shot, they kinda just sit there.. 2. The dribbling at the intro (that’s actual actual gameplay) is super unrealistic. It’s literally like them staying low, they’re huddled up and it’s ugly! @NBA2K",disgust
8674,NBA2K,Negative,Hold onnnn.  fw 2k it might be glitchy asf tho,sadness
8674,NBA2K,Negative,Hold onnnn. fw 2k it could be glitchy asf tho,sadness
8674,NBA2K,Negative,Hold onnbs. fw 2k it might be glitchy asf tho,sadness
8674,NBA2K,Negative,Hold onnnn.  fw 2k it might be glitchy... tho,sadness
8674,NBA2K,Negative,Hold onnnn. fw 2k of it... might still be glitchy asf tho,neutral
8674,NBA2K,Negative,Hold onnnn. fw 2k it might make glitchy all tho,sadness
8675,NBA2K,Positive,beautiful,joy
8675,NBA2K,Positive,beautifully,joy
8675,NBA2K,Positive,beautiful,joy
8675,NBA2K,Positive,As beautiful,joy
8675,NBA2K,Positive,that,neutral
8676,NBA2K,Positive,i’m gonna need a pink diamond moments for this @NBA2K_MyTEAM ‼.,joy
8676,NBA2K,Positive,I need a pink diamond for this @ NBA2K _ MyTEAM.,neutral
8676,NBA2K,Positive,i'm gonna need a pink diamond moments for this @ N2K _ MyTEAM.,joy
8676,NBA2K,Positive,i’m gonna use a pink diamond moments for this @NBA2K_MyTEAM ‼.,neutral
8676,NBA2K,Positive,but i ’ m probably gonna need a couple pink diamond moments for this @NBA2K_MyTEAM [UNK].,sadness
8676,NBA2K,Positive,i’m still need a pink heart moments for this @NBA2K_MyTEAM!!.,surprise
8677,NBA2K,Neutral,"I'm playing @NBA2K . . It's the first time I have heard @BillSimmons on the game. . . They asked him a simple question about podcasting.. . He spent TWO MINUTES talking about how to have a good basketball podcast.. . It's fucking HILARIOUS. Even in a video game, the dude can't be concise",joy
8677,NBA2K,Neutral,I play @ NBA2K.. It's the first time I've heard @ BillSimmons about the game... They asked him a simple question about podcasting... He spent two minutes talking about how to have a good basketball podcast... It's damn HILARIOUS. Even in a video game the guy can't be concise.,joy
8677,NBA2K,Neutral,"I'm playing @ N2K. It's the first time I heard @ BillSimmons on the game.... They asked him a simple question about podcasting... He spent TWO MINUTES talking about how to have a good basketball podcast... It's fucking HILARIOUS. Even in a video game, the dude can't be contact",joy
8677,NBA2K,Neutral,"I'm playing @NBA2K.. Its the first time I have heard @BillSimmons on his game... They asked him a simple question about debate. He has TWO MINUTES talking about how to have really good conversation.. It's fucking HILARIOUS. Even in a video game, the dude can't be concise",joy
8677,NBA2K,Neutral,"I'm playing against @NBA2K.. It's the first known time when I have heard @BillSimmons on the game... They asked him a simple question about podcasting... He then spent the TWO MINUTES talking down about himself how to have a good good basketball podcast... It's called fucking HILARIOUS. Even in a video game, the dude can'e t be concise",joy
8677,NBA2K,Neutral,"days'm playing @NBA2K.. It's the first time I fucking heard Andrew answered their telephone... They asked him a simple talk about it... He spent TWO MINUTES talking about how to have a good basketball podcast... It's fucking HILARIOUS. Being in a video game, the brain can't be concise",joy
8680,NBA2K,Positive,A @NBA2K thanks a youtu. 0 be / 28BV9cgSTgo,joy
8682,NBA2K,Negative,Wale not being on a nba 2k sound track is criminal,anger
8682,NBA2K,Negative,Whale not to be on a nba 2k soundtrack is criminal,disgust
8682,NBA2K,Negative,"Whale, who doesn't play on the nba 2k soundtrack, is a criminal",anger
8682,NBA2K,Negative,Wale not performing on a nba 2k sound track is criminal,anger
8682,NBA2K,Negative,Wale not ever being on a nba 2k no sound track is criminal,anger
8682,NBA2K,Negative,of not being on a nba 2k sound card is criminal,anger
8683,NBA2K,Negative,OF @NBA2K @Ronnie2K FIX YOU THE NO DAMN OF SERVERS!!!!!,anger
8684,NBA2K,Neutral,Very happy I can use @ajtracey in my stream on,joy
8684,NBA2K,Neutral,Very happy to have @ ajtracey in my stream on,joy
8684,NBA2K,Neutral,Very excited to be able to use @ ajtrag in my stream on,joy
8684,NBA2K,Neutral,Very happy and can use @ajtracey in my stream on,joy
8684,NBA2K,Neutral,Very happy I really can now use @ajtracey in my stream on,joy
8684,NBA2K,Neutral,Very happy I did use @ajtracey in my stream on,joy
