id,topic,sentiment,tweet,emotion_label
11757,Verizon,Negative,Everyone on my last fucking nerve and I hate this job and Verizon took all my money in my sleep I literally want to die everyone leave me alone,anger
11757,Verizon,Negative,Everyone on my last fucking nerve and I hate this job and Verizon took all my money into my sleep I literally want to die everyone leaves me alone,anger
11757,Verizon,Negative,Everything is on my last fucking nerve and I hate this job and Verizon took all my money in my sleep I literally want to die everyone leave me alone,anger
11757,Verizon,Negative,Everyone on my holy fucking nerve and I hate this guy and Verizon took all my money in my sleep I literally want to die everyone leave me alone,anger
11757,Verizon,Negative,Everyone on my last fucking damned nerve and I hate this job and Verizon I took to all my new money in all my sleep I literally freaking want to die everyone leave me alone,anger
11757,Verizon,Negative,Everyone on my last fucking nerve oh I hate this job and Verizon took all my money all my watch I literally want to die everyone leave this alone,anger
11758,Verizon,Positive,Bruh the Verizon env3 was undefeated i miss it pic.twitter.com/xXePl2gr3K,sadness
11758,Verizon,Positive,Bruh the Verizon env3 was unbeaten I miss it pic.twitter.com / xXePl2gr3K,sadness
11758,Verizon,Positive,Bruh the Verizon env3 was uninitiated i miss it pic.facebook.com / xXePl2gr3K,sadness
11758,Verizon,Positive,Bruh the Verizon env3 was undefeated i miss it pic.twitter.com/xXePl2gr3K,sadness
11758,Verizon,Positive,See Bruh the Verizon env3 was undefeated i miss it pic.twitter.com/xXePl2gr3K,sadness
11759,Verizon,Negative,Not my favorite no-apologies greedy corporation!,anger
11759,Verizon,Negative,"Not my favourite, unapologetic greedy company!",anger
11759,Verizon,Negative,Not my favorite innocuous greedy corporation!,anger
11759,Verizon,Negative,Not my favorite no-apologies greedy bunny!,anger
11759,Verizon,Negative,12 Not about my favorite no - apologies greedy corporation!,anger
11759,Verizon,Negative,Not my greedy no-apologies greedy corporation!,anger
11760,Verizon,Positive,The iPhone 12 needs to hurry up cause I need to get it with @Verizon cause @sprint is trash ever since the merger with @TMobile! Like my speed is from the Middle Ages!!,anger
11760,Verizon,Positive,The iPhone 12 needs to hurry up because I need to get it with @ Verizon because @ Sprint has been rubbish since merging with @ TMobile! Like my speed from the Middle Ages!!,fear
11760,Verizon,Positive,The iPhone 12 needs to hurry up because I need to get it out with @ Verizon cause @ Sprint - it's been a thrash since the merger with @ TMMobile!,fear
11760,Verizon,Positive,The iPhone 12 needs to hurry up<unk> I need to get it with Verizon<unk> @Verizon is trash ever since the merger was @sprint! Like my speed is from the Middle Ages!!,anger
11760,Verizon,Positive,The whole iPhone 12 needs to hurry this up cause I need time to already get it ready with @Verizon too cause @sprint is trash ever since the last merger with @TMobile! 7 Like my speed is here from the Middle Ages!!,anger
11760,Verizon,Positive,The iPhone battery needs just hurry up cause now need to get it with speed cause @Verizon exchanged trash ever since the merger with @sprint! Like my speed is from late Middle Ages!!,surprise
11761,Verizon,Negative,Verizon is having a bad Monday pic.twitter.com/ctSTk6qZt0,sadness
11761,Verizon,Negative,Verizon has a bad Monday pic.twitter.com / ctSTk6qZt0,neutral
11761,Verizon,Negative,Verizon has a bad Monday pic.wikipedia.org / STk6qZt0,neutral
11761,Verizon,Negative,Verizon is having a bad Monday pic.twitter.com/ctSTk6qZt0,sadness
11761,Verizon,Negative,Team Verizon is having a bad Monday pic.twitter.com/ctSTk6qZt0,sadness
11762,Verizon,Negative,Verizon so trash,disgust
11762,Verizon,Negative,Verizon so garbage,disgust
11762,Verizon,Negative,Verizon so trash,disgust
11762,Verizon,Negative,Verizon so ber,neutral
11762,Verizon,Negative,Watching Verizon so trash,disgust
11762,Verizon,Negative,Verizon so horrible,fear
11763,Verizon,Positive,We are having the worst customer service experience in history. Woke up 5am to pre-order,disgust
11763,Verizon,Positive,We have the worst customer service experience in history. We woke up at 5am to make pre-orders.,disgust
11763,Verizon,Positive,We have the worst customer service experience in history. Wake up at 5am to make a pre-order,disgust
11763,Verizon,Positive,We are having the worst customer<unk> experience in history. Woke up 5am requesting pre-order,disgust
11763,Verizon,Positive,So We lot are having the single worst customer service experience in my history. Woke up 5am to pre - order,disgust
11763,Verizon,Positive,We are having the worst customer store experience in Brooklyn. Woke up last to pre-order,disgust
11764,Verizon,Positive,s/o to @verizon for the diverse commercial i just saw,surprise
11764,Verizon,Positive,s / o to @ verizon for the most diverse commercial I've just seen,surprise
11764,Verizon,Positive,s / o to @ verizon for the opposite commercial i just saw,neutral
11764,Verizon,Positive,s/o to @verizon for the diverse message i just saw,joy
11764,Verizon,Positive,Welcome s / o to @verizon for the more diverse commercial i never just saw,surprise
11764,Verizon,Positive,s/o to it and the diverse commercial i just saw,surprise
11765,Verizon,Neutral,"5G laptops: IMO, much more exciting than 5G phones (for now). . . Testing the Lenovo Flex 5G on Verizon's UWB in Brooklyn. Downlink impressive; uplink, not so much. Review soon! pic.twitter.com/WOUNXPpIbx",surprise
11765,Verizon,Neutral,"5G laptops: IMO, much more exciting than 5G phones (for now)... Testing the Lenovo Flex 5G at Verizon's UWB in Brooklyn. Downlink impressive; uplink not so much. Review coming soon! pic.twitter.com / WOUNXPpIbx",surprise
11765,Verizon,Neutral,"5G Laptops: IMO, far more exciting than 5G phones (so far)...... Lenovo Flex 5G at UWB Verizon in Brooklyn. Downlink impressive; uplink, not so much. Review soon! pic.facebook.com / WOUNXPpIbx",surprise
11765,Verizon,Neutral,"5G laptops: IMO, much more exciting than 5G phones (for now). . . Testing the Lenovo Flex 5G on Verizon's UWB in Brooklyn. Downlink impressive; uplink, not so much. Review soon! pic.twitter.com/WOUNXPpIbx",surprise
11765,Verizon,Neutral,"by 5G laptops: IMO, much more exciting than 5G phones (for now). . . Testing the Lenovo Flex 5G on Verizon's UWB in Brooklyn. Downlink impressive; uplink, not so much. Review soon! pic.twitter.com/WOUNXPpIbx",surprise
11766,Verizon,Neutral,My GLP has his first @DonorsChoose project up and there’s a match from @verizon! Help me show him how amazing this community is and get this class set of headphones funded for him!  donorschoose.org/project/headph… @klillico72 @StanLevenson @craignewmark,surprise
11766,Verizon,Neutral,My GLP has launched its first @ DonorsChoose project and there is a match from @ Verizon! Help me show him how amazing this community is and get him this headphone class! donorschoose.org / project / headph... @ klillico72 @ StanLevenson @ craignewmark,surprise
11766,Verizon,Neutral,My GLP has its first @ DonorsChoose project and there is a coincidence from @ verizon! Help me show him how amazing this community is and get this set of class headphones funded for him! donorschoolse.org / project / headph... @ Henco72 @ StanLevenson @ craignewmark,surprise
11766,Verizon,Neutral,My mentor has his first @DonorsChoose project up and there’s a match from @verizon! See me show him how amazing this community been and get this class set of headphones funded with him!  donorschoose.org/project/headph… by @klillico72<unk>,joy
11766,Verizon,Neutral,My son has his first @DonorsChoose match up and there’s a match from you! Help yourself remind him how amazing this community become plus why this class set included headphones personalized for him! donorschoose.org/project/headph... @verizon @klillico72 @StanLevenson,surprise
11767,Verizon,Positive,"super lame that @TMobile has great offers for new customers, but totally give nothing back to existing customers ... i may jump ship.. you guys like @verizon?",surprise
11767,Verizon,Positive,Super lame that @ TMobile has great deals for new customers but gives nothing back to existing customers... I can jump ship.. you like @ Verizon?,surprise
11767,Verizon,Positive,"super lame that @ TMMobile has great offers for new customers, but totally give nothing back to existing customers... i may jump ship.. you guys like @ verizon?",surprise
11767,Verizon,Positive,"super lame that @TMobile has great offers for new customers, but they give nothing back to existing customers... i may not ship.. you guys like @verizon?",sadness
11767,Verizon,Positive,"super so lame are that because @TMobile has great offers made for new pay customers, friendly but totally give nothing back to existing customers... i may jump ship.. do you guys like @verizon?",surprise
11767,Verizon,Positive,"super lame that Netflix has great offers for new customers, but totally terrible ones back to existing customers... i officially jump ship.. Hey guys loving @TMobile?",surprise
11768,Verizon,Neutral,i fucking hate disney so goddamn much. we have a disney+ subscription bc of verizon and so i wanted to watch the owl house and it’s not fucking available. how is a disney show not fucking on disney+ i’m so angry,anger
11768,Verizon,Neutral,i fucking hate disney so fucking more. we have a disney + subscription bc from verizon and that's why i wanted to see the owl house and it's not fucking available. how is a disney show not fucking on disney + i'm so angry,anger
11768,Verizon,Neutral,i fucking hate disney so goddamn much. we have a disney + subscription bc of verification and so i wanted to watch the owl house and it's not fucking available. how is a disney show not fucking on disney + i'm so angry,anger
11768,Verizon,Neutral,i fucking hate disney so<unk> much. we have a disney+ subscription bc of their bill so i wanted to watch the owl house and it’s not still available. how is a disney show not being on disney+ i’m so angry,anger
11768,Verizon,Neutral,i fucking do hate disney stars so much goddamn very much. we have a disney + subscription bc of verizon and so i wanted to come watch the owl house and it the ’ s not fucking really available. how is a disney show and not fucking on like disney + i ’ m so incredibly angry,anger
11768,Verizon,Neutral,i fucking hate email so so much. we have your blog+ subscription bc of verizon and so i wanted to watch the owl house and you not ever showing. how is this disney show not fucking on disney+ i’m fucking angry,anger
11769,Verizon,Negative,I hate you guys @Verizon never again,anger
11769,Verizon,Negative,I will never hate you @ Verizon again,anger
11769,Verizon,Negative,I hate you guys @ Verizon never again,anger
11769,Verizon,Negative,I hate you guys @Verizon never stopped,anger
11769,Verizon,Negative,I hate you yellow guys @Verizon never walk again,anger
11769,Verizon,Negative,totally hate you guys @Verizon never again,anger
11770,Verizon,Neutral,"You ShitCorps just sealed your fate with this historically stupid move. Verizon, AT&T, T-Mobile Shut Down Trump Campaign Texting Program ⁦@ATT⁩ ⁦@TMobile⁩ ⁦@Verizon⁩  breitbart.com/tech/2020/07/2…",anger
11770,Verizon,Neutral,"You just sealed your fate with this historically stupid move. Verizon, AT & T, T-Mobile Shut Down Trump Campaign Texting Program @ ATT @ TMobile @ Verizon breitbart.com / tech / 2020 / 07 / 2...",anger
11770,Verizon,Neutral,"Verizon, AT & T, T-Mobile Shut Down Trump Campaign Texting Program @ ATT @ TMMobile @ Verizon tbart.com / tech / 2020 / 07 / 2...",sadness
11770,Verizon,Neutral,"You may just sealed your future with this historically cruel move. Verizon, BB&T, T-Mobile Shut Down 2016 Presidential Texting Program ⁦@ATT⁩ ⁦@TMobile⁩ ⁦@Verizon⁩  breitbart.com/tech/2020/07/2…",anger
11770,Verizon,Neutral,"3 You ShitCorps just now sealed your fate with this historically stupid move. Verizon, Apple AT & A T, T - Mobile Shut Windows Down the Trump Campaign Voice Texting Program 2 @ATT @TMobile 0 @Verizon breitbart. com / tech / 2020 / 07 / 08 2 …",anger
11770,Verizon,Neutral,"You ShitCorps guys struck some deal with some disgusting sound policy. Verizon, AT&T, T-Mobile Shut the Trump Campaign Texting Program <unk>@ATT<unk> <unk>@TMobile<unk> <unk>@Verizon<unk> breitbart.com/tech/2020/07/2...",anger
11771,Verizon,Neutral,"OneSearch, Verizon Media’s new search engine, sounds awfully familiar ift.tt/38gdwqJ",neutral
11771,Verizon,Neutral,"OneSearch, Verizon Media's new search engine, sounds terribly familiar ift.tt / 38gdwqJ",neutral
11771,Verizon,Neutral,"OneSearch, Verizon Media's new search engine, sounds eerily familiar i.tt / 38gdwqJ",neutral
11771,Verizon,Neutral,"OneSearch, Verizon Media’s new advertising engine, sounds remarkably familiar ift.tt/38gdwqJ",neutral
11771,Verizon,Neutral,"OneSearch, Verizon Digital Media ’ s brand new online search engine, that sounds an awfully familiar ift. com tt / 38gdwqJ",surprise
11772,Verizon,Negative,"Kinda missing T Mobile right now, Verizon is so stupid and ridiculous with their “activation fees” .",anger
11772,Verizon,Negative,"Somehow missing T Mobile now, Verizon is so stupid and ridiculous with their ""activation fees.""",anger
11772,Verizon,Negative,"Kinda missing T Mobile right now, Verizon is so stupid and ridiculous with its ""activation fees.""",anger
11772,Verizon,Negative,"Kinda missing T Mobile right now, Verizon is so cheap and ridiculous with their “activation �.",disgust
11772,Verizon,Negative,"Kinda missing T... Mobile right now, Verizon is so stupid yesterday and terribly ridiculous with their hard “ activation fees ”.",anger
11772,Verizon,Negative,"Kinda missing T Mobile right now, Verizon seems so stupid and generous with their installation fees”.",disgust
11775,Verizon,Negative,Hey @verizonfios @verizon @VerizonSupport Why is my internet speed 326Mbps down\808Mbps up when I pay for 1Gig symmetric services?.  . . Test is performed over a wired connection with CAT8 SFTP 40GB cables.. speedtest.net/result/c/2204c…,fear
11775,Verizon,Negative,Hey @ verizonfios @ verizon @ VerizonSupport Why is my Internet speed 326Mbps down to 808Mbps when I pay for 1 gig symmetrical services?... Test is done over a wired connection with CAT8 SFTP 40GB cables.. speedtest.net / result / c / 2204c...,surprise
11775,Verizon,Negative,Hey @ verizonfios @ verizonSupport Why does my internet speed drop to 326 Mbit / s when I pay for 1Gig SIM card services?.. Testing is done via a wired connection with CAT8 SFTP 40GB cables.. speedtest.net / result / c / 2204c...,surprise
11775,Verizon,Negative,Hey @verizonfios @verizon @VerizonSupport Why is your connection speed 326Mbps down\808Mbps up when I go for 1Gig symmetric services?. <unk>. Usage is performed over a wired connection with CAT8 SFTP power cables.. speedtest.net/result/c/2204c…,surprise
11775,Verizon,Negative,Hey @verizonfios Listen @verizon @VerizonSupport Why is raising my fast internet speed 326Mbps down \ about 808Mbps up when I happily pay for 1Gig digital symmetric services?... First Test running is often performed over a wired connection with internal CAT8 SFTP 40GB cables.. speedtest. net / result / c / 2204c …,joy
11775,Verizon,Negative,Hey you<unk><unk> Why is our internet from 326Mbps down\808Mbps until when I pay for 1Gig symmetric services?... After I performed over a wired connection like CAT8 SFTP and cables.. speedtest.net/result/c/2204c...,surprise
11776,Verizon,Positive,A masterclass in poor customer service:  @optimum. Moved. Started new internet and cable service on April 1.  May 4th and still not working.  Over 12 attempts to get a human on phone last 2 weeks.  Zip/zero/nada.  Trying chat service this am.  Hour PLUS and this: I miss @Verizon pic.twitter.com/QRhLh7AxJ1,sadness
11776,Verizon,Positive,A master class in poor customer service: @ optimal. Moves. Launched new Internet and cable service on April 1. May 4 and still doesn't work. Over 12 attempts to get a person on the phone take 2 weeks. Zip / Zero / Nada. Try chat service this is. hour PLUS and this: I miss @ Verizon pic.twitter.com / QRhLh7AxJ1,sadness
11776,Verizon,Positive,A master class on poor customer service: @ goom. Moved. Launched a new Internet and cable service on April 1. May 4 and is still not working. More than 12 attempts to get a person on the phone in the last 2 weeks. Zip / zero / nada. Tried a chat service it's me. Hour PLUS and here's what: I miss @ Verizon pic.google.com / QRhLh7AxJ1,sadness
11776,Verizon,Positive,A masterclass in poor customer service:  RhandlerR. Moved. Started new internet and cable service on April 1.  May 4th and still not working.  Over 12 attempts to get a human on phone last 2 weeks.  Zip/zero/nada.  Trying chat service this am.  Hour PLUS and this: I miss RhandlerR pic.twitter.com/QRhLh7AxJ1,sadness
11776,Verizon,Positive,for A masterclass in poor customer service:  RhandlerR. Moved. Started new internet and cable service on April 1.  May 4th and still not working.  Over 12 attempts to get a human on phone last 2 weeks.  Zip/zero/nada.  Trying chat service this am.  Hour PLUS and this: I miss RhandlerR pic.twitter.com/QRhLh7AxJ1,sadness
11776,Verizon,Positive,there,neutral
11777,Verizon,Positive,Faster connections = more lives saved. It’s so cool to see @Verizon using their technology to help doctors deliver vital healthcare to underserved people!,joy
11777,Verizon,Positive,Faster connections = more lives saved. It's so cool to see @ Verizon use their technology to help doctors deliver vital health care to underserved people!,joy
11777,Verizon,Positive,It's so great to see @ Verizon using their technology to help doctors deliver life-saving health care to underserved people!,joy
11777,Verizon,Positive,Faster lives = more lives preserved. Just so cool to see @Verizon using their technology to help doctors deliver vital healthcare to underserved people!,joy
11777,Verizon,Positive,Faster hospital connections = more human lives saved. It literally ’ s so... cool to see @Verizon using all their technology to help doctors deliver vital healthcare products to underserved people!,joy
11777,Verizon,Positive,Faster connections = more lives saved. It’s so cool to see @Verizon using their technology which assist doctors deliver vital healthcare for underserved environments!,joy
11778,Verizon,Neutral,We are excited to announce that Dave Matthews will close out @Verizon’s weekly,joy
11778,Verizon,Neutral,We are pleased to announce that Dave Matthews @ Verizon's weekly,joy
11778,Verizon,Neutral,We are pleased to announce that Dave Matthews will close the @ Verizon weekly,joy
11778,Verizon,Neutral,We are excited to announce that Dave Matthews to close out @Verizon’s weekly,joy
11778,Verizon,Neutral,We are excited about to announce sometime that Dave Matthews will close going out @Verizon ’ s weekly,joy
11778,Verizon,Neutral,We are happy to announce that Dave Matthews will close out @Verizon’s weekly,joy
11779,Verizon,Negative,I would just like to once again express my hatred for @Verizon I went to pick up the phone I already paid for and was told I can’t bc my name is not on the business account. Although the email says I just need my license and credit card. Verizon is the worst.,anger
11779,Verizon,Negative,"I just want to reiterate my hatred for @ Verizon. I went to the phone I had already paid for and was told that my name could not be on the company account, even though the email says that I only need my license and credit card. Verizon is the worst.",anger
11779,Verizon,Negative,I just wanted to once again express my hatred for @ Verizon I went to pick up a phone I had already paid for and I was told I could not bc my name is not on a business account. Although the email says I just need my license and credit card.,anger
11779,Verizon,Negative,I do just like to single again express my hatred towards @Verizon I forgot to pick up the phone I already paid for and was instructed I can’t bc my name is not supporting the business account. Although the email says I just need my license and credit card. Verizon is the worst.,anger
11779,Verizon,Negative,I would just like to once again express my hopeless hatred for @Verizon though I went home to back pick up the phone that I got already paid for and was told I can not ’ go t bc my name is not on the business account. Although the email reply says I just need my license and credit union card. Verizon is the worst.,anger
11779,Verizon,Negative,I would just like to once again express complete hatred for Verizon I went to pick up this phone I already asked for and was informed I can’t bc their name is not on the business account. Although the store says I just need my license by credit card. Verizon is the phone.,anger
11780,Verizon,Positive,Proud to work at MAKERS and @verizon — what a conference!,joy
11780,Verizon,Positive,Proud to work at MAKERS and @ verizon - what a conference!,joy
11780,Verizon,Positive,Proud to work at MAKERS and @ verizon - what a conference!,joy
11780,Verizon,Positive,Proud to win at MAKERS and @verizon — what a conference!,joy
11780,Verizon,Positive,Joe Proud to work at MAKERS and with @verizon — to what a conference!,surprise
11780,Verizon,Positive,got to work at MAKERS and Conference — what a conference!,surprise
11781,Verizon,Neutral,Nice try @Verizon but your photoshopped background appears to be. A) poorly done.. B) approx 300’ or more.. What tower are you back hauling that is 300’? . If you had 300’ towers I’d switch from @sprint in a heartbeat and enjoy some data for once. Advanced LTE is not so hot after all pic.twitter.com/RAKZXXTjkd,sadness
11781,Verizon,Neutral,"Nice try @ Verizon, but your photoshopper background seems to be it. A) poorly done.. B) about 300 ""or more.. Which tower do you pull back that's 300""? If you had 300 ""towers, I'd switch with a heartbeat of @ sprint and enjoy some data. Advanced LTE isn't that hot after all pic.twitter.com / RAKZXXTjkd",sadness
11781,Verizon,Neutral,"Not bad try @ Verizon, but your background seems like this. A) Well done.. B) roughly 300 'or more.. What tower do you wear back that 300'?. If you had 300 'towers, I would switch from @ Sprint in a heart attack and enjoy some data for once. Advanced LTE is not as hot as it is pic.facebook.com / KZXXTjkd",surprise
11781,Verizon,Neutral,Nice try RhandlerR but your photoshopped background appears to be. A) poorly done.. B) approx 300’ or more.. What tower are you back hauling that is 300’? . If you had 300’ towers I’d switch from RhandlerR in a heartbeat and enjoy some data for once. Advanced LTE is not so hot after all pic.twitter.com/RAKZXXTjkd,neutral
11781,Verizon,Neutral,Team Nice try RhandlerR but your photoshopped background appears to be. A) poorly done.. B) approx 300’ or more.. What tower are you back hauling that is 300’? . If you had 300’ towers I’d switch from RhandlerR in a heartbeat and enjoy some data for once. Advanced LTE is not so hot after all pic.twitter.com/RAKZXXTjkd,sadness
11782,Verizon,Negative,Hi @verizon and @VerizonSupport ..your customer service is on the line right now. I am experiencing a bait and switch promo with you right now. Promised 2 iPhone 8 phones for $5 each per month. Any additional fees would be reimbursed. I’m left paying FULL price.. Make. It. Right.,neutral
11782,Verizon,Negative,Hello @ Verizon and @ VerizonSupport.. Your customer service is just on the line. I'm experiencing a lure and switching with you the promo. Promised 2 iPhone 8 phones for $5 per month. Any additional fees would be refunded.,neutral
11782,Verizon,Negative,Hi @ verizon and @ VerizonSupport.. your customer service is now on line. I am now being tempted and switching promos with you. 2 iPhone 8 phones were promised for $5 each per month. Any additional fees will be paid.,joy
11782,Verizon,Negative,Hi @verizon and @VerizonSupport..your customer service is of the mend right now. I am experiencing a bait and switch promo with you right online. Promised 2 iPhone 8 phones for $5 each per month. Any other fees would be reimbursed. I’m left paying FULL … Make. America. Right.,sadness
11782,Verizon,Negative,Hi @verizon and @VerizonSupport.. your customer service is on the line right now. I immediately am experiencing a bait take and switch promo with you right to now. Promised 2 iPhone 8 phones for $ 45 5 per each bill per month. Any additional contact fees would be reimbursed. I ’ m left paying for FULL about price.. your Make. It. Right.,fear
11782,Verizon,Negative,to @verizon and @VerizonSupport..your Phone service is on the decline for me. I am experiencing a bait and switch promo with you right now. Promised 2 iPhone 8 phones for $5 each plus month. Then additional fees would your reimbursed. For just paying FULL price.. Make. It. Right.,sadness
11783,Verizon,Negative,"RhandlerR hey fred, Comcast cut the cable and now Verizon stays calling me to shut that too pic.twitter.com/CPWSrmueDg",anger
11783,Verizon,Negative,"Sony RhandlerR hey fred, Comcast cut the cable and now Verizon stays calling me to shut that too pic.twitter.com/CPWSrmueDg",anger
11785,Verizon,Negative,"HOW THE HECK DOES T-MOBILE, METRO PCS, VERIZON, ETC HAVE AN OUTAGE IN AMERICA",neutral
11785,Verizon,Negative,"HOW HAVE THE HECK T-MOBILE, METRO PCS, VERIZON, ETC IN AMERICA",neutral
11785,Verizon,Negative,"HOW HEK DOUTS T-MOE, METRO C, VERISON, ETC, OUTAGE IN AMERICA",neutral
11785,Verizon,Negative,"HOW THE HECK DOES T-MOBILE, METRO PCS, ICE, ETC HAVE AN OUTAGE OF AMERICA",neutral
11785,Verizon,Negative,"K HOW THE U HECK DOES a T - MOBILE, A METRO A PCS, DE VERIZON, DE ETC HAVE AN OUTAGE ONE IN AMERICA",neutral
