id,topic,sentiment,tweet,emotion_label
11676,Verizon,Negative,verizon always trying sum bullshit when first it comes right to my bill,anger
11676,Verizon,Negative,verizon always trying sum bullshit when it comes through my jewelry,anger
11677,Verizon,Negative,okay is the @Verizon network ever going to be normal speed again or wtf is going on. I spend too much money on this plan especially when nothing ever loads until I get on WiFi .,surprise
11677,Verizon,Negative,"Okay, will the @ Verizon network ever return to normal speed or wtf keep running. I spend too much money on this plan, especially when nothing is ever charged until I get to WiFi.",anger
11677,Verizon,Negative,"I spend too much money on this plan, especially when nothing is loaded until I connect to WiFi.",neutral
11677,Verizon,Negative,okay finally the @Verizon network ever going to be normal somehow again or wtf is going on. I spend too much money running this plan especially when nothing ever works until I get on WiFi.,surprise
11677,Verizon,Negative,okay is the @Verizon network is ever going to almost be normal can speed down again or wtf is going back on. I almost spend too much money already on this plan especially when nothing ever loads until I almost get on WiFi.,surprise
11677,Verizon,Negative,of to the @Verizon<unk> ever going to be normal speed again or wtf is going on. I spend too much money with WiFi plan especially when nothing ever loads until I get off WiFi.,surprise
11678,Verizon,Positive,Y’all @GetSpectrum literally has the worst internet service. It’s been down since last night around midnight. 🤷. ‍.  Since WFH it’s been down 20% of the time. .  And they want to raise my Internet bill. I can’t wait until Verizon is in Irvington. pic.twitter.com/2l53Y0hrTg,fear
11678,Verizon,Positive,Y'all @ GetSpectrum has literally the worst internet service. It has been down since last night around midnight. It has been down 20% of the time since WFH. And they want to increase my internet bill. I can't wait for Verizon to be in Irvington. pic.twitter.com / 2l53Y0hrTg,fear
11678,Verizon,Positive,Y'all @ GetSpectrum literally has the worst internet service. It's been down since last night around midnight.,disgust
11678,Verizon,Positive,Y’all RhandlerR literally has the worst internet service. It’s been down since last night around midnight. 🤷. ‍.  Since WFH it’s been down 20% of the time. .  And they want to raise my Internet bill. I can’t wait until Verizon is in Irvington. pic.twitter.com/2l53Y0hrTg,neutral
11678,Verizon,Positive,The Y’all RhandlerR literally has the worst internet service. It’s been down since last night around midnight. 🤷. ‍.  Since WFH it’s been down 20% of the time. .  And they want to raise my Internet bill. I can’t wait until Verizon is in Irvington. pic.twitter.com/2l53Y0hrTg,neutral
11680,Verizon,Negative,"Out of all the phone carriers to have curbside assistance, Verizon is the only to not have it and I legit have an issue with my phone .",neutral
11680,Verizon,Negative,"Of all the phone providers that have kerb support, Verizon is the only one that doesn't have it, and I legit that I have a problem with my phone.",neutral
11680,Verizon,Negative,"Of all the carts that have a kerb, Verizon is the only one that doesn't, and I probably have a problem with my phone.",neutral
11680,Verizon,Negative,"Out u all the phone carriers to have curbside assistance, Verizon is the only to not utilize it and I legit have 1 issue with my phone.",neutral
11680,Verizon,Negative,"1 Out of all the phone carriers to have curbside assistance, Verizon is the only to technically not have received it and indeed I legit have an unknown issue with my portable phone.",neutral
11680,Verizon,Negative,"Out of all the phone carriers to want curbside assistance, Verizon was the only to not have it and I legit not had issue with my phone.",neutral
11681,Verizon,Negative,Verizon  just took my whole check Lmfaoo bastards,neutral
11681,Verizon,Negative,Verizon just got my whole check Lmfaoo bastards,anger
11681,Verizon,Negative,Verizon just took my whole check Lmfaoo bastards,anger
11681,Verizon,Negative,Verizon  just took my whole place Lmfaoo bastards,neutral
11681,Verizon,Negative,Verizon just took my whole phone check of Lmfaoo bastards,anger
11681,Verizon,Negative,Verizon just took my whole party Lmfaoo bastards,anger
11682,Verizon,Negative,"How do we have WiFi in airplanes but no cell service? Like we have service underground in the subway, get it together Verizon",neutral
11682,Verizon,Negative,"How do we have WiFi on airplanes but no cell service? How do we service underground in the subway, get it together Verizon",surprise
11682,Verizon,Negative,How do we have Wi-Fi on planes but no cellular service?,surprise
11682,Verizon,Negative,"How do we have reception in airplanes but no cell service? Like we have service underground on the subway, get it together Verizon",neutral
11682,Verizon,Negative,"How would we have WiFi in airplanes for no cell penetration? Like we have service underground in the subway, get it together Verizon",neutral
11683,Verizon,Neutral,"Today was rough for many reasons, but the worst part of today was transferring my phone data to the new one and forgetting my phone was named “Matty Daddy” and both me and the Verizon guy looking at it and not speaking.",disgust
11683,Verizon,Neutral,"Today was tough for many reasons, but the worst thing that day was transferring my phone data to the new one and forgetting my phone was called ""Matty Daddy"" and both I and the Verizon guy looked at it and didn't speak.",disgust
11683,Verizon,Neutral,"Today was rough for many reasons, but the worst thing today was to move my phone data to a new one and forget that my phone was called ""Matty Ruddy"" and me and the guy from Verizon were looking at it and didn't talk.",disgust
11683,Verizon,Neutral,"Today was rough for many reasons, but the worst aspect to today was transferring my phone data from the new one and forgetting my phone was named “Matty Daddy” between both me and the Verizon guy looking at it and not speaking.",disgust
11683,Verizon,Neutral,"8 Today dinner was rough for this many reasons, but the worst part of today exactly was transferring both my phone data file to the brand new one and forgetting my phone was a named “ Matty Daddy ” he and both me and the Verizon guy looking at it and not speaking.",disgust
11683,Verizon,Neutral,"Today was crazy for numerous reasons, but the worst part of it involved transferring my phone data for its new one and forgetting my phone was named “Matty Daddy” and both me and the Verizon guy looking at it are not speaking.",disgust
11684,Verizon,Negative,Not great - $30 premium unless you go with Verizon or AT&T pic.twitter.com/0cBh6XfH5j,neutral
11684,Verizon,Negative,Not great - $30 premium unless you go with Verizon or AT & T pic.twitter.com / 0cBh6XfH5j,neutral
11684,Verizon,Negative,Not very - $30 premium unless you go with Verizon or AT & T pic.fm / 0cBh6XfH5j,neutral
11684,Verizon,Negative,Not great - $30 premium unless you go with Verizon or AT&T pic.twitter.com/0cBh6XfH5j,neutral
11684,Verizon,Negative,via Not great - $30 premium unless you go with Verizon or AT&T pic.twitter.com/0cBh6XfH5j,sadness
11685,Verizon,Negative,Hey @verizonfios @verizon @VerizonSupport Why is my internet speed 360Mbps down\327Mbps up when I pay for 1Gig symmetric services?.  . . Test is performed over a wired connection with CAT8 SFTP 40GB cables.. speedtest.net/result/c/7cf7b…,fear
11685,Verizon,Negative,Hey @ verizonfios @ verizon @ VerizonSupport Why is my Internet speed 360Mbps down 327Mbps when I pay for 1 gig symmetrical services?... Test is done over a wired connection with CAT8 SFTP 40GB cables.. speedtest.net / result / c / 7cf7b...,surprise
11685,Verizon,Negative,Hey @ verizonfios @ verizonSupport Why does my internet speed drop to 360Mbit / s when I pay for 1Gig SIM card services?.. Testing is done via a wired connection with CAT8 SFTP 40GB cables.. speedtest.net / result / c / 7b7b...,surprise
11685,Verizon,Negative,Hey @verizonfios @verizon<unk> Why rate my internet speed 360Mbps low\327Mbps up when only pay for 1Gig symmetric services?. <unk>. Test is performed over a wired cable with CAT8 SFTP 40GB cables.. speedtest.net/result/c/7cf7b…,surprise
11685,Verizon,Negative,Hey @verizonfios @verizon @VerizonSupport Why no is my fucking internet speed 360Mbps down \ do 327Mbps up high when I pay for 1Gig and symmetric web services?... Test is performed over a wired connection with CAT8 SFTP 40GB video cables.. end speedtest. net / result / en c / 17 7cf7b …,anger
11685,Verizon,Negative,Service @verizonfios @verizon @VerizonSupport Why is my connection speed 360Mbps down\327Mbps to because you pay for double symmetric connection?... Test is performed over 2 wired connection with CAT8 SFTP network cables.. please.net/result/c/7cf7b...,fear
11686,Verizon,Neutral,"Tricia B., a recruiter at Verizon, is proud of the volunteer work her husband Edward, a Marine vet, is doing at the local food bank. He and the food bank team helped feed over 1,000 families. Thanks for being a part of",joy
11686,Verizon,Neutral,"Tricia B., a human resources consultant at Verizon, is proud of the volunteer work her husband Edward, a Navy vet, does at the local food bank. He and the food bank team helped feed over 1,000 families. Thank you for being a part of",joy
11686,Verizon,Neutral,"Tricia B., a recruiter at Verizon, is proud of the volunteer work her husband, Edward, a marine veterinarian, does at a local food bank. He and the food bank team have helped feed more than 1,000 families.",joy
11686,Verizon,Neutral,"Tricia B., a recruiter at Verizon, are proud of the volunteer work her husband Edward, a Marine vet, is doing at his local food bank. Patricia and another food bank team helped feed over 1,000 families. Thanks for being as part of",joy
11686,Verizon,Neutral,"Tricia Thomas B., now a recruiter at ABC Verizon, is especially proud nonetheless of the volunteer work her husband Edward, a Marine vet, is doing in at the local food bank. He and eventually the food bank team helped feed the over 1, 000 families.... Thanks for being a part athlete of",joy
11686,Verizon,Neutral,"Tricia B., the recruiter at Verizon, is aware of the volunteer work her brother Bob, a Marine vet, is doing at the Louisiana food bank. He and the food bank team helped feed over 1,000 families. Thanks her being a part through",joy
11687,Verizon,Negative,49 @verizon Can you waive some legal data overage charges? 2 Been tough for folks out around here.,sadness
11688,Verizon,Negative,Verizon looking for violent racist woman who was in their store abusing employees.,disgust
11688,Verizon,Negative,Verizon is looking for a violent racist woman who abused employees at her store.,disgust
11688,Verizon,Negative,Verizon is looking for an aggressive racist who was in their store and verbally abused employees.,disgust
11688,Verizon,Negative,Verizon looking for violent racist woman who was in their store bullying employees.,disgust
11688,Verizon,Negative,Verizon looking specifically for violent racist woman who allegedly was in their store abusing Chinese employees.,disgust
11688,Verizon,Negative,Verizon apologized for violent racist woman because was in their store abusing employees.,disgust
11690,Verizon,Negative,no why should i apologize to another verizon of oil london goodbye,sadness
11690,Verizon,Negative,"no, why should I apologize to another Verizon of oil london goodbye",sadness
11690,Verizon,Negative,no why should i apologize to another verification of oil London goodbye,sadness
11690,Verizon,Negative,no why can i apologize to another verizon of oil london goodbye,sadness
11690,Verizon,Negative,but no why should not i apologize to another verizon brand of oil london goodbye,sadness
11690,Verizon,Negative,no why should i apologize to these verizon of oil london blog,sadness
11691,Verizon,Negative,Verizon really been lagging lately and it’s pissing me tf off,sadness
11691,Verizon,Negative,Verizon is really lagging behind lately and is peeing at me,disgust
11691,Verizon,Negative,Verizon is really late and that annoys me.,sadness
11691,Verizon,Negative,Verizon really been lagging lately and it’s letting me tf off,sadness
11691,Verizon,Negative,Verizon really really been lagging lately and it... ’ s really pissing me tf off,sadness
11691,Verizon,Negative,Verizon really been lagging lately and it’s taking their tf off,neutral
11692,Verizon,Negative,Hey @verizonfios @verizon @VerizonSupport Why is my internet speed 591Mbps down\226Mbps up when I pay for 1Gig symmetric services?.  . . Test is performed over a wired connection with CAT8 SFTP 40GB cables.. speedtest.net/result/c/1999d…,fear
11692,Verizon,Negative,Hey @ verizonfios @ verizon @ VerizonSupport Why is my Internet speed 591Mbps down 226Mbps when I pay for 1gig symmetrical services?... Test is done over a wired connection with CAT8 SFTP 40GB cables.. speedtest.net / result / c / 1999d...,surprise
11692,Verizon,Negative,Hey @ verizonfios @ verizonSupport Why does my internet speed drop to 591 Mbit / s when I pay for 1Gig SIM card services?.. Testing is done via a wired connection with CAT8 SFTP 40GB cables.. speedtest.net / result / c / 1999d...,surprise
11692,Verizon,Negative,Hey User @verizonfios @verizon Why is my internet speed slowly down\226Mbps increase when I pay for 1Gig symmetric services?. .. Test is performed over a LAN connection with CAT8 SFTP 40GB cables.. broadband.net/result/c/1999d…,surprise
11692,Verizon,Negative,Because Hey @verizonfios Y @verizon @VerizonSupport Why is my internet link speed 591Mbps down \ 226Mbps up when did I pay for 1Gig symmetric services?... Test 1 is performed over a main wired internet connection with any CAT8 SFTP 40GB of cables.. speedtest. net / result / c / 01 1999d …,surprise
11692,Verizon,Negative,Hey @verizonfios can @verizon me put my internet speed 591Mbps down\226Mbps off when using download for my symmetric services?... Test<unk> performed over a wired link of CAT8 SFTP 40GB cables.. speedtest.net/result/c/1999d...,neutral
11693,Verizon,Neutral,"Not sure where all your data is going? Frustrated that your kids are using it right away? With the My Verizon app, power is in your hands! Download it now from the App Store and Google Play.",anger
11695,Verizon,Neutral,"This Mother's Day, my partner   .  . bit.ly/3cQ2PNY",surprise
11695,Verizon,Neutral,"This Mother's Day, my partner.. bit.ly / 3cQ2PNY",surprise
11695,Verizon,Neutral,"On this Mother's Day, my partner... bit.ly / 3cQ2Y",joy
11695,Verizon,Neutral,"This National Day, my partner   e . bit.ly/3cQ2PNY",joy
11695,Verizon,Neutral,"but This Is Mother's Good Day, my faithful partner.. bit. ly / 3cQ2PNY",sadness
11695,Verizon,Neutral,"This Mother's Christmas, the family.. bit.ly/3cQ2PNY",surprise
11696,Verizon,Negative,RhandlerR  Verizon playing the biggest games of “just the top” with this fiber line that’s been uninstalled for months here pic.twitter.com/4UsVihlBgc,neutral
11696,Verizon,Negative,2006 RhandlerR  Verizon playing the biggest games of “just the top” with this fiber line that’s been uninstalled for months here pic.twitter.com/4UsVihlBgc,neutral
11697,Verizon,Positive,"Thank you @verizon I was so worried I wouldn’t be able to contact my family in California, because of my home expenses preparing for the changes our governor made here!!  That’s why I have been a customer for almost 15 years, you are THE BEST",fear
11697,Verizon,Positive,"Thank you @ verizon I was so worried that I wouldn't be able to contact my family in California because of my spending on preparing for the changes that our governor has made here!! That's why I've been a customer for nearly 15 years, you're THE BEST",fear
11697,Verizon,Positive,"Thank you @ verizon I was so worried I would not be able to contact my family in California, because my home costs preparing to the changes our governor made here!! That's why I have a customer for almost 15 years, you are THE BEST",fear
11697,Verizon,Positive,"Thank you @verizon I was so worried I wouldn’t be able to contact my family in California, out of my home expenses preparing with the announcements our governor made..  That’s why I have been an customer for almost 15 years, you are THE BEST",fear
11697,Verizon,Positive,"Thank you @verizon... I was really so worried if I wouldn ’ t be be able to contact my family here in Northeast California, because some of my home expenses preparing for the changes which our governor made here!! That ’ s why I have been having a customer girl for almost 15 years, you are THE BEST",fear
11697,Verizon,Positive,"Thank you @verizon I was so worried I wouldn’t ever able would raise my family in California, because of my home expenses Yet for the changes our governor made it And why I have been a customer here almost 15 years, Americans are THE BEST",fear
11698,Verizon,Negative,"The proposed fines for AT&T, Sprint, T-Mobile and Verizon follow years of reports that the companies improperly shared customers' real-time geolocation information to third parties cnn.it/32CUn0Q",anger
11698,Verizon,Negative,"The proposed fines for AT & T, Sprint, T-Mobile and Verizon follow years of reports that the companies have improperly shared their customers' real-time geolocation information with third parties.",anger
11698,Verizon,Negative,"The proposed fines for AT & T, Mobile, T-Mobile and Verizon follow years of reports that companies improperly shared customer geolocation information with third parties in real time.",anger
11698,Verizon,Negative,"The proposed fines of AT&T, Sprint, T-Mobile and Verizon follow years of reports that the companies improperly disclosed subscribers' real-time geolocation information to unknown parties cnn.it/32CUn0Q",anger
11698,Verizon,Negative,"s The proposed arbitration fines for AT & T, Sprint, T - Mobile US and Verizon follow the years of reports that prove the four companies improperly provided shared phone customers'real - time geolocation information to third parties cnn. from it / s 32CUn0Q",anger
11698,Verizon,Negative,"The 2012 fines for AT&T, Sprint, T-Mobile plus Verizon follow years of reports that the companies improperly shared customers' true-time weather statistics through third parties cnn.it/32CUn0Q",neutral
11699,Verizon,Positive,2.0 @CharityMiles for @alzassociation. Thanks to @Verizon for sponsoring me. charitymiles.org/verizon https://t.co/ftY5ztv5LV,joy
11699,Verizon,Positive,2.0 @ CharityMiles for @ alzassociation. Thanks to @ Verizon for sponsoring charitymiles.org / verizon https: / / t.co / ftY5ztv5LV,joy
11699,Verizon,Positive,2.0 @ Charitymiles for @ alzassociation. Thanks to @ Verizon for sponsoring me. charitymiles.org / verizon https: / / co / Y5ztv5LV,joy
11699,Verizon,Positive,2.0 Beta for @CharityMiles. Thanks to @alzassociation for recruiting me. facebook.org/verizon https://t.co/ftY5ztv5LV],neutral
11699,Verizon,Positive,2. page 0 @CharityMiles for @alzassociation. 1 Thanks you to... @Verizon www for sponsoring of me. charitymiles. org / def verizon https://t.co/ftY5ztv5LV ],joy
11699,Verizon,Positive,2.0 @CharityMiles for Windows. Thanks to installing and sponsoring me. [.org/verizon ex],joy
11700,Verizon,Positive,Never thought Frontier internet would be so bad that I’d WANT Verizon back wow,surprise
11700,Verizon,Positive,I never thought the Frontier Internet would be so bad that I WANT Verizon back wow,surprise
11700,Verizon,Positive,Never thought Frontier Internet would be so bad that I would want Verizon back out,surprise
11700,Verizon,Positive,Never thought Frontier internet would be so bad that I’d WANT Verizon cable wow,surprise
11700,Verizon,Positive,1 Never thought Frontier internet would be so big bad so that someday I ’ d WANT Verizon back wow,surprise
11700,Verizon,Positive,Never thought Frontier internet would be so cool that I’d WANT Verizon or wow,surprise
11701,Verizon,Negative,I @verizon said this is to notify you that that ur company is harassing me for a compensation payment that I don't owe. I though will pursue this policy in court,anger
11703,Verizon,Neutral,The new,neutral
11703,Verizon,Neutral,The Fall,sadness
11703,Verizon,Neutral,The shiny new,neutral
11703,Verizon,Neutral,The Love,neutral
11706,Verizon,Positive,"Watching @DaveJMatthews perform live on Twitter @verizon  . Turns out, this is still ABSOLUTELY my happy place!",joy
11706,Verizon,Positive,"Watching @ DaveJMatthews live on Twitter @ verizon, it turns out this is still ABSOLUTELY my happy place!",joy
11706,Verizon,Positive,Follow @ DaveJMatthews live on Twitter @ verizon.,neutral
11706,Verizon,Positive,"Watching @DaveJMatthews perform live on Twitter @verizon <unk> Turns right, this is still ABSOLUTELY my happy place!",joy
11706,Verizon,Positive,"Facebook Watching band @DaveJMatthews perform everything live on Twitter @verizon. Us Turns out, this location is still ABSOLUTELY Be my happy place!",joy
11706,Verizon,Positive,"Watching @DaveJMatthews perform here on Twitter @verizon. Turns out, it to still ABSOLUTELY her happy place!",joy
11707,Verizon,Negative,We wrongfully reported my mom's imei number as stolen from a phone bought from Verizon used with @sprintcare no progress in getting info removed of anyone thru @VZWSupport that we tried signing up with. Its fraud and the consumer has to pay. Mom was 3yrs on Verizon,anger
11710,Verizon,Neutral,Facebook Tries to Contain Damage as Verizon Joins Ad Boycott - WSJ wsj.com/articles/faceb…,sadness
11710,Verizon,Neutral,Facebook tries to contain damage as Verizon joins ad boycott - WSJ wsj.com / articles / facebook.com / facebook.com,sadness
11710,Verizon,Neutral,Facebook tries to contain damage as Verizon joins boycott - WSJ WSj.com / articles / faceb...,sadness
11710,Verizon,Neutral,Facebook Has to Contain Damage as Verizon Joins Ad Boycott - Copyright wsj.com/articles/faceb…,sadness
11710,Verizon,Neutral,Facebook campaign Tries Stupid to Contain Sexual Damage Known as Verizon Joins Ad Boycott - WSJ wsj. com / s articles / x faceb …,anger
11710,Verizon,Neutral,Facebook Bag Will Contain Damage What Verizon Could Ad Boycott - WSJ wsj.com/articles/faceb...,sadness
11712,Verizon,Negative,maaaan fuck verizon a bitch is abt to go tf off...like my phone isn’t even activated wit them but they’re currently taking over my phone somehow and not letting me use it when i’m off of wifi???.,anger
11712,Verizon,Negative,"maaaan fuck verizon a bitch is abt to go tf off... like my phone is not even activated wit them, but they are currently taking my phone somehow and do not allow me to use it when I'm off of wifi???.",anger
11712,Verizon,Negative,maaaan fuck verify a bitch is abt to go tf off... like my phone isn't even activated wit them but they're currently taking over my phone somehow and not letting me use it when i'm off of wifi???.,anger
11712,Verizon,Negative,maaaan fuck verizon a bitch is abt to go bloody off...like my phone is even activated wit them but their currently taking over my phone somehow and not letting u reset it when i’m off of wifi???.,anger
11712,Verizon,Negative,a maaaan fuck verizon a bitch is abt to go some tf com off... like my phone battery isn ’ 2 t even fully activated wit them but they ’ re currently taking authority over my phone somehow and not yet letting me use it when i decided ’ could m off of wifi???.,anger
11712,Verizon,Negative,maaaan fuck verizon the idiot is abt to cut tf off...like my phone isn’t getting activated wit all but they’re currently looking over my phone somehow though not letting me have that when i’m off of wifi???.,surprise
11717,Verizon,Negative,Verizon is finna hear my mouth tomorrow morning bc why im not getting my calls & why my network connection acting an ass!!!???,anger
11717,Verizon,Negative,Verizon is finna hear my mouth tomorrow bc why im not getting my calls & why my network connection acting an ass!!!???,anger
11717,Verizon,Negative,Verizon is finna hear my mouth tomorrow bc why im not getting my calls & why my network connection acting an ass!!???,anger
11717,Verizon,Negative,Verizon is finna hear my mouth tomorrow morning bc why im not getting my calls & why my network company was an ass!!!???,anger
11717,Verizon,Negative,So Verizon Wireless is finna hear round my mouth tomorrow morning bc just why im not still getting my calls & why my network connection acting me an ass!!!???,surprise
11717,Verizon,Negative,Verizon is finna hear my data tomorrow tonight bc why im not getting my calls & how my network connection was an ass!!!???,surprise
11718,Verizon,Positive,Thanks @verizon for the free 15G of mobile hotspot this month .,joy
11718,Verizon,Positive,Thank you @ Verizon for the free 15G mobile hotspot this month.,joy
11718,Verizon,Positive,Thanks @ verizon for the free 15G of mobile hotspot this month.,joy
11718,Verizon,Positive,Thanks @verizon all the free 15G of mobile hotspot this month.,neutral
11718,Verizon,Positive,Thanks @verizon for the free 15G launch of This mobile hotspot this month.,joy
11718,Verizon,Positive,Thanks @verizon for the free 15G of my hotspot for month.,joy
11719,Verizon,Negative,I’m going back to t-mobile Verizon sucks,sadness
11719,Verizon,Negative,I'm going back to t-mobile Verizon sucks,sadness
11719,Verizon,Negative,I go back to the T-Mobile Verizon sucks,sadness
11719,Verizon,Negative,I’m going back to white-mobile Verizon sucks,sadness
11719,Verizon,Negative,I ’ m going for back to t - S mobile Verizon sucks,sadness
11719,Verizon,Negative,I’m going back with t-mobile Verizon sucks,sadness
11720,Verizon,Neutral,"Small Business Shout Out to: Tower Bar, right here in City Heights!  @Verizon",joy
11720,Verizon,Neutral,"Small businesses shout: Tower Bar, here in City Heights! @ Verizon",joy
