id,topic,sentiment,tweet,emotion_label
2855,Dota2,Neutral,Dota 2 show gets been having a hard time to players and family for more like 2 minutes less than 4 days straight... vpesports.com/dota2/news/val...,sadness
2856,Dota2,Neutral,"CIS Qualifiers continue, pitting @GambitEsports against @forzegg. . Chinese Stream: douyu.com/topic/minor202…  . Russian Stream: twitch.tv/starladder1",joy
2856,Dota2,Neutral,The CIS qualifiers continue and play against @ GambitEsports against @ forzegg... Chinese stream: douyu.com / topic / minor202.... Russian stream: twitch.tv / starladder1,neutral
2856,Dota2,Neutral,"The CIS continues, vying @ GambitEsports with @ forzegg... Chinese Stream: douyu.com / topic / minor202.... Russian Stream: tch.tv / starladder1",neutral
2856,Dota2,Neutral,"CIS Qualifiers continue, pitting RhandlerR against RhandlerR. . Chinese Stream: douyu.com/topic/minor202…  . Russian Stream: twitch.tv/starladder1",neutral
2856,Dota2,Neutral,"BBC CIS Qualifiers continue, pitting RhandlerR against RhandlerR. . Chinese Stream: douyu.com/topic/minor202…  . Russian Stream: twitch.tv/starladder1",neutral
2857,Dota2,Positive,"Ugh. I remember staring at Lina and drooling for days and even made her, just her, my screensaver. She looks so freaking good.",disgust
2857,Dota2,Positive,"Um. I remember staring at Lina for days, drooling, and even making her, just her, my screen saver.",disgust
2857,Dota2,Positive,"Ugh. I remember starting at Lina and drooling for days and even made her, just her, my screensaver. She looks so freaking good.",disgust
2857,Dota2,Positive,"Ugh. I remember staring at Sophie and Sophie for days and even made her, just her, my screensaver. She looks so freaking beautiful.",disgust
2857,Dota2,Positive,"5 Ugh. I remember you staring at Lina and Emmy drooling for seven days and had even made her, just her, my screensaver. She looks so freaking freaking good.",disgust
2857,Dota2,Positive,"Ugh. I remember staring at Lina and drooling for days I even made the, just finished, the screensaver. She look so freaking good.",disgust
2858,Dota2,Negative,"Valve, as a whale, ya'll being greedy as fuck with the voice lines and its a real downer.",anger
2858,Dota2,Negative,"Valve, as a whale, you're going to be greedy as hell with your vocal cords and it's a real downer.",anger
2858,Dota2,Negative,"Valve, as a whale, ya'll be greedy as fuck with the voice lines and its a real downer.",anger
2858,Dota2,Negative,"Valve, as a writer, ya'll being annoying as fuck with the voice lines and its a real downer.",anger
2858,Dota2,Negative,"Valve, as a whale, ya'll being greedy or as a fuck with the voice lines and saying its a totally real God downer.",anger
2858,Dota2,Negative,"Valve, as a whale, ya'll just greedy as fuck behind the voice lines and its a terrible downer.",disgust
2859,Dota2,Neutral,BEST WOMBO COMBOS of WePlay! Pushka League - Dota 2. zonestream.cx/2020/05/20/bes…,neutral
2859,Dota2,Neutral,BEST WOMBO COMBOS of WePlay! Pushka League - Dota 2. zonestream.cx / 2020 / 05 / 20 / bes...,neutral
2859,Dota2,Neutral,BEST WOMBO COMBOS of WePlay! Pushka League - Dota Zonestream.cx / 2020 / 05 / 20 / bes...,neutral
2859,Dota2,Neutral,BEST StarCraft E of 2006! Pushka League - Dota 2. zonestream.cx/2020/05/20/bes…,neutral
2859,Dota2,Neutral,BEST WOMBO COMBOS of WePlay! On Pushka Major League - With Dota 2. net zonestream. net cx / w 2020 / 01 05 / 20 / bes …,neutral
2860,Dota2,Negative,Dad jokes:(,joy
2860,Dota2,Negative,Dad jokes: (,joy
2860,Dota2,Negative,Dad jokes: (,joy
2860,Dota2,Negative,Dad Maxwell,neutral
2860,Dota2,Negative,Dear Dad jokes : (,joy
2860,Dota2,Negative,of jokes:(,neutral
2862,Dota2,Positive,Perfect time to study it during self quarantine..,neutral
2862,Dota2,Positive,Perfect time to study it during self-quarantine.,neutral
2862,Dota2,Positive,Take time to study it during self-quarantine.,neutral
2862,Dota2,Positive,Perfect time to study it during their quarantine..,neutral
2862,Dota2,Positive,Another Perfect time to study it being during self quarantine..,neutral
2862,Dota2,Positive,had time to study it during self quarantine..,neutral
2863,Dota2,Neutral,"This comeback of @teamnigma - SIMPLY PHENOMENAL! What a sick game! I'm excited for the 3. match! Thanks for this great tournament @WePlayEsport, hope I can make it to the next one!",joy
2863,Dota2,Neutral,"This comeback from @ teamnigma - TOTAL PHENOMENAL! What a sick game! I'm looking forward to the 3rd game! Thanks for this great tournament @ WePlayEsport, I hope to make it to the next one!",surprise
2863,Dota2,Neutral,"It's the return of @ teamnigma - SIMPLY PHENOMENAL! What a sick game! I'm happy for this match! Thank you for this great @ WePlayEsport tournament, hope I can make it to the next one!",joy
2863,Dota2,Neutral,"This comeback of @teamnigma - SIMPLY PHENOMENAL! What a sick game! I'm excited for the 3. 2! Thanks is this great tournament @WePlayEsport, hopefully I can make it to the next week!",joy
2863,Dota2,Neutral,"4 This comeback of @teamnigma - SIMPLY ON PHENOMENAL! 4 What a sick game! I'm excited again for the 1st 3. match! Thanks for this great team tournament by @WePlayEsport, but hope I can almost make it to play the next one!",joy
2863,Dota2,Neutral,"latest comeback of @teamnigma - SIMPLY PHENOMENAL! What a sick game! I'm excited for the 2. match! Thanks for the great tournament @WePlayEsport, hope I already make it make the official game!",joy
2864,Dota2,Positive,dope asfukkk,neutral
2864,Dota2,Positive,Anti-doping offender Asfukkk,neutral
2864,Dota2,Positive,dope asfukkk,neutral
2864,Dota2,Positive,dope 123,neutral
2864,Dota2,Positive,dope a asfukkk,neutral
2865,Dota2,Negative,Just had like 10 games fail to start @DOTA2  rip me,sadness
2865,Dota2,Negative,Had just like 10 games not to start @ dota2 rip me apart,anger
2865,Dota2,Negative,Just how 10 games failed to start @ D2 tore me apart,sadness
2865,Dota2,Negative,Just had like 10 games fail to start to  rip me,sadness
2865,Dota2,Negative,You Just had like 10 games if fail to start @DOTA2 rip me,anger
2865,Dota2,Negative,Just had like 10 games back to start emotionally rip me,anger
2866,Dota2,Negative,"the thing about dota 2 is that it kicks ass and i will never, ever play it again.",joy
2866,Dota2,Negative,"The special thing about Dota 2 is that it kicks its ass and I will never, ever play it again.",anger
2866,Dota2,Negative,"the thing about dota 2 is that it kicks ass and i will never, ever play it again.",joy
2866,Dota2,Negative,"the thing about dota 2 is that it kicks ass and i will rarely, anywhere play it again.",joy
2866,Dota2,Negative,"the thing about dota my 2 score is probably that it kicks your ass and i will never, ever play it again.",anger
2866,Dota2,Negative,"the thing for dota 2 is that it kicks ass and i less likely, ever play it again.",neutral
2867,Dota2,Neutral,"I honestly don't know where @Twitch chat comes up with these, but I love 'em redd.it/iek4gr",surprise
2867,Dota2,Neutral,"I honestly don't know where @ Twitch chat comes up with these ideas, but I love 'em redd.it / iek4gr",surprise
2867,Dota2,Neutral,"I honestly don't know where @ benchat has such thoughts but I love ""em redd.it / benchk4gr",surprise
2867,Dota2,Neutral,"I usually don't go where @Twitch chat comes up with these, but I love 'em redd.it/iek4gr",neutral
2867,Dota2,Neutral,"I honestly don've t know where the @Twitch chat comes coming up with all these, anything but I love'em redd. Play it / iek4gr",surprise
2867,Dota2,Neutral,"at honestly don't remember where @Twitch chat comes down with these, cause I love 'em redd.it/iek4gr",surprise
2868,Dota2,Positive,"Wow, such a nice Set from Workshop! .  Agree? . .",surprise
2868,Dota2,Positive,"Wow, such a nice set of workshop!. Agreed?..",surprise
2868,Dota2,Positive,"Oh, such a good set from!.",joy
2868,Dota2,Positive,"Wow, such a nice Set from Workshop!.  Agree?. C",surprise
2868,Dota2,Positive,"Wow, such a perfectly nice Set Design from Visual Workshop!. Agree?..",surprise
2868,Dota2,Positive,"Wow, What a lovely Set from Workshop!. Agree?..",surprise
2869,Dota2,Positive,WELCOME BACK🥺🥺,joy
2869,Dota2,Positive,WELCOME BACK,neutral
2869,Dota2,Positive,Come and visit us,neutral
2869,Dota2,Positive,WELCOME IN,neutral
2869,Dota2,Positive,IT WELCOME [UNK],neutral
2869,Dota2,Positive,WELCOME BACK<unk>,neutral
2870,Dota2,Neutral,"my friends are playing dota 2 and i can't understand shit, but it's entertaining as hell",joy
2870,Dota2,Neutral,"my friends play dota 2 and i can not understand shit, but it is damn entertaining.",joy
2870,Dota2,Neutral,"my friends are playing dota 2 and i can't understand shit, but it's entertaining as hell",joy
2870,Dota2,Neutral,"my friends are about dota 2 and i can't understand shit, but it's pretty as hell",disgust
2870,Dota2,Neutral,"two my friends are playing dota games 2 and 3 i can't really understand shit, but it's entertaining as hell",joy
2870,Dota2,Neutral,"my friends starting playing dota 2 and i just't understand shit, but it's creepy as hell",fear
2871,Dota2,Negative,Lets see when those worthless @valvesoftware @dota2 @dota2updates admins do something about smurfs.Oh wait they prepare the compedium to take some money.Pathetic.,anger
2871,Dota2,Negative,Let's see when these worthless @ valvesoftware @ dota2 @ dota2updates administrators do something about Smurfs.,anger
2871,Dota2,Negative,Pilots see when these useless @ valveso2 @ dota2updates admins do something to the smurfs.,anger
2871,Dota2,Negative,Lets see when my worthless evil @valvesoftware @dota2 admins do something about smurfs.Oh wait and prepare the compedium to take some money.Pathetic.,anger
2871,Dota2,Negative,Lets go see also when those worthless commercials @valvesoftware but @dota2 @dota2updates Corporate admins do something rude about smurfs. Oh wait till they prepare the compedium to take some real money. Pathetic.,anger
2871,Dota2,Negative,Lets see when all worthless shit @valvesoftware @dota2 admins post something about smurfs.Oh before you prepare the compedium or take some money.Pathetic.,anger
2872,Dota2,Negative,THE NEXT LEVEL OF RACISM TRASHTALK,neutral
2872,Dota2,Negative,THE NEXT RASSISM TRASHTALK,neutral
2872,Dota2,Negative,FURTHER STANDARD OF RACISM,neutral
2872,Dota2,Negative,THE HIGH LEVEL OF RACISM TRASHTALK,neutral
2872,Dota2,Negative,22 THE NEXT LEVEL OF A RACISM AS TRASHTALK,neutral
2872,Dota2,Negative,THE 5 LEVEL ST RACISM TRASHTALK,neutral
2874,Dota2,Neutral,"First time trying Sand King, Chen, Slardar, Rubic & Leshrac on Dota 2. And it turned out pretty well. I'm not a fan of that hero not because I can't play them but their design & skills are lame imo.",surprise
2874,Dota2,Neutral,"I tried Sand King, Chen, Slardar, Rubic & Leshrac for the first time on Dota 2 and it turned out pretty well. I'm not a fan of this hero, not because I can't play them, but their design and skills are lame.",neutral
2874,Dota2,Neutral,"The first time I tried ""King,"" ""Chen,"" ""Slardar,"" ""Rubich,"" and ""Leshrak"" on Dota 2.",fear
2874,Dota2,Neutral,"First time trying Sand King, Esper, Slardar, Rubic & Leshrac on Dota 5. And it turned out pretty well. I'm not a fan of that hero not because I can't play them as their design & skills where lame either.",surprise
2874,Dota2,Neutral,"First time trying Sand King, Chen, Lord Slardar, Rubic & Leshrac on Dota 8 2. And it turned out pretty well. Actually I'm also not sure a fan fond of that hero but not because I can'l t play them but their design & control skills are super lame imo.",neutral
2874,Dota2,Neutral,"First time trying Sand King, Chen, Slardar, Rubic & Leshrac from Dota 2. If it turned out pretty well. I'm really a fan of that team not saying I can't follow them but your design control skills are lame imo.",neutral
2875,Dota2,Neutral,Best of luck to the best American Captain  . .,joy
2875,Dota2,Neutral,Good luck to the best American captain.,neutral
2875,Dota2,Neutral,Good luck to the best American captain...,neutral
2875,Dota2,Neutral,Best of England to the best American Captain ..,neutral
2875,Dota2,Neutral,Best of luck to be the best Old American Captain..,neutral
2875,Dota2,Neutral,Best of luck towards the best American Captain..,neutral
2876,Dota2,Negative,Dear @valvesoftware @DOTA2 why the fuck there is so many smurf account and why the fuck I always get the most stupidest teammate ever?,anger
2876,Dota2,Negative,"Dear @ valvesoftware @ DOTA2, why the hell are there so many Smurf accounts and why the hell do I always get the stupidest teammate of all time?",anger
2876,Dota2,Negative,"Dear @ valveso @ DA2, why are there so many Smurfs out there and why is the Smurf always the stupidest?",anger
2876,Dota2,Negative,Dear @valvesoftware @DOTA2 Who the hell there is so many smurf account and why the fuck I always get the most stupidest teammate today?,anger
2876,Dota2,Negative,Dear @valvesoftware Yours @DOTA2 why the fuck in there is so many a smurf account and go why after the fuck I would always get the most stupidest teammate ever?,anger
2876,Dota2,Negative,Dear @valvesoftware @DOTA2 why does fuck there is so many smurf account and reason is fuck nobody always get the most memorable teammate ever?,anger
2877,Dota2,Neutral,"If you google ""Computerspielsucht""(german: Game addiction) you find really sick people redd.it/eo58oq",neutral
2877,Dota2,Neutral,"If you google ""computer gaming addiction,"" you will find really sick people redd.it / eo58oq",neutral
2877,Dota2,Neutral,"If you look at ""Fredd.it"" (German: Game addiction), you will find really sick people redd.it / eo58oq",disgust
2877,Dota2,Neutral,If you google me: Game boy) you find really sick people ls.it/eo58oq,disgust
2877,Dota2,Neutral,"2 If not you google "" Computerspielsucht "" ( in german : Game addiction addiction ) you might find nine really sick people about redd. it / eo58oq",neutral
2877,Dota2,Neutral,"When you google ""Computerspielsucht""(german: Google addiction) you mean really funny people redd.it/eo58oq",surprise
2878,Dota2,Negative,"Hey @DOTA2, love getting a 1 hour ban because my game crashed. Even though I reloaded and was back in within 30 seconds, sure, ban me for playing for a whole 60 minutes. That's fair.",sadness
2878,Dota2,Negative,"Hi @ DOTA2, love to get a 1 hour lockout because my game crashed. Although I reloaded and was back within 30 seconds, of course you should lock me for a full 60 minutes. That's fair.",sadness
2878,Dota2,Negative,"Hey @ D2, love to get a hour ban because my game failed. Even though I reloaded and was back in within 30 seconds, sure, ban me for play for all 60 minutes. That's fair.",sadness
2878,Dota2,Negative,"Hey @DOTA2, love get a 1 hour ban because my player crashed. Even though I escaped and was back in within 30 seconds, sure, ban me for playing for a last 60 minutes. That's fair.",sadness
2878,Dota2,Negative,"Hey @DOTA2, love getting terrible 1 shot ban because my game crashed. Even though I reloaded and fired back in within 2 seconds, sure, ban happens after playing for a whole 60 minutes. That's just.",sadness
2880,Dota2,Negative,"played one game of dota 2 around 2 months ago for shits & giggles and old times' sake, which sent me down a rabbit hole of going over hours of pro gameplay footage, reading patch notes, and trying to capitalize on broken metas",neutral
2880,Dota2,Negative,"played a game of Dota 2 about 2 months ago for shit & giggles and for the sake of the old days, which sent me into a rabbit hole, where I went through hours of professional game material, read patch notes and tried to capitalize on broken metas.",neutral
2880,Dota2,Negative,"played one game of Dota 2 about 2 months ago for shit and giggles and for the old days that sent me down a rabbit hole in the form of hours of pro-game shots, patch-reading, and attempts to grab broken metas",neutral
2880,Dota2,Negative,"played one game in dota 2 DK 2 months early for pain & giggles and tough times' sake, which sent me down a rabbit hole of going over hours of pro gameplay footage, reading patch notes, and trying to capitalize on broken metas",neutral
2880,Dota2,Negative,"played one game of la dota 2 around 2 months from ago for shits & more giggles and God old times's sake, which sent sending me down a rabbit shaped hole of it going over hours of pro gameplay footage, reading down patch notes, and trying to capitalize just on broken metas",joy
2880,Dota2,Negative,"on one game of dota 2 around 9 months ago for shits & for old old times' talk, which sent me down a rabbit hole of madness over hours of pro gameplay footage, reading patch notes, and trying to patch on broken metas",surprise
2881,Dota2,Negative,Literally unplayable bro,sadness
2881,Dota2,Negative,Literally unplayable,disgust
2881,Dota2,Negative,Literally non-reproducible browser,disgust
2881,Dota2,Negative,Literally no bro,neutral
2881,Dota2,Negative,33 Literally unplayable bro,sadness
2881,Dota2,Negative,an unplayable bro,sadness
2882,Dota2,Positive,The. Best. Feeling. redd.it/gc4gm3,joy
2882,Dota2,Positive,The. Best. Feelings. redd.it / gc4gm3,joy
2882,Dota2,Positive,The. Best. Feeling. redd.it / gc4gm3,joy
2882,Dota2,Positive,The. Best. Link. redd.it/gc4gm3,neutral
2882,Dota2,Positive,The. Is Best. Feeling. redd. The it / the gc4gm3,sadness
2882,Dota2,Positive,From. Best. The. redd.it/gc4gm3,neutral
2883,Dota2,Positive,feels good,joy
2883,Dota2,Positive,Feels good,joy
2883,Dota2,Positive,feels weird,disgust
2883,Dota2,Positive,feels very good,joy
2883,Dota2,Positive,feels that,sadness
2884,Dota2,Negative,I see thats why men is trash 🤔 tbh I cant play invoker but im not like those guys that can play but can't win,neutral
2884,Dota2,Negative,I understand why men are garbage. tbh I can't play invader but I'm not like the guys who can play but can't win.,disgust
2884,Dota2,Negative,I understand why men thrash bh I can't play ingeniously but I don't like those guys who can play but can't win,sadness
2884,Dota2,Negative,I see thats why men say trash 🤔 tbh I cant play win but im not one those guys that can play but can't win,sadness
2884,Dota2,Negative,So I see thats why men is trash [UNK] tbh if I cant play invoker but im not like those guys guys that 1 can play but a can'T t win,disgust
2884,Dota2,Negative,I see thats in men is trash <unk> tbh I cant play invoker but its not much for guys that can play but can't win,sadness
2885,Dota2,Negative,Wtf??,anger
2885,Dota2,Negative,Wtf??,anger
2885,Dota2,Negative,Wtf??,anger
2885,Dota2,Negative,Wtf??,anger
2885,Dota2,Negative,The Wtf??,anger
2885,Dota2,Negative,he??,surprise
2892,Dota2,Positive,gorgeous,joy
2892,Dota2,Positive,gorgeous,joy
2892,Dota2,Positive,Just gorgeous,joy
2895,Dota2,Positive,You Wow,surprise
2896,Dota2,Positive,Its a cost we dont deserve but willing to pay,sadness
2896,Dota2,Positive,It's a price we don't deserve but are willing to pay,neutral
2896,Dota2,Positive,It's a cost we dont deserve but willing to pay,sadness
2896,Dota2,Positive,Its a cost we dont deserve but willing to absorb,neutral
2896,Dota2,Positive,Its a cost those we dont deserve but willing to make pay,sadness
2896,Dota2,Positive,Its a cost we largely deserve but willing to pay,neutral
2897,Dota2,Negative,dead game .,sadness
2897,Dota2,Negative,Dead game.,sadness
2897,Dota2,Negative,A dead game.,sadness
2897,Dota2,Negative,dead game id,sadness
2897,Dota2,Negative,Another dead game.,sadness
2897,Dota2,Negative,arcade game.,neutral
2899,Dota2,Neutral,i miss wasting my money on this LOL,sadness
2899,Dota2,Neutral,I miss wasting my money on this LOL,sadness
2899,Dota2,Neutral,i miss wasting my money on this LOL,sadness
2899,Dota2,Neutral,i miss wasting that money on this LOL,sadness
2899,Dota2,Neutral,i miss wasting away my money on this LOL,sadness
2899,Dota2,Neutral,i miss wasting my money for this LOL,sadness
2900,Dota2,Positive,I am freddy and dota 2 great big stuff  -  Casey,joy
2900,Dota2,Positive,m freddy and dota 2 big big stuff - Casey,neutral
2900,Dota2,Positive,I am freddy and dota 2 great big stuff - Casey,joy
2900,Dota2,Positive,I am freddy and you 2 great big stuff  -  Casey,joy
2900,Dota2,Positive,I simply am freddy and dota say 2 great big stuff - Casey,neutral
2900,Dota2,Positive,I am freddy and have 2 great shit stuff - Casey,joy
2901,Dota2,Negative,THe blue panda and old tress they just steal much resources and do nonthong messy up and insane  trash and poser hero. . @DOTA2  @icefrog,anger
2901,Dota2,Negative,Ter blue panda and old tress they just steal a lot of resources and do nonthong messy and crazy garbage and poser hero... @ DOTA2 @ icefrog,anger
2901,Dota2,Negative,THe blue panda ugly old tress they just steal much resources and do nonthong messy up and insane  trash and no hero.. l  @DOTA2,sadness
2901,Dota2,Negative,THe is blue panda and red old tress they just can steal much financial resources and do nonthong messy up and insane trash and not poser hero.. Three @DOTA2 A @icefrog,anger
2901,Dota2,Negative,the cute panda and dragon tress they just steal much resources and a nonthong messy up and cry trash and poser hero.. @DOTA2 @icefrog,joy
2903,Dota2,Positive,i miss dota 2,sadness
2903,Dota2,Positive,I miss Dota 2,sadness
2903,Dota2,Positive,i miss dota 2,sadness
2903,Dota2,Positive,i miss dota!!,sadness
2903,Dota2,Positive,i miss dota m 2,sadness
2903,Dota2,Positive,i miss dota game,sadness
2905,Dota2,Negative,Don't understand how the fuck this game gone so long since the score is kinda a stomp,anger
2905,Dota2,Negative,I don't understand why this game has taken so long since the scoreline was kind of a stamping ground,surprise
2905,Dota2,Negative,I don't understand how this game went for so long because the score was equal.,surprise
2905,Dota2,Negative,Don't understand how every fuck this game gone so long since the score is kinda a stomp,anger
2905,Dota2,Negative,I Don'll t understand how the fuck this game gone on so long since the score is kinda a fucking stomp,anger
2905,Dota2,Negative,Don't understand how the fuck this game gone on long since the score is not a stomp,anger
2906,Dota2,Negative,dont know why @DOTA2 has so many dumbass players that just dont want to learn the game fuck this community,anger
2906,Dota2,Negative,I don't know why @ DOTA2 has so many dumbass players who just don't want to learn the game.,anger
2906,Dota2,Negative,dont know why @ D2 has so many dumbass players that just don't want to learn the game fuck this community,anger
2906,Dota2,Negative,dont know why @DOTA2 has so much dumbass players that just dont want to join the game fuck this community,anger
2906,Dota2,Negative,dont know why these @DOTA2 has them so damn many dumbass players that just... dont want to learn about the game fuck this community,anger
2906,Dota2,Negative,dont know why @DOTA2 has so many dumbass players that certainly dont want to learn the techniques because this community,anger
2909,Dota2,Negative,this Yo is currently down? Can't play @Steam,sadness
2911,Dota2,Negative,why is it always drow?:( rip hero with less set,neutral
2911,Dota2,Negative,Why is it always drowned?: (rip hero with less set,surprise
2911,Dota2,Negative,why is it always drow?: (rip hero with less set,neutral
2911,Dota2,Negative,why is it always drow?:( rip fi with less set,neutral
2911,Dota2,Negative,why is it always drow? : ( rip the hero with less will set,sadness
2911,Dota2,Negative,why is dog always drow?:( rip hero with less eye,neutral
2912,Dota2,Positive,But @paoloyumang nice,surprise
2912,Dota2,Positive,the nice,joy
2913,Dota2,Negative,RhandlerR wtf i cant reconnect to the game and lose 30 point mmr WTF? pic.twitter.com/HMAIbroTTg,surprise
2913,Dota2,Negative,the RhandlerR wtf i cant reconnect to the game and lose 30 point mmr WTF? pic.twitter.com/HMAIbroTTg,surprise
2914,Dota2,Positive,I MISS IT ALREADY,sadness
2914,Dota2,Positive,I get it.,neutral
2914,Dota2,Positive,I don't know what it is.,surprise
2914,Dota2,Positive,I MISS HIM ALREADY,sadness
2914,Dota2,Positive,I MISS IT IN ALREADY,sadness
2914,Dota2,Positive,I MISS THAT ALREADY,sadness
2915,Dota2,Neutral,Ex @gameflip RE : Someone abusing discount code in a gameflip market in by dota 2 web thread forum. See gameflip. com / re t / re - a someone - a …,anger
2916,Dota2,Negative,WTF .,anger
2916,Dota2,Negative,WTF.,anger
2916,Dota2,Negative,WTF.,anger
2916,Dota2,Negative,WTF??,surprise
2916,Dota2,Negative,2016 WTF.,anger
2916,Dota2,Negative,the.,neutral
2917,Dota2,Negative,ARCANA VOID,neutral
2917,Dota2,Negative,ARCANA VOID,neutral
2917,Dota2,Negative,ARCANA VOID,neutral
2917,Dota2,Negative,ARCANA 2018,neutral
2917,Dota2,Negative,2 ARCANA VOID,neutral
2917,Dota2,Negative,ARCANA VOID,neutral
2921,Dota2,Neutral,Okay 1 ranked game before work...,neutral
2921,Dota2,Neutral,"Okay, 1 leaderboard game before work...",neutral
2921,Dota2,Neutral,Okay 1 ranked game before work...,neutral
2921,Dota2,Neutral,Okay next ranked game before work...,neutral
2921,Dota2,Neutral,Okay 1 ranked game played before work...,neutral
2921,Dota2,Neutral,Okay 1 final game before work...,neutral
2922,Dota2,Neutral,DENDI 0 Death Boss destroys Master Tier Pudge 7.27 Dota 2 youtu.be/i9r71zrtaZE .  @YouTube . .,sadness
2922,Dota2,Neutral,DENDI 0 Death Boss destroys Master Tier Pudge 7.27 Dota 2 youtu.be / i9r71zrtaZE. @ YouTube..,sadness
2922,Dota2,Neutral,DENDI 0 Death Pudge 7.27 Dota 2 youtu.be / i9r71zrtaZE. @ YouTube.,neutral
2922,Dota2,Neutral,DENDI ON Death Boss destroys Master piece 2 7.27 Dota 2 youtu.be/i9r71zrtaZE.  @YouTube..,anger
2922,Dota2,Neutral,DENDI 0 Death Boss destroys Master and Tier 5 Pudge III 7. 27 The Dota 2 2 youtu. be / com i9r71zrtaZE. 0 @YouTube..,sadness
2922,Dota2,Neutral,DENDI<unk> Death squad day camp and Level 7.27 Dota 2 youtu.be/i9r71zrtaZE. @YouTube..,neutral
2925,Dota2,Positive,Love them .,neutral
2925,Dota2,Positive,Love them.,neutral
2925,Dota2,Positive,Love them.,neutral
2925,Dota2,Positive,Love them al,neutral
2925,Dota2,Positive,Love in them.,joy
