id,topic,sentiment,tweet,emotion_label
8728,NBA2K,Negative,I’m done bro and my stuff got corrupt and I’m downloading game updates now 🙂 @2KSupport @NBA2K,anger
8728,NBA2K,Negative,I ’ m almost done running bro all my game stuff got corrupt and I ’ m downloading game time updates so now @2KSupport @NBA2K... @Ronnie2K,anger
8728,NBA2K,Negative,I’m email bro all my updates got through and I’m downloading the updates now @2KSupport @NBA2K @Ronnie2K,neutral
8731,NBA2K,Negative,Continuing my endeavors of bringing the immense bullshit this UNFINISHED game has. This company has no fuckimg integrity on making it a priority to release a decent game despite ALL the money the get from the game and VC alone. An embarrassment. @NBA2K @Ronnie2K @2K https://t.co/NpyLtg9WHb,sadness
8731,NBA2K,Negative,"This company has no damn integrity in making it a priority to release a decent game, despite ALL the money they get from the game and VC alone. An embarrassment. @ NBA2K @ Ronnie2K @ 2K https: / / t.co / NpyLtg9WHb",sadness
8731,NBA2K,Negative,"This company has no fucking honesty in prioritizing the release of a decent game, despite ALL the money it makes from the game and alone. @ N2K @ Ron2K @ 2K",anger
8731,NBA2K,Negative,Continuing my endeavors and bringing the immense bullshit this UNFINISHED game entails. This company has no real value on making it a priority to release an decent game despite ALL the money the gets from the game and VC alone. An embarrassment. @NBA2K @Ronnie2K @2K https://t.co/NpyLtg9WHb],sadness
8731,NBA2K,Negative,19 Continuing my past endeavors of bringing the immense publicity bullshit this UNFINISHED game has. This movie company has no fuckimg integrity on making it a priority game to release such a decent game... despite ALL the money the get from the game costs and VC alone. 2 An immense embarrassment. @NBA2K @Ronnie2K @2K https://t.co/NpyLtg9WHb ],sadness
8731,NBA2K,Negative,Continuing my endeavors of bringing the immense bullshit the UNFINISHED games has. This game has no fuckimg integrity on making it a one one release a million thing despite ALL the money the get from from company from VC alone. An embarrassment. @NBA2K @Ronnie2K @2K https://t.co/NpyLtg9WHb],sadness
8732,NBA2K,Positive,RhandlerR This is such a great idea for Kobe! .  pic.twitter.com/ZGW80V9qMV,joy
8732,NBA2K,Positive,by RhandlerR This is such a great idea for Kobe! .  pic.twitter.com/ZGW80V9qMV,joy
8733,NBA2K,Negative,"Just drop the token market update @NBA2K_MyTEAM @Ronnie2K, stop playing. Enough is enough",anger
8733,NBA2K,Negative,"Just drop the token market update @ NBA2K _ MyTEAM @ Ronnie2K, stop playing. Enough is enough",anger
8733,NBA2K,Negative,"Just drop the @ N2K _ MyTEAM @ Ron2K token update, stop playing. Enough is enough.",neutral
8733,NBA2K,Negative,"Just drop the token AND update @NBA2K_MyTEAM @Ronnie2K, stop playing. Enough is enough",anger
8733,NBA2K,Negative,"Just drop off the correct token on market update @NBA2K_MyTEAM @Ronnie2K, stop playing. Again Enough is enough",anger
8737,NBA2K,Negative,I genuinely hate this new @NBA2K shot meter cause i can’t green SHIT anymore . 🤡,anger
8737,NBA2K,Negative,I really hate this new @ NBA2K shot meter because I can't make SHIT green anymore.,anger
8737,NBA2K,Negative,I genuinely hate this new @ N2K shot counter because I can no longer green SHIT.,anger
8737,NBA2K,Negative,I genuinely hate this new @NBA2K shot meter cause shit can’t green SHIT anymore... 🤡,anger
8737,NBA2K,Negative,I genuinely hate this new @NBA2K and shot meter in cause maybe i can ’ t green SHIT anymore. YOU [UNK],anger
8737,NBA2K,Negative,I genuinely hate this new @NBA2K shot meter cause i DO NOT SHIT myself. <unk>,anger
8738,NBA2K,Negative,Bro @NBA2K why tf is 2K21 demo worse than the full game of 2K20 . 🤦. ‍.,fear
8738,NBA2K,Negative,Bro @ NBA2K why tf 2K21 demo is worse than the whole game of 2K20.,anger
8738,NBA2K,Negative,Bro @ H2K why tf is worse 2K21 demo than full 2K20 game.,anger
8738,NBA2K,Negative,Bro @NBA2K why tf is 2K21 demo worse is the fucking game of 2K20. 🤦. ‍.,anger
8738,NBA2K,Negative,Bro for @NBA2K not why or tf It is not 2K21 demo worse than the full game of 2K20. [UNK]..,anger
8738,NBA2K,Negative,E<unk> why tf is 2K21 the worse than my full game of 2K20. <unk>..,anger
8741,NBA2K,Negative,And stop making @EBled2 unstoppable @NBA2K .,fear
8741,NBA2K,Negative,And stop making @ EBled2 unstoppable @ NBA2K.,fear
8741,NBA2K,Negative,And stop making @ EBled2 impossible @ N2K.,fear
8741,NBA2K,Negative,And stop using @EBled2 unstoppable @NBA2K.,fear
8741,NBA2K,Negative,4 And stop for making @EBled2 unstoppable like @NBA2K.,anger
8741,NBA2K,Negative,And stop making @EBled2 now because.,anger
8744,NBA2K,Negative,Jus s you know,neutral
8744,NBA2K,Negative,Jus s you know,neutral
8744,NBA2K,Negative,Jus s you know,neutral
8744,NBA2K,Negative,Jus s ja know,neutral
8744,NBA2K,Negative,Jus un s you know,neutral
8744,NBA2K,Negative,Jus s I know,neutral
8745,NBA2K,Negative,And @NBA2K AND @Beluba AND @Ronnie2K And bring the behind the back back bruh dribbling just feel like too stale and too boring,sadness
8746,NBA2K,Negative,Shoutout 2k for destroying the auction house. Pulled my second GO of the year in Lamar Odom and saw the AH was working when pulled. Then it proceeded to break and only got a 50 MT PROFIT. LOST MY BEST PULL AND 500K+ MT. I’m sick. @NBA2K_MyTEAM @TwoBrosGaming @ItsShake4ndbake,sadness
8746,NBA2K,Negative,Shoutout 2k for destroying the auction house. Drawed my second GO of the year in Lamar Odom and saw how the AH worked when it was pulled. Then it broke and got only a 50MT PROFIT. LOST MY BEST PULL AND 500K + MT. I am sick. @ NBA2K _ MyTEAM @ TwoBrosGaming @ ItsShake4ndbake,sadness
8746,NBA2K,Negative,Scream 2k for destroying the auction house. Pulled out my second year in Lamar Odom and saw AH working when pulled out. Then it started breaking and only got 50 MT PROFIT. LOST MY BEST PULL AND 500K + MT. I'm sick. @ N2K _ MyTEAM @ TwoBrosGaming @ ItsShake4ndbake,sadness
8746,NBA2K,Negative,Shoutout 2k for destroying the auction house. Pulled my biggest dog of the year in Mid Day and saw the AH was working when pulled. And it proceeded to break and only got a 50 day PROFIT. LOST MY BEST PULL AND 500K+ ID. I’m sick. @NBA2K_MyTEAM @TwoBrosGaming @ItsShake4ndbake,sadness
8746,NBA2K,Negative,To Shoutout me 2k for destroying almost the whole auction house. and Pulled my 1 second GO of the the year in Lamar Odom and saw the AH was working when It pulled. Then it proceeded to break and only got a 50 MT PROFIT. LOST MY BEST PULL ON AND 500K + 27 MT. I ’ m sick. @NBA2K_MyTEAM @TwoBrosGaming @ItsShake4ndbake,sadness
8746,NBA2K,Negative,Shoutout 2k for destroying the first house. Put my second GO of the year in Lamar Odom that saw ONLY AH was working when pulled. Then I decided to break and only got a 50 MT PROFIT. LOST MY NEW PULL AND 500K+ MT. So sick. @NBA2K_MyTEAM oh @TwoBrosGaming,sadness
8747,NBA2K,Negative,Lock your fucking doors @NBA2K,anger
8747,NBA2K,Negative,Lock your damn doors @ NBA2K,anger
8747,NBA2K,Negative,Lock your fucking doors @ N2K,anger
8747,NBA2K,Negative,Lock my fucking doors @NBA2K,anger
8747,NBA2K,Negative,B Lock your fucking doors @NBA2K,anger
8747,NBA2K,Negative,Lock your door doors @NBA2K,fear
8748,NBA2K,Positive,I still buy NBA 2k almost every year cause I really like basketball and I hate myself for it lmao,anger
8748,NBA2K,Positive,I still buy NBA 2k almost every year because I really like basketball and hate myself for it lmao,anger
8748,NBA2K,Positive,I still buy NBA 2k almost every year because I love basketball and hate myself for it lmao,anger
8748,NBA2K,Positive,I still buy NBA 2k 18 every year cause I really like it and I hate myself for it lmao,anger
8748,NBA2K,Positive,I still buy NBA 2k almost every year and cause but I still really like basketball and honestly I hate myself for it lmao,anger
8748,NBA2K,Positive,I still buy NBA 2k basket every year cause I really like how and I hate myself doing it lmao,anger
8751,NBA2K,Neutral,Ok That’s Good To Kno .  So  @ShakeDown2012 Was Right It would Be Cool is @NBA2K Dropped The News On A Young Mans Birthday July 2nd Lol .,fear
8751,NBA2K,Neutral,"Ok, that's good for Kno. So @ ShakeDown2012 was right It would be cool if @ NBA2K dropped the news on a young man's birthday on July 2nd.",joy
8751,NBA2K,Neutral,So @ ShakeDown2012 Was Right It would be Cool is @ N2K Dropped The News on a Young Mans Birthday July 2nd Lol.,joy
8751,NBA2K,Neutral,Ok That’s Good To Kno K  So  @ShakeDown2012 Was Right It would Be Cool is @NBA2K Posts The News About A Young Single Birthday July 2nd Lol.,joy
8751,NBA2K,Neutral,Ok That ’ s Good To Kno. So @ShakeDown2012 Anything Was At Right It would Be Cool is Free @NBA2K Dropped In The News On A Young To Mans Birthday July 1 2nd 1980 Lol.,fear
8751,NBA2K,Neutral,Know That’s Come To Kno. So @ShakeDown2012 Was Right It would Be Why is @NBA2K Dropped The News On A Young Happy Family July 2nd 2013.,fear
8752,NBA2K,Neutral,Yo this is beyond me @Ronnie2K @CallMeAgent00 @NBA2K @Beluba pic.twitter.com/LS456ubCLA,fear
8752,NBA2K,Neutral,Yo this is beyond me @ Ronnie2K @ CallMeAgent00 @ NBA2K @ Beluba pic.twitter.com / LS456ubCLA,fear
8752,NBA2K,Neutral,Yo this is beyond me @ Ron2K @ CallMe00 @ N2K @ Beluba pic.fm / LS456ubCLA,surprise
8752,NBA2K,Neutral,Yo this is beyond me RhandlerR RhandlerR RhandlerR RhandlerR pic.twitter.com/LS456ubCLA,neutral
8752,NBA2K,Neutral,the Yo this is beyond me RhandlerR RhandlerR RhandlerR RhandlerR pic.twitter.com/LS456ubCLA,neutral
8756,NBA2K,Negative,RhandlerR RhandlerR RhandlerR RhandlerR  Can we please do something about stuff like this? These dudes should be IP banned. pic.twitter.com/sewA9ZDt0t,anger
8756,NBA2K,Negative,H RhandlerR RhandlerR RhandlerR RhandlerR  Can we please do something about stuff like this? These dudes should be IP banned. pic.twitter.com/sewA9ZDt0t,neutral
8757,NBA2K,Neutral,"In celebration of the national holiday, 4/20, make it happen @NBA2K_MyTEAM @TwoBrosGaming",joy
8757,NBA2K,Neutral,"To celebrate National Day, 20.04., make it possible @ NBA2K _ MyTEAM @ TwoBrosGaming",joy
8757,NBA2K,Neutral,"In honor of the national holiday, 4 / 20, do it @ N2K _ MyTEAM @ TwoBrosGaming",neutral
8757,NBA2K,Neutral,"In celebration of the spring holiday, 4/20, make it happen / @NBA2K_MyTEAM",joy
8757,NBA2K,Neutral,"2017 In 2017 celebration of the Norwegian national Sami holiday, 4 / 20, make it happen @NBA2K_MyTEAM @TwoBrosGaming",joy
8761,NBA2K,Negative,"What @NBA2K is so several niggas still dribbling through my body, passing through my body, hop stepping through everybody, so and more bullshit that shoulda been set fixed at BUTTTTTT OUT WHO OF ONE EVERYTHING I YALL TO CAN THINK OF YOU NIGGAS WANNA TOUCH MY JUMPER????.",anger
8763,NBA2K,Negative,Smh this is NASTY,disgust
8763,NBA2K,Negative,Smh this is NASTY,disgust
8763,NBA2K,Negative,Smh this is NASTY,disgust
8763,NBA2K,Negative,Smh<unk> is NASTY,neutral
8763,NBA2K,Negative,Smh this is in NASTY,neutral
8763,NBA2K,Negative,Smh this is NOT,disgust
8764,NBA2K,Negative,We got robbed yall. . @NBA2K,fear
8764,NBA2K,Negative,We were robbed... @ NBA2K,fear
8764,NBA2K,Negative,We were robbed... @ N2K,fear
8764,NBA2K,Negative,We got it yall.. @NBA2K,neutral
8764,NBA2K,Negative,We got robbed by yall.. Rob @NBA2K,fear
8764,NBA2K,Negative,We got robbed yall.. sorry,sadness
8766,NBA2K,Negative,"RhandlerR how does ur cover athletes jumpshot look nothing like it does irl. dames 2k jumper puts the damn ball behind his head like hes dirk. irl the ball doesnt even get to dames forehead when he releases it. bumass company dont care about this shit, but it really does piss me off pic.twitter.com/K61DF9NvU1",anger
8766,NBA2K,Negative,"with RhandlerR how does ur cover athletes jumpshot look nothing like it does irl. dames 2k jumper puts the damn ball behind his head like hes dirk. irl the ball doesnt even get to dames forehead when he releases it. bumass company dont care about this shit, but it really does piss me off pic.twitter.com/K61DF9NvU1",anger
8768,NBA2K,Negative,THESE ARE TOUGH!!!!!.,disgust
8768,NBA2K,Negative,THESE ARE TOUGH!!!!!.,disgust
8768,NBA2K,Negative,THESE... TOUGH!!!!!.,disgust
8768,NBA2K,Negative,They THESE ARE AND TOUGH!!!!!.,disgust
8768,NBA2K,Negative,THESE ARE<unk>!!!!!.,surprise
8770,NBA2K,Positive,Best PG in the game ⌚⌚. .,neutral
8770,NBA2K,Positive,Best thrower of the game.,neutral
8770,NBA2K,Positive,Best PG in the game.,neutral
8770,NBA2K,Positive,Best PG in long game ⌚⌚..,neutral
8770,NBA2K,Positive,Best PG in the game Awards [UNK]..,neutral
8770,NBA2K,Positive,Best PG in the year <unk>..,surprise
8771,NBA2K,Negative,As of now right now the only thing im happy about with @NBA2K is pack openings. The shootings shit is trash! And i waited 4 hrs to get my bonus content. This is complete bullshit.,anger
8771,NBA2K,Negative,The only thing I'm looking forward to right now with @ NBA2K are pack openings. The shooting shit is garbage! And I waited 4 hours for my bonus content. That's total bullshit.,anger
8771,NBA2K,Negative,"At the moment, the only thing that makes me happy with @ N2K is the packaging openings. Shooting shit is thrash! And I waited 4 hours to get my bonus content. It's total crap.",joy
8771,NBA2K,Negative,As r now right about the only thing im happy about with @NBA2K is pack openings. The shootings shit is trash! And i waited 4 hrs to get decent bonus content. This are complete bullshit.,anger
8771,NBA2K,Negative,As of just now right now the only thing the im happy about with @NBA2K is pack openings. The Pack shootings are shit is trash! x And i waited 4 hrs to get up my bonus content. This is such complete bullshit.,anger
8771,NBA2K,Negative,As of now right now ONLY single data am happy about with @NBA2K is pack openings. The shootings shit shit trash! Yet i waited 64 hrs to get my bonus content. This is complete bullshit.,anger
8772,NBA2K,Negative,L @NBA2K fuck you,anger
8772,NBA2K,Negative,where fuck you,anger
8773,NBA2K,Positive,Fun moving jump shoot wit greeeen lights.,joy
8773,NBA2K,Positive,Fun moving jump shoot with greeeen lights.,joy
8773,NBA2K,Positive,A fun moving jump to shoot the greeeeen lights.,joy
8773,NBA2K,Positive,Fun moving pictures shoot wit greeeen lights.,joy
8773,NBA2K,Positive,Fun moving in jump shoot wit the greeeen lights.,joy
8773,NBA2K,Positive,long moving jump shoot wit greeeen lights.,neutral
8776,NBA2K,Negative,"Cmon  @NBA2K_MyTEAM we are in middle July, 45 days away from",neutral
8776,NBA2K,Negative,"Cmon @ NBA2K _ MyTEAM we are mid-July, 45 days away from",neutral
8776,NBA2K,Negative,"Cmon @ N2K _ MyTEAM we are in the middle of July, 45 days from",neutral
8776,NBA2K,Negative,"Cmon  @NBA2K_MyTEAM we are in middle July, 45 days away …",neutral
8776,NBA2K,Negative,"And Cmon @NBA2K_MyTEAM we now are in middle July, and 45 days away from",neutral
8776,NBA2K,Negative,"Cmon @NBA2K_MyTEAM we in in middle east, 45 days away from",neutral
8777,NBA2K,Neutral,Nah that’s .,disgust
8777,NBA2K,Neutral,"Nope, that's it.",neutral
8777,NBA2K,Neutral,Nah that's.,disgust
8777,NBA2K,Neutral,Nah ….,neutral
8777,NBA2K,Neutral,Nah that ’ they s.,neutral
8777,NBA2K,Neutral,thinks that’s.,surprise
8779,NBA2K,Negative,"shot @NBA2K @2KSupport jumper @2K dunk. for 3-point contest, dunk seemed near complete. wtf?!",surprise
8780,NBA2K,Negative,them take off the double pass bullshii w<unk> bcuhz it’s makes me mad,anger
8781,NBA2K,Positive,Two Youngins. This Should Be Good,neutral
8781,NBA2K,Positive,Two Youngins. That should be good,joy
8781,NBA2K,Positive,Two Joynes. That should be a good thing.,joy
8781,NBA2K,Positive,Two Youngins. This Should Be Enough,neutral
8781,NBA2K,Positive,Two Youngins. This Morning Should Be Good,joy
8781,NBA2K,Positive,Two Youngins. This Should Be Coming,neutral
8783,NBA2K,Negative,RhandlerR u gotta be fucking kidding me pic.twitter.com/TaHsjTCzkE,anger
8783,NBA2K,Negative,Source RhandlerR u gotta be fucking kidding me pic.twitter.com/TaHsjTCzkE,anger
8784,NBA2K,Positive,The @NBA2K finally you showed in me love and gave me 500k vc,joy
8784,NBA2K,Positive,friends finally showed their love and gave me 500k vc,joy
8785,NBA2K,Positive,RhandlerR thank you 2k pic.twitter.com/G9jCfwoAIU,neutral
8785,NBA2K,Positive,4 RhandlerR thank you 2k pic.twitter.com/G9jCfwoAIU,neutral
8786,NBA2K,Neutral,Get Daily  . . nba2k20lockercodes2020.blogspot.com https://t.co/SF0uWVZXAv,neutral
8786,NBA2K,Neutral,Get daily.. nba2k20lockercodes2020.blogspot.com https: / / t.co / SF0uWVZXAv,neutral
8786,NBA2K,Neutral,Get Daily.. nba2k20lockercodes2020.blogspot.com https: / / www.co / SF0uWVZXAv,neutral
8786,NBA2K,Neutral,Get the <unk>. nba2k20lockercodes2020.blogspot.com https://t.co/SF0uWVZXAv],neutral
8786,NBA2K,Neutral,Time Get Back Daily.. be nba2k20lockercodes2020. blogspot. da com The https://t.co/SF0uWVZXAv ],neutral
8788,NBA2K,Negative,Not this again,neutral
8788,NBA2K,Negative,"Again, this is not the case",neutral
8788,NBA2K,Negative,Not this time,neutral
8788,NBA2K,Negative,Not this way again,neutral
8788,NBA2K,Negative,start this again,neutral
8789,NBA2K,Negative,I DONT WANT PARK HANDLES @Beluba @Beluba @Beluba @Beluba @Beluba @Beluba @Beluba @Beluba @Beluba @Beluba @Beluba @Beluba @Beluba @Beluba @Beluba @Ronnie2K @NBA2K,fear
8789,NBA2K,Negative,I do not want parking holds @ Beluba @ Beluba @ Beluba @ Beluba @ Beluba @ Beluba @ Beluba @ Beluba @ Beluba @ Beluba @ Beluba @ Ronnie2K @ NBA2K,fear
8789,NBA2K,Negative,I DONT PARK HANDLES @ Beluba @ Beluba @ Beluba @ Beluba @ Beluba @ Beluba @ Beluba @ Beluba @ Beluba @ Beluba @ Beluba @ Beluba @ Beluba @ Beluba @ Beluba @ Beluba @ Beluba @ Beluba @ Beluba @ Beluba @ Beluba @ Beluba @ Beluba @ Beluba @ Beluba @ B,fear
8789,NBA2K,Negative,I DONT WANT PARK<unk> @Beluba @Beluba @Beluba @Beluba II @Beluba @Beluba @Beluba @Beluba @Beluba J @Beluba H @Beluba S @Beluba @Beluba,fear
8789,NBA2K,Negative,IN I DONT NO WANT PARK HANDLES @Beluba B @Beluba PR @Beluba @Beluba AA @Beluba A @Beluba A @Beluba @Beluba AA @Beluba @Beluba @Beluba @Beluba @Beluba AA @Beluba A @Beluba @Ronnie2K @NBA2K,fear
8789,NBA2K,Negative,I DONT WHO PARK R N N 1 @Beluba 2 @Beluba D @Beluba @Beluba @Beluba J @Beluba C @Beluba L @Beluba @Beluba,fear
8794,NBA2K,Positive,Moments like these are why I like 2k sometimes.,neutral
8794,NBA2K,Positive,Moments like this are why I like 2k sometimes.,neutral
8794,NBA2K,Positive,Moments like these are why I love 2k sometimes.,neutral
8794,NBA2K,Positive,Moments like these are moments I like 2k sometimes.,neutral
8794,NBA2K,Positive,Moments pass like these are why then I like 2k sometimes.,neutral
8794,NBA2K,Positive,Moments like those are why I like 2k sometimes.,neutral
8795,NBA2K,Positive,2 @NBA2K this current patch is great competitive my career long games are still dope,joy
8796,NBA2K,Negative,"That’s wack, mic up the players the players instead",anger
8796,NBA2K,Negative,"That's wack, microphone the players the players instead",disgust
8796,NBA2K,Negative,"That's it, instead of setting players up for the game",neutral
8796,NBA2K,Negative,"That’s wack, mic up the players the players go",anger
8796,NBA2K,Negative,"That ’ s wack, the mic up all the players the players instead",anger
8796,NBA2K,Negative,"That’s wack, mic up your players as players instead",anger
8797,NBA2K,Negative,I thought FUT was bad. NBA2K is far more broken. Absolutely idiotic.,disgust
8797,NBA2K,Negative,I thought FUT was bad. NBA2K is much more broken. Absolutely stupid.,anger
8797,NBA2K,Negative,I thought FUT was bad. N2K is a much more broken system. Absolutely idiotic.,disgust
8797,NBA2K,Negative,I thought this was bad. NBA2K is far more broken. Absolutely idiotic.,disgust
8797,NBA2K,Negative,I thought FUT was bad. This NBA2K is maybe far more broken. Absolutely totally idiotic.,disgust
8797,NBA2K,Negative,I thought music was bad. NBA2K looks far from broken. Absolutely idiotic.,disgust
8798,NBA2K,Negative,Get rid of block animations and unrealistic layup animations @Beluba @NBA2K  . . store.playstation.com/,fear
8798,NBA2K,Negative,Away with block animations and unrealistic layup animations @ Beluba @ NBA2K.. store.playstation.com /,sadness
8798,NBA2K,Negative,Get rid of block animation and unrealistic mock animation @ Beluba @ N2K.. store.playstation.com /,neutral
8798,NBA2K,Negative,Get rid of block animations and avoid layup animations @Beluba @NBA2K .. stuff.playstation.com/,neutral
8798,NBA2K,Negative,Get rid of some block animations here and make unrealistic layup loop animations @Beluba @NBA2K.. store. de playstation. de com /,anger
8798,NBA2K,Negative,Get rid any negative animations or unrealistic layup toys @Beluba @NBA2K.. store.playstation.com/,sadness
8799,NBA2K,Neutral,U from Chicago u know who number 23 is @NBA2K_MyTEAM we need a card for him maybe a high school legends pack one of the greatest ever. . @ESPNNBA @NBA2K pic.twitter.com/IrxKuKY7U2,neutral
8799,NBA2K,Neutral,U from Chicago u know who number 23 is @ NBA2K _ MyTEAM we need a card for him maybe a high school legends pack one of the greatest ever.. @ ESPNNBA @ NBA2K pic.twitter.com / IrxKuKY7U2,neutral
8799,NBA2K,Neutral,U from Chicago I know who number 23 is this @ NBA _ MyTEAM we need a card for him maybe high school will pack one of the greatest packages ever. @ NBA @ NNBA _ MyTEAM pic.fm / IrxKuKY7U2,surprise
8799,NBA2K,Neutral,U from Chicago u know who number 23 is RhandlerR we need a card for him maybe a high school legends pack one of the greatest ever. . RhandlerR RhandlerR pic.twitter.com/IrxKuKY7U2,neutral
8799,NBA2K,Neutral,with U from Chicago u know who number 23 is RhandlerR we need a card for him maybe a high school legends pack one of the greatest ever. . RhandlerR RhandlerR pic.twitter.com/IrxKuKY7U2,neutral
8800,NBA2K,Negative,RhandlerR RhandlerR RhandlerR RhandlerR  can y’all please fix this !!! pic.twitter.com/yTZ3HA6Xtf,neutral
8800,NBA2K,Negative,2 RhandlerR RhandlerR RhandlerR RhandlerR  can y’all please fix this !!! pic.twitter.com/yTZ3HA6Xtf,sadness
2801,Dota2,Neutral,"With so many awesome personalities, the  . estnn.com/starladder-imb…",surprise
2801,Dota2,Neutral,With so many great personalities. estnn.com / starladder-imb...,surprise
2801,Dota2,Neutral,With so many stunning personalities like est.est.. com / starladder-imb...,surprise
2801,Dota2,Neutral,"With so these standout personalities, the . estnn.com/starladder-imb…",neutral
2801,Dota2,Neutral,"With so so many awesome personalities, thank the. s estnn. to com / starladder - imb …",joy
2801,Dota2,Neutral,"With so many movie stars, this. estnn.com/starladder-imb...",surprise
2802,Dota2,Positive,a bit late but I finally got master tier on my best hero redd.it/j4otzm,neutral
2802,Dota2,Positive,a bit late but I finally got master animal on my best hero redd.it / j4otzm,neutral
2802,Dota2,Positive,"a bit late, but I finally got a master class on my best hero redd.it / j4m",neutral
2802,Dota2,Positive,a bit while but I finally got master tier on my best hero photos.it/j4otzm,joy
2802,Dota2,Positive,a bit got late but I finally got master... tier status on my best hero with redd. it / j4otzm,neutral
2802,Dota2,Positive,a bit late but I finally got proper tier on my little friend redd.it/j4otzm,neutral
2803,Dota2,Neutral,Winning a game vs a divine meepo player .,joy
2803,Dota2,Neutral,Win a game against a divine meepo player.,joy
2803,Dota2,Neutral,Winning the game against the divine player.,joy
2803,Dota2,Neutral,Winning a game vs a divine good player.,joy
2803,Dota2,Neutral,Winning a game vs a simple divine opponent meepo player.,joy
2803,Dota2,Neutral,Winning a game vs a rival meepo player.,joy
2805,Dota2,Positive,C × AL LEAGUE AND B DOTA IN CINEMATICS BACK TO BACK NO IM EATING THE SO GOOD,neutral
2806,Dota2,Positive,"Aight, where can i get those item in this god damn life bruh? I only want to have a motherfucking cour",anger
2806,Dota2,Positive,"Aight, where can i get these articles in this goddamn life bruh? I just want to have a motherfucking cour",anger
2806,Dota2,Positive,"Aight, where can i get those item in this god damn life bruh? I only want to have a motherfucking cour",anger
2806,Dota2,Positive,"Aight, where can i go those item in this god damn life bruh? I only want to have 1 motherfucking cour",anger
2806,Dota2,Positive,"Shit Aight, where ever can we i get those item in this god damn fucking life bruh? I sure only want to have a motherfucking cour",anger
2806,Dota2,Positive,"Aight, where can i get those item in this one<unk> life bruh? I may want to earn a motherfucking cour",anger
2808,Dota2,Neutral,The OGA Dota PIT Season 3: Europe/CIS looks like it is going to be one heck of a tournament with some of the best teams in Europe competing in it.. .  . . afkgaming.com/articles/dota2…,surprise
2808,Dota2,Neutral,The OGA Dota PIT Season 3: Europe / CIS looks like it will be a heck of a tournament featuring some of the best teams in Europe..... afkgaming.com / articles / dota2...,surprise
2808,Dota2,Neutral,The OGA Dota PIT Season 3: Europe / CIS looks like it is going to be one heck of a tournament with some of the best teams in Europe competing in it..... afkgaming.com / articles / dota2...,neutral
2808,Dota2,Neutral,The OGA Dota 2 Season 3: Europe/CIS feels like it is going to be one heck of a tournament with some of amongst best teams on action competing in it... .. afkgaming.com/articles/dota2…,neutral
2808,Dota2,Neutral,The OGA Dota PIT Season Series 3 : West Europe / CIS looks about like it is going for to be one whole heck of a local tournament with about some of the four best teams based in Europe competing in it..... afkgaming. com / articles / conference dota2 …,neutral
